ID;Source;Creation Date;Content;Sentiment
16200007;HackerNews;2018-01-21;Title:The Death of Microservice Madness in 2018, Content: http://www.dwmkerr.com/the-death-of-microservice-madness-in-2018/;0

16238424;HackerNews;2018-01-26;but how is the data shared? e.g. when you sign up you store your data. but to edit it or to just display it you need to access it again but that data only belongs to the signup microservice...?;0
16218767;HackerNews;2018-01-24;it's fascinating to me that people don't point out that you can get many of the benefits of microservices with all your code in a monolith indeed all in a single runtime. of the 4 benefits he lists 1 independent development 2 independent deployment 3 independent scalability 4 reusability you can mostly get 24 by deploying your monolith to different server pools that are deployed and routed to independently.microservices get to be necessary for large dev teams but probably a lot later than most teams think.;0
16216223;HackerNews;2018-01-23;i'm well aware of that. this type of coordination is much easier than producing a new build in a complex corporate environment. the delivery of microservice is limited in most cases to the change in environment inventory file and integration testing. the delivery of the build requires source code management you'll need to push the dependency change in the right branch probably full application sqa cycle to make sure there's no side effects e.g. due to transitive dependency update and only then deployment and integration testing.;0
16210898;HackerNews;2018-01-23;my experience in attempting to build a monolithand oh i triedwas that it's basically impossible.forget embedding elasticsearch for the purpose of running it inside your monlith just the transport layer drivers supposing you're not using drivers that work over http basically add all of elasticsearch onto your classpath. good luck building your monolith after that. and that's true for so many things you'd want to use. if you want to build a monolith you basically can't have any dependencies. or be very experienced in dependency management.this is why i have a microservice that fronts all my elasticsearch queries. its artifact has the elasticsearch drivers all other microservices that need access data from elasticsearch talk to this service over grpc. any time i want to upgrade elasticsearch or change something about a query i only need to do it in one spot. it's great.;0
16210226;HackerNews;2018-01-23;i'm gonna just be honest here and say that i don't really know the difference between microservices and serviceoriented architecture except for the notion that microservices implies breaking up your services before they get too big and hairy which kind of seems obvious.the impression i get and this could be totally wrong is that the difference is how the services relate to each other.in this post's example 5 of the 6 microservices look like something that would be exposed to the user in some way. i would call this a microservice architecture they're networked together in a way where no one thing orchestrates the others. they likely all touch the same data storage but the overall structure is mostly flat.in a serviceoriented architecture there'd be a treelike or graphlike hierarchy. to an end user it would look monolithic but the monolith would behind the scenes delegate to the userfacing services such as upload and download. upload and download would then use the transcode service as appropriate. but the important part is that this would all be one way transcode isn't allowed to contact upload or download just return the result to whatever called it.;0
16208347;HackerNews;2018-01-22;completely agree.i mostly tell my people we aren't going to do that yet or possibly ever but keep in mind that we might have to if we ever win the user growth hockeystick graph lottery so when choosing between options of how to architect things prefer very narrow focus that could be pulled apart into microservices more easily if practicali've also been known to stand up duplicated instances on a monolith with path routing on the load balancer as a pretend microservices scaling or upgrade trick.;0
16207467;HackerNews;2018-01-22;i'm gonna just be honest here and say that i don't really know the difference between microservices and serviceoriented architecture except for the notion that microservices implies breaking up your services before they get too big and hairy which kind of seems obvious.if some companies go completely nuts and deploy 5 microservices per developer then yes that is madness. if all of those microservices are restjson microservices that's madness squared because you're wasting half your time in serializationdeserialization. if you're managing all of this stuff with kubernetes because it's trendy rather than because it's actually necessary for your use case then you're probably making a bad call.but ultimately services give development teams ownership over features in a complete endtoend way that is fundamentally impossible with monoliths once you're past a certain size.;0
16207257;HackerNews;2018-01-22;i get both why people downvoted you and why people defended you.one developer can certainly be responsible for coding many microservices and even maintaining them depending on the scope number of users etc.sometimes people might even rotate with a core architect coordinating how they all interact and if they are consistent with each other.discussing about microservices can be very confusing if people are thinking about different things and as always when there's a good idea implemented in a specific context and people who don't use it get exposed to it as a silver bullet we'll end up with a huge backlash like in this article.;0
16206635;HackerNews;2018-01-22;also there is a nice place ibetweeni microservices and a monolith;0
16206099;HackerNews;2018-01-22;message queues streaming services specialized dbs etc have no intrinsic properties making them cloudprovider capabilities.all of these cloudprovider capabilities are just normal software that you can run on your own hardware. in one or two cases the software was first exposed via a particular provider's platform but similar and very likely superior software that accomplishes the same goals is now available for selfhosting dynamo cassandra or riak for example. that's about as strong as the connection gets.it doesn't follow that microservices and cloudnative apps hang together because the cloud provider charges you a lot of money to access their redis server when you could run your own redis server.;0
16205344;HackerNews;2018-01-22;it's the ensuring that the library got everywhere it needed to go and that the new release of the other users of that library didn't introduce any bugs.and guess what you have to do the same thing with microservices. you must ensure that all its clients are pointing to the correct version and you must ensure that the new version didn't add any bugs in the clients.adaptations for new service versions will also get into the release queue and can also get blocked by other stuff.;0
16204697;HackerNews;2018-01-22;i don't think microservices are loved by developers so much because they are technically superior but because they allow for quickersafer decisionmaking on management level just like agile development imho only helps traineedevs but shines in providing clear communication strategies between management and developers read keeps mgmt off dev's back for at leat 6h a day.abstractly spoken i don't care whether you call fx directly via ipc rpc or as a microservice. in my preferred programming languages there is not much of a difference anyway.;0
16204692;HackerNews;2018-01-22;appears to be hip to bash microservices now. we have some very clear reasons that keep us on the service oriented path. scaling based on very disparate resource requirements across our api security isolation of critical backend infrastructure language requirements and dependency management accommodating different skills and groups of skills across our organization;0
16204520;HackerNews;2018-01-22;that's harder scheduling not easier. with a monolith you just give it all the resources and threads will use resources as is necessary. after that it's a matter of load balancing appropriately.the key was with bin packing. if you just give it all the resources then you're not bin packing and you're barely scheduling. at that point your scheduler is only capable of scheduling based on cpu and io usage and not for example based on ram. that last one is tricky because most runtime environments won't return memory to the operating system e.g. free won't munmap and we're currently in the middle of a ram shortage. your machines will almost always have a different shape from your processes it's just something you have to live with.a bin packing scheduler is not useful for all companies and all services. it depends on the size of your resource footprint with very large services benefiting the most.so microservices give you better scheduling in the sense that you can use fewer machines to run the same set of services. however this is not important to everyone.this stuff is built into e.g. kubernetes so it is actually quite easy. you just can't do it with monoliths.;0
16204518;HackerNews;2018-01-22;that's absolutely true but it's not specific to microservices. the pendulum could very well swing back the other wayi've come to view microservices in the context of conway's law. if you have a team of developers working on a project who don't like to communicate or work with each other do not understand version control and all have different programming styles and technology choices the only feasible architecture is one service per person.i have no trouble believing that this is what's really behind netflix's adoption of microservices. from what i've heard it's a sociopathogenic work culture and if i worked there i would probably want to just disappear from everybody too.;0
16204338;HackerNews;2018-01-22;all software is modular whether those modules are individual functions or separate processes called over the network. like i said the computer doesn't care so it's really up to the dev team and organization to divide functionality as they see fit.there's no inherent infinite scale that magically shows up proper architecture and design does that. microservices again just goes back to being a rather badly defined description of a certain way of deployment. every time i've seen these used in smaller companies there's no benefit over just having separate assemblies talking in the same process instead.;0
16204337;HackerNews;2018-01-22;better scheduling. a service made of microservices is easier to schedule using bin packing. low priority components can be deprioritized by the scheduler very easily. this is important for services with large resource footprints.that's harder scheduling not easier. with a monolith you just give it all the resources and threads will use resources as is necessary. after that it's a matter of load balancing appropriately.;0
16204210;HackerNews;2018-01-22;i've been working on a number of microservice projects and have found them to at times be wonderful at times frustrating. all in all i think it's just a case of ymmv that with or without can be fine as long as the decision making is sane;0
16204164;HackerNews;2018-01-22;yep there is no real one size fits all to microservices;0
16204044;HackerNews;2018-01-22;yes i agree. my concern is more that microservices as a subcategory of soa are a fad that few people will care about or use 1020 years from now. most services probably don't ever go beyond monolith the rest move to soa and probably a minuscule minority actually needs microservices.;0
16203979;HackerNews;2018-01-22;you icouldi. in this particular case if memory serves we had an existing set of endpoints functioning but people deemed it in need of rewrite to node because 'microservice'. instead of putting the code we had behind proxy then migrating we had to start over. because 'scale' and 'microservice'. and 'lambda'.also the same team spent several hours in meetings deciding whether or not to allow email signup or facebook signup or both or neither in the mobile app. then had the same discussionsarguments a few weeks later when a couple new people joined the team.i realize i sound a bit bitter. i got pushback because i'd used the 'microservice api' in a we don't like that language. consuming the api which i'd understood to be part of the reason of having a central api vs just hitting db tables directly by anything that wasn't also node was outside the groupthink and caused problems.i left the project.they've got their microservice architecture but no userbase yet? to be concerned about scaling issues.i understand it's reasonable to be concerned about potential scaling problems the teamproject spent far too much time chasing architectural perfection and really... 'shiny new stuff' vs executing a marketing plan. it's easier for a group that is techfolkheavy to focus on that i get it. but it didn't solve any problems at hand. but when the mythical 2 million users in an hour problem happens it'll probably hold up unless it doesn't.;0
16203834;HackerNews;2018-01-22;services consuming other services sounds like recipe for spaghetti.can we extend that logic to classes or interfaces? accessing data operations through a wellestablished api is generally seen as a good thing and is the exact cure for spaghetti...service apis also entail load balancing and decoupled deployments so they eliminate unclear architecture that arises at the app level when trying to tune the whole for individual components. particularly when a shared component exist across multiple systems.for a generalized microservices architecture layering is a bit of a misnomer as everything is loosely in the same 'service' layer... i'd also point out that in ntiered applications application services or domain services calling other services at the same layer is seen as the solely approved channel for reuse not an antipattern.;0
16203818;HackerNews;2018-01-22;you'd be surprised. with a microservice you still need to coordinate the release with other consumers of it.;0
16203787;HackerNews;2018-01-22;idk if azure functions count or notazure functions are technically a serverless product but using them as y'all intended to is a textbook definition of a microservice;0
16203776;HackerNews;2018-01-22;microservice architectures are a subcategory of soa.many of the same reasons to use them apply to both but with a finer granularity on what is being hosted where and how it is scaling with microservices. scaling a service with multiple facets going through it gets tricky hence a desire for a more appropriate modularity.placing services in the cloud kinda papers over why microservices and cloudnative apps hang together so tightly... leveraging cloudprovider capabilities message queues streaming services specialized dbs etc often introduces new kinds of scaling new requirements and new deployment needs at the icomponent leveli. particularly if you're working in multiple clouds or a hybrid environment or with teams in different organizations... tech stacks might diverge at the component level developer competencies diverge maintenance routines and monitoring and the rest of it too.a thin service wrapper in front of dynamodb is gonna have a different scalability story than a doitall service on a vm that can also write to dynamodb. especially if the service is used by multiple apps or customers in addition to apps. for a saas outfit that can be make or break.;0
16203745;HackerNews;2018-01-22;sounds like they don't understand why it's called a microservice to begin with. they're not supposed to be solutions an entire piece of software just dedicated bits at least that's what i'd figure with a name such as micro. when we adopted microservices at my job idk if azure functions count or not we did it because we had 1 task we needed taken out of our main application for performance concerns iandi because we knew it would involve way more work to implement .net framework codebase being ported to .net core which meant the dependencies from .net framework did not work anymore in .net core but we eventually turned it into a webapi instead due to limitations of azure functions for what we wanted to do process imagery of sorts.;0
16203704;HackerNews;2018-01-22;hey daveno problem. there was a ton of good stuff in there! i saved it to refer back to it later. as a tech coach i teach good programming skills which mostly ends up being tdd and other good coding skills for oop folks. but i've become a huge pure fp fan over the past decade learning it all on my own just by struggling through it.so as a coach i'm seeing more and more of these microservice train wrecks. i'm also seeing a ton of people who don't understand microservices come online and bitch about how they don't work.wlaschin's book goes into building a pure fp system from the topdown something i never considered doing i've never coached or worked in a large pure fp shop. of course if you build it out that way it really doesn't matter how you splice up the code or where it goes. you can do monolith serverless microservices whatever.i liked the process described in the book a lot. it describes to me how you can have 50 people and 100 microservices and make it all work. although everything you point out is still an issue many of the pure fp techniques mitigate them. feels a lot like bduf though which kinda bugs me.i sat down with uncle bob last month and spend a week showing him f. tdd didn't seem to work that well but maybe i missed it. there's just nothing to test in simple transforms and you want to keep using simple transforms as much as you can. i think we need to evolve a tddlike process for growing systems in pure fp from the groundup. i'll probably cogitate on this for a few years and end up writing something. if you know of any good resources please send them my way!;0
16203693;HackerNews;2018-01-22;if that was the case then it wouldn't be anything specific to microservices.;0
16203688;HackerNews;2018-01-22;it's not the number of people that are micro it's the scope of the service... so what is the right level of manpower for a scoped service with unspecified operational demands? unknowable.the definition isn't small teams per se it's a small area of responsibility with singular focus. a lego block instead of duplo. that lends itself very well to small teams but you could reasonably have 100 people working on a service and call it micro.reason being if those 100 people weren't working on their scoped 'microservice' they would be part of a much much much larger pool working on the shared 'product' 'platform' or 'service' that contains that exact same functionality only without the clarityscalability of application boundaries surrounding the individual service components.that's not to say microservices are ideal just that the size of micro is highly relative to ongoing operations.;0
16203664;HackerNews;2018-01-22;i don't think you should always go with a microservice approach first but you should always separate different domainsfeatures into well defined modulesprojects even within a monolith.there have been plenty of times where i've taken a project out of a monolith and created a separate shippable package to be consumed by another monolith in a separate repo.there were also occasions where i had to rip out a feature in a monolithic api that either needed to scale independently or be released independently and then just created a facade in the originally api that proxies the microservice.;0
16203645;HackerNews;2018-01-22;micro in this case relates to the services iscopei not its operational footprint.so if netflix has a user logon service and a payment processing service used across their clients clients you might be looking at a couple of microservices with ihundredsi of related employees. imagine services for googles search autocomplete ml or analytics...as the article states the micro aspect is mostly in terms of deployment responsibility freeing those 101000 employees from thinking about the totality of googlesnetflixes' operations before rolling out a patch;0
16203619;HackerNews;2018-01-22;those growth points and their associated market knowledge and budgetary constraints would become perfect transition points into a friendlier architecture for the team... plan for change moreso than trying to plan against change.decomposing and fragmenting an established service into smaller clones of itself should be reasonably straightforward. in most languages with a component story ie java library reuse across microservices should make your service architecture orthogonal to your application logic. this kind of approach also eases a lot of pain of crossservice issues.;0
16203597;HackerNews;2018-01-22;it has nothing to do with the resilience of cloud providers. if the cloud providers were resilient then you wouldn't need all of the wonderful scheduling tooling from stuff like kubernetes to deal with unstable individual machines. you can also certainly have a microservice architecture without running anything on the cloud at all.microservices make it possible to simply deal with unstable environments. cattle not pets.;0
16203574;HackerNews;2018-01-22;i'm the dev lead for a largish company with a small development shop 49 people contractors come and go. i went for a microservice like hub and spoke model where a bunch of small services integrate with a central mongo database where all of the crud is managed via an api and validation is done via the api. also cross cutting concerns like configuration a wrapper around consul logging structured logging via serilog and job scheduling nomad is done via a common package.i chose this approach because the developers who were already there were relatively new to c and i knew we were going to have to ramp up contractors relatively fast.our dev ops process revolves around creating build and release processes by simply cloning an existing build and release pipeline in visual studio team services the hosted version of team foundation services and changing a variable. every service is a separate repo. each dev is responsible for releasing their own service.the advantages1. all green field development for a new dev. they always start with an empty repo when creating a new service.2. maintenance is easier. you know going in all you have to do is use a few documented postman calls to run your program if you need to make changes. also it's easy to see what the program does and if you make a mistake it doesn't affect too many other people if you keep the interface the same.3. the release process is fast. once we get the necessary approvals we can log on to vsts from anywhere and press a button.4. bad code doesn't infest the entire system. the permanent junior employees are getting better by the month and we are all learning what works and doesn't work as we build out the system. each service is taking our lessons learned into account. we aren't forced to keep living with bad decisions we made earlier and building on top of it.a microservice strategy only works if you have the support system around it.in our case an easy to use continuous integration continuous deployment system vsts easy configuration consul service discovery and recovery consul with watches automated unit and integration tests a method to standardize cross cutting concernsand finally hashicorp's nomad has been a god send for orchestration. our services are really just a bunch of apps. nomad works with shell scripts batch files docker containers and raw executables. it was much easier to set up and configure than kubernetes.;0
16203521;HackerNews;2018-01-22;crossbar.io is currently an interesting approach imo.it does have a single point of failure that is also a bottleneck the router and it's a lot of work to load balance failover it.but other than that it provides a fantastic way to make microservices anything is a client of the crossbar router. your server code is a client. the db can be a client. the web page js code is a client. and they all talk to each others. a client can expose any function to be called remotely by giving it a name. another client can call this function by simply providing the name. clients don't need to know each others. routed rpc completly decoupled the clients from each others. a client can subscribe to a topic at any time and be notified when anothe client publishes a message on that topic. quick easy and powerful pubsub with wildcard. a client can be written in js node and browser python c java php etc. clients from other languages can talk to each others transparently. they all just receive jsonmsgpackwhatever and error are propagated and turn into the native language error handling mechanisme transparently. the api is pretty simple. if you tried soap or corba before this is way way way simpler. it feels more like using redis. it uses websockets which mean it works anywhere http works. including a web page or behind a nat or with tls. everything is async. the router handles 6000 msg s to 1000 clients on a small raspberry pi. the router can act as a process manager and even a static wsgi web server. you can load balance any clients hot swap them ban them get meta event about the whole system etc. you can asign clients permissions authentications etc. sessions are attached to each connexion so clients knows what other clients can do.;0
16203474;HackerNews;2018-01-22;you don't need microservices to fix that you need ci and maybe some release processes for your libraries.there will come a point where you can't scale a monolith sure but that point is thousands rather than hundreds of engineers.;0
