ID;Source;Creation Date;Content;Sentiment
16200611;HackerNews;2018-01-22;a microservice should generally not have side effects.that's plainly wrong. i get the gist of what you are saying and i more or less agree with it but you expressed it poorly.having api dependencies is not an issue. as long as the microservices don't touch each others data and only communicate with each other through their api boundaries microservices can and should build on top of each other.in fact that's one of the core promises of the open source microservices architecture we are building .i think your bad experiences are due to microservice apps which are unnecessarily fragmented into a lot of services. sometimes even when you respect service boundaries that can be a problem when you have to release a bunch of services to ship a feature that's a sign that you have a distributed monolith on your hands.i like to think of services even my services as third party ones i can't touch. when i view them this way the urge to tailor them to the current feature i'm hacking on lessens and i identify the correct microservice the given modification belongs to easier.;0
16200588;HackerNews;2018-01-21;in proper microservices architecture only a single application access the db. other apps get the data via an api call. thus you can drop the column maybe it's derived data and still keep the api interface.in the end it's mostly about enforcing contracts and making devops simpler.;0
16200541;HackerNews;2018-01-21;that's not a pure microservices approach since you are sharing state the database. it means that any development which changes or is impacted by a change in the db has to be coordinated between teams.the microservice approach is to have each service have its own database mysql or schema postgresql.another solution is the use of a modular architecture where separate modules are each responsible for their database tables' schema. tables are not shared across modules accessing data from a table requires calling its module's api.each module can be developed independently and combined into one large service or several smaller services. it's helpful to be able to separate modules into their own service for load balancing and optimization while having all modules in the same service eases administration of the system.from previous experience you start by lumping all modules together then use monitoring software i.e. elk stack collectdgrafana you decide where to split into services. because the reality is you'll not really know where to split until you are running in production.this is the approach of django for example and works quite well for large projects.;0
16200497;HackerNews;2018-01-21;once when starting a new gig i inherited a microservices architecture.they were having performance problems and needed to migrate to microservices. they developed 12 seperate applications all in the same repo deployed independently it's own jvm. of course if you were using microservices you needed docker as well so they had also developed a giant docker container containing all 12 microservices which they deployed to a single host all managed by supervisord. of course since they had 12 different jvm applications the services needed a host with at least 9gib of ram so they used a larger instance. everything was provisioned manually by the way because there was no service discovery or container orchestration just a docker container running on a host an upgrade from running the production processes in a tmux instance. what they really had was a giant monolithic application with a complicated deployment process and an insane jvm overhead.moving to the larger instance likely solved the performance issues. in place they now had multiple over provisioned instances for ha and combined with other questionable decisions were paying 100kyear for a web backend that did no more than 50 requestsminute at peak. but hey at least they were doing real devops like netflix.for me i've become a bit more aware of cargo cult development. i can't say i'm completely immune to cargo cult driven development either i once rewrote an entire angular application in react because angular is dead so it really opened my eyes how i could also implement solutions without truly understanding why they are useful.;0
16200492;HackerNews;2018-01-21;by most definitions of microservices i've heard there's a 1many relationship between microservicesdatastores. multiple microservices can't talk to the same database. for example while monolithic applications prefer a single logical database for persistant data enterprises often prefer a single database across a range of applications... microservices prefer letting each service manage its own database either different instances of the same database technology or entirely different database systems not to say that pattern can't be successfully implemented just that it wouldn't be considered microservices. it sounds like you're describing a threetier architecture;0
16200488;HackerNews;2018-01-21;a microservice imo should just be a simple black box that takes in some input and returns some output sometimes asynchronously. no sideeffects necessary. no fiddling with database flags or global state and definitely no hitting iotheri microservices. see cryologic's post for a good example. this means that you simply ican'ti build some things using microservices like logging in a user and you'd be right.;0
16200484;HackerNews;2018-01-21;at the very least each service should own its area of concern which means only one application should ieveri write to the underlying structures and those structures should support that application alone. what happens if you have an app that needs a certain setting on the database but you can't restart to make it effective because 9 other apps are using the same db?it's hard enough to coordinate this kind of maintenance when there is only one oltpstyle user of the database. if you get a lot of interdependent units where app a needs to read table b and app c needs to write to table d it's nigh impossible to do it without global downtime.microservices require a large amount of control and discipline to implement properly. in almost all cases a straightup monolith ends up being much saner. microservices are often seen as a license to run hog wild and disregard everything outside of one's immediate area of concern team. this is convenient at the time because of conway's law but it is terrible for longterm maintenance overall consistency and employee sanity.;0
16200452;HackerNews;2018-01-21;a microservice should generally not have side effectsi gotta ask how is this realistic? a salient feature of most of the software i've worked on is that it has useful side effects.;0
16200439;HackerNews;2018-01-21;if multiple services are coupled to the same database schema then any changes to the schema must be coordinated between all services so you've got something of a distributed monolith instead of a set of independent microservices.this might be fine and maybe it could even be a good choice in your situation but i would probably avoid the added complexity.;0
16200423;HackerNews;2018-01-21;shared mysql dbthis is already a smell. usually microservices don't need to access global state.;0
16200419;HackerNews;2018-01-21;biggest issue with microservices microservices can be monoliths in disguise i'd omit the icani and say i99 of the time arei.it's not a microservice if you have api dependencies. it's probably not a microservice if you access a global data store. a microservice should generally inoti have side effects. microservices are supposed to be great not just because of the ease of deployment but it's also supposed to make debugging easier. if you can't debug ionei and only one microservice at a time then it's not really a microservice.a lot of engineers think that just having a bunch of api endpoints written by different teams is a microservice architecture but they could't be more wrong.;0
16200417;HackerNews;2018-01-21;i think that sounds like a bad idea. i could see pain arising from the shared usage of the database e.g. during migrations or heavy usage. i'm not really sure what the benefit is either each team will likely want to be the owner of their own database anyway.if you're talking about the separate microservices using the same tables in the database that's probably an even worse idea. either your services are way too tightly coupled or shouldn't have been split into separate services in the first place.;0
16200415;HackerNews;2018-01-21;agree with the author that microservices are harder to operate in certain aspects. for example latency tracing with microservices is harder when you have many services to check latency through what service call caused the latency. doing error tracing with microservices is also harder because now you have to follow a web request through many different microservices. microservices in some cases may have worse performance than a monolith. with microservices data no longer does in local memory or local cache you have to traverse the network through an api calls to fetch data. imagine that you have a monolith that can look up data in a hash table that is one memorycache access versus a micro service network call. in the micro service you have to make a network call for a memory lookup. a memory access may take between 0.5ns100ns versus a network call may take 10000ns. that microservices may be between 20000 times to a 100 times slower accessing remote memory in another microservice than accessing it locally in the same monoliths memory. thus one could argue that in some cases performance are worse with microservices than a monolith. you can still scale stateless monoliths buy putting a load balancer in front of the monolith. there is also increased overhead of running microservices instead of having one java processnodejs process for a monolith you may have several hundred nodejs processes microservices running in docker containers. each nodejs process takes memory for nodejs itself. an important aspect of microservices which are good is that they allow a part of the system to be restarted independently instead of restarting a whole monolith. . sometimes you may want to rewrite a component that is also much easier to rewrite with micro services. compare a mainframe from the 60s80s running a monotlith without unit testing integration testing versus modern micro services with testing. replacing parts or the whole main frame monolith will be very very scary.latency numbers every programmer should know however i would argue microservices has been done before the idea is not new. microservices is a realization of the same principle as that of unixlinux. this is called the unix philosophy write one program that do one thing well. make the output of one program the input of the other one.microservices are not a new idea its the reimplementation of the unix philosophy for the web.the unix philosophy make each program do one thing well. to do a new job build afresh rather than complicate old programs by adding new features. compare with microservice definition by wikipedia the services are small finegrained to perform a single function.improving reliaility with recursive reboots microservices on kubernetes are at least implementing micro reboots in case of component failure. like most tech micro services probably follow the hype cycle;0
16200412;HackerNews;2018-01-21;that sounds like the integration database pattern and it's generally not considered serviceoriented of which microservices is a subset.;0
16200390;HackerNews;2018-01-21;i have recently been thinking about doing microservices by simply having a shared mysql db that all modules connect to.so for example one developer can create the backend and one developer can create the frontend. the codebases can be completely independent. one could use phplaravel and the other one phpsymfony for example.frontend and backend would live on their own servers. and simply having the ip login and pw of the shared db set in their project.what do you guys think about such an approach?;0
16200375;HackerNews;2018-01-21;best use i've found for microservices is highly isolated and welldefined stateless functions which make a significant read compute intense change to some data and drop it somewhere else e.g. image compression.now you can use this microservice anywhere and just change a few params in how you call it and you have avatars thumbnails etc.;0
16200325;HackerNews;2018-01-21;this is the 9th time it's been posted;0
16200269;HackerNews;2018-01-21;broadly speaking microservices make small limited changesupdate less complex and large sweeping changesupdates more complex.this is why generalizations like larger established organizations which make mostly relative small changes should lean more to microservices than smaller younger organizations which make mostly relatively large changes hold true.;0
