ID;Source;Creation Date;Content;Sentiment
16201493;HackerNews;2018-01-22;background ive been on good and bad projects that used microservices and good and bad monolithic projects.the madness is going away but the microservices are staying. there are some rationales for microservices that are conspicuously missing.1. fault isolation. transcoder stuck in a crash loop? upload service using too much ram? with microservices you don't even really have to figure out what's going on you can often just roll back the affected component.2. data isolation. only certain privileged components can access certain types of data. using a separate service for handling authentication is the classic example.3. better scheduling. a service made of microservices is easier to schedule using bin packing. low priority components can be deprioritized by the scheduler very easily. this is important for services with large resource footprints.the criticisms remind me of the problems with objectoriented programming. in some sense the transition is similar objects are selfcontained code and data with references to other objects. the 90s saw an explosion of bad oo design and cargo cult architectures. it wasn't a problem with oo design itself. eventually people figured out how to do it well. you don't have to make everything an object any more than you have to make everything a microservice.;0
16201475;HackerNews;2018-01-22;that is nice in theory and i agree it should be done wherever possible but lot of the time business logic will require immediate synchronous response to be returned as a next step in workflow will execute different branch of logic based on conditionresult returned from previous microservice and the frontend consumer app will need immediate confirmation about whether action succeeded.even in such cases you might want to move bulk of processing to asynchronous queue based system but part of the logic might need to be executed synchronously authorise credit card payment you can process the payment asynchronously later perhaps in bulk cron jobs like apple itunes does it but initial authorisation which decides whether purchase is successful must be synchronous.;0
16201474;HackerNews;2018-01-22;well a library deploying it into its own space so that it doesn't bring down your main app due to compute time.the operational part of microservices can end up being pretty important in these cases;0
16201467;HackerNews;2018-01-22;but that is ridiculous. fiddling with database flags is silly i agree but inserting and updating database is a completely normal side effect of most business logic. so if your microservice handles any kind of ordinary feature of your business solution it will almost definitely have side effects because it will write to database. there might be services which just do some computation in memory and return result to you but i think those will be a small minority most of your services dealing with features such as payment subscriptions identity etc just some examples will have useful side effects.;0
16201451;HackerNews;2018-01-22;do you legit think that people are all just doing this as a fad?there's legitimate arguments for looking at these patterns the big one being isolation of concerns. the biggest counterargument is that the ops cost is much higher than assumed of course.the idea that the existing code base could have problems shouldn't be a surprise to anyone. amazon almost fell over because of their code base. twitter too. and its not even not doing it right but simply that scales change. or patterns change.and in new companies it could be that people don't get it.microservices as mass delusion discounts a lot of people who are really thinking hard about how to handle the pros and the cons of things.;0
16201442;HackerNews;2018-01-22;this i can entirely agree with framing my point around conway's law works well and i think i can reframe my question as is the expression of conway's law a management failure or is it the misstructuring of the organization causing the expression to be harmful?the parent post i was replying to seemed to simplify things down to let your developers communicate and they'll build a more coupled system that works instead of a morass of microservices that don't. that's another thing that looks good on paper but doesn't scale at least in my experience.;0
16201375;HackerNews;2018-01-22;those of us who have been around since the 80s90s are astonished by the low productivity of today's programmers.if it takes 1 person to run 1 microservice we are all doomed.;0
16201353;HackerNews;2018-01-22;they were having performance problems and needed to migrate to microservices. they developed 12 seperate applications all in the same repo deployed independently it's own jvm.9 times out of 10 it's because developers don't know how to properly design and index the underlying rdbms. i've noticed there is a severe lack of knowledge of that for the average developer.;0
16201333;HackerNews;2018-01-22;i think another important cause of microservice is politicswhen every department wants the easiest job with max outcome and the boss decides to split the cake equally then an easy job x can be cut into n services which are usually named micro resulting in a huge project of complexity xnn for each team.;0
16201318;HackerNews;2018-01-22;microservice architectures usually represent a management failure because they usually don't work well in the real world. it's easy to concoct a paperonly theoretical version of an idealized microservice architecture since you can gloss over all the realworld details and practicalities. mapping that theory into the real physical world is a whole different ball game.conway's law might as well be renamed the law of microservices. per wikipedia 0 it states organizations which design systems ... are constrained to produce designs which are copies of the communication structures of these organizations.microservices are on a tear because they make a perfect cover for the blatant and bare expression of unbridled conway's law.such unbridled expression is much easier in the course of greenfield development because it lets the core team of 23 people per service go about their development work without consulting anyone external. it lets them throw away any overriding convention or cultural concerns and it avoids the difficulties of crossgroup coordination. but it leads to a completely unmaintainable wreck when things transition into production.this is not to say that ino onei will have a successful microservice deployment or that it's always a bad choice but it usually goes way off the rails.0;0
16201295;HackerNews;2018-01-22;microservices as a mechanism for mainly code organization are just a bad idea. build a wellorganized monolith first structure your code as inprocess services so that you can factor those pieces out individually in the future.i see smaller teams heaping in tons of complexity for no real gain and actual measurable cost.;0
16201276;HackerNews;2018-01-22;i found out recently that people too often think about microservices in context of broader solution like it would be one app just scattered around. i did that mistake in the past either. the longer i work with microservices the clearer it is to me that teams implementing them should forget about the big product just focus on the service as it would be product itself. assume that anyone can use it for any purpose they like as long as they stick to the contract that is and you'll be fine.i tend to have two layers of design now. one big picture which treats services anonymously. just black boxes that respond to input. the goal here is to build solution like kids are building stuff from building blocks.other layer depicts services as separate beings. they treat all their clients anonymously. they have a contract to fulfill and whomever plays by the rules can be served all right. they should be treated as completely separate projects have their own backlog release strategies etc.now if you would have a product that utilize certain data would you allow some anonymous guy from the internet tap to it directly? no need to answer i guess.edit typo;0
16201253;HackerNews;2018-01-22;the monolith first approach has always served me well. nascent projects benefit from portability because they need higher amounts of flux. as they mature let's assume they grow in scale and integrations and somewhere along the line it becomes sensible to break off pieces into services.to me the big benefit of microservices is scaling out components into flexible independent release cadences but the trouble comes with employing them too early.;0
16201220;HackerNews;2018-01-22;putting the i back in microservices;0
16201211;HackerNews;2018-01-22;the key to microservices is a framework and tooling around them to make them work for you. release management authnauthz compilation composition service lookup etc. should all be outofthebox before microservices should ever be considered. otherwise the on gains you get in modularity turn into on fml.;0
16201194;HackerNews;2018-01-22;i prefer that the advice not to be dogmatic about saying no but rather to be wary of the costs. the big benefit of microservices is being able to easily reason about or scale services but adding dependencies usually sacrifices those benefits. ive seen that done poorly in the various iterations of this cycle and the worst failure modes mean that debugging requires you to understand how to get amp interpret state from many locations making even simple problems challenging.that might mean that you still take that cost willingly but engineer in the extra tooling to make things easier to manage i.e. simplifying tracing load or errors across service boundaries back to the source but it might also be a cue for you raise to reconsider whether the service divisions are in the right place or whether all of the services are appropriately sized. if you find yourself needed distributed transactions retries etc. thats often a good time to pause and reconsider.;0
16201150;HackerNews;2018-01-22;looks like microservices have rounded the peak of inflated expectations and heading into the trough of disillusionment;0
16201124;HackerNews;2018-01-22;why is scaling independently a pro? i've heard that argument before and never understood it.if i have one api that is low throughput and one that is high say requires 2 and 20 nodes respectively then you need 22 nodes whether they are two independent microservices or a monolith. i'd think the monolith would actually be easier to manage as you don't have to worry about how to divvy up the resources. all 22 nodes run the same code. sure you could do the same with a k8s cluster autoscaling i assume but still i don't see how this makes anything strictly easier than a monolith scaling. if anything it seems like one more thing to worry about.but i've heard the argument multiple times so wonder if i'm missing something.;0
16201122;HackerNews;2018-01-22;why was this downvoted? i think this is a valid argument. there are plenty of small teams or individuals who have been managing a bunch of small services. before this was called microservices.;0
16201094;HackerNews;2018-01-22;i'm thinking this concept improperly conflates synchronous requests with eventuallyconsistent asynchrony.no you definitely don't want microservices making synchronous requests to other microservices and depending on them that way.but it still may be necessary for your services to depend on each other and that's where you can allow that communication through asynchronous eventually consistent communication. actor communications queue submissionconsumption caching etc.;0
16201081;HackerNews;2018-01-22;in my opinion only the extremely good developers seem to comprehend that they are almost always writing what will be considered the technical debt of 5 years from now when paradigms shift again.i've also seen really bad developers with that attitude it's all crap so just ship whatever already.the good developers write code that can be replaced rewritten or rescaled later. though charitably both monolithic service and microservice people are trying to do exactly that. it's just what sort of scale they're thinking about and what part of the software development lifecycle they think will be especially difficult going forward.;0
16201067;HackerNews;2018-01-22;i tend to think that the job of invoking the services lies within a gateway. for example you can have a microservice for recipes but a web gateway that know all of the various integrations necessary to generate a page. so the web gateway is essentially a monolith.if and when you need to support mobile devices independently of your web ui you can have a mobile gateway. same idea. this gateway is optimized to know how to handle mobile traffic realities like smaller download sizes etc.;0
16201058;HackerNews;2018-01-22;well you don't want to call a processor intensive task with a library. a separate service for these types of tasks is a better architecture.although i'm not sure whether or not a task queue architecture with separate server workers executing code passed over from a central monolithic app server is still considered a microservice architecture.;0
16201042;HackerNews;2018-01-22;to put it in an even less flattening way the real problem are developers not the paradigm. your company's code will be as good as your developers are regardless of the paradigm.microservices will not help you if your developers have the same level of skill and foresight as whoever wrote the monolith which is probably true if those devs were selected by the same hiring process that your company has today subject to the same organizational effectiveness etc.;0
16201032;HackerNews;2018-01-22;is this truly a management failure?if a few things are true i could see this as a win i can isolate my developers from outside interests using microservices. my developers are more effective in each dimension quality retentionhappiness velocity because they are isolated from outside interests. my software is easier to operate and more reliable because it is a microservice.if any of these three things aren't true then i agree. but i'm not sure that a communication culture can scale to a large organization and i'd like to see a truly large company 1000 developers successfully doing so. i've seen more success come from separation of concerns and welldeployed microservices seem to be fairly effective to this end.;0
16200956;HackerNews;2018-01-22;it's not exclusive to inheritance though. there are lots of times that the original principal decides that he could have done it better and winds up in exactly the same place. it could be progress too if it trades on set of failure modes for another that is less severe or less frequent.this is why a team needs access to good architect who's seen the paradigms shift or even cycle. you're almost never starting from scratch so you really need someone who's able to incorporate better or more suitable tech without throwing out the baby.if you're microservicesbased that last part is easier even if it falls into one of the described pitfalls e.g. systemofsystems.;0
16200916;HackerNews;2018-01-22;i really think microservices are a process win not a technical win. it's easier and better to have 5 teams of 10 managing 5 services. then having one team of 50 managing a one super service.when i see a team of 7 deciding to go with microservices for a new project i know they're gonna be in for a world of unnecessary pain.;0
16200912;HackerNews;2018-01-22;at my workplace the idea is distort disparage or destroy applications and replace with spring boot thingie. voila now we have a 'next generation platform' based on microservices.;0
16200910;HackerNews;2018-01-22;why can't you build a microservice that does a handshake with an api gateway to authenticate a user? when doing microservices you have to have a sane auth strategy and that generally means you encapsulate authenticationauthorization in a service that your gateway will talk to.;0
16200908;HackerNews;2018-01-22;microservices as the m in mvc?;0
16200899;HackerNews;2018-01-22;i agree mostly. a black box can have internal state but it should not have shared state with another black box defeats the purpose calling it a black box. if two black boxes microservices shared state then we'd need to think of the composite as a single black box.if two black boxes directly contact each other then that also defeats the purpose. microservices are not appealing unless talk via message queues. the whole point of microservices was to handle scale independently for independent functions.where do you suggest storing that state if it needs to be persistent? the definition of microservices should not assume anything about how long i need to track my data. if two of your microservices are touching the same database fields then that's the implementor's mistake.;0
16200882;HackerNews;2018-01-22;great article but i'd like to dispute one point a new version of the subscriptions service may store data in the subscriptions database in a different shape. if you are running both services in parallel you are running the system with two schemas at once.microservices should manage their own separate data stores and communicate with others through a welldefined api. only then services can evolve independently and each team is free to change the internals including schema migrations without coordinating with everybody else.multiple services sharing the same database is the perfect example of the monolith in disguise antipattern mentioned in the article with all of the costs of microservices but few benefits.;0
16200867;HackerNews;2018-01-22;microservices with a share datasource are just a service oriented architecture circa 2005. you might have a variety of middle tier services deployed in their own boxes or at the very least java service containers but ultimately talking to some giant oracle db behind it. microservices that share a database are not deployed into a container running jboss and instead use something more languageagnostic but it's ultimately the same thing. all you have to do is e the many criticisms of that era when any significant db change was either impossible or required dozens of teams to change things in unison.the best imagery i know for this picture is a twoheaded ogre. it might have multiple heads but one digestive system. doesn't matter which head is doing the eating ultimately you have the same shit. i've head semi famous people talk about this in conferences but few articles.;0
16200843;HackerNews;2018-01-22;im confused. if a microservice doesnt call the api of any other microservices then when is sending the requests to any of them?a large purpose of service oriented architecture is encapsulation. if no other microservices can make requests to your microservice then you really havent encapsulated much.;0
16200842;HackerNews;2018-01-22;i recently had a similar experience our product at work is a monolith not in the greatest shape as it has technical debt which we inherited and our product is usually used condescendingly when talking to other teams working on different products. to our surprise when we started testing it with cloud deployments it was really lightweight compared to just one of the 25 java microservices from the other teams.their microservices suffered from the same jvm overhead and to remedy this they are joining their functionalities together initially they had 3040.;0
16200801;HackerNews;2018-01-22;modifying data in a database is a side effect. since you brought up the wikipedia definition here it is in computer science a function or expression is said to have a side effect if it modifies some state outside its scope or has an observable interaction with its calling functions or the outside world besides returning a value. for example a particular function might modify a global variable or static variable modify one of its arguments raise an exception write data to a display or file read data or call other sideeffecting functions.note write data to a display or file. i think we agree that writing to a database falls under this definition hence using terms like side effecting when talking about microservices is misleading.;0
16200756;HackerNews;2018-01-22;a side effect is iby definitioni some mutation that's out of the scope of the function if the purpose of the microservice is to put stuff in a database then by definition it's not a side effect. switching a flag on top of doing some work on the other hand e.g. flip processed to true in a global database iisi a side effect.;0
16200733;HackerNews;2018-01-22;aren't you talking about pure functions more applicable to serverless than the commonly accepted use of microservices?;0
16200732;HackerNews;2018-01-22;i think it has to do with control. i've written microservices and microservices tooling now for a long time... so long when i started we were just calling it something like isolatedresponsibility soa and we didn't have a fancy buzzword.developers want to iowni their thing. microserivces desire springs up because of a lack of communication culture and desire for siloification in a companies organization to keep various interests from bothering the developers. those almost always point to a failure of management in my mind rather than a technical failure.;0
16200726;HackerNews;2018-01-22;i do have a case of monolithsindisguiseitis.i just wish someone with street cred or with a famous recognizable name i could use for appeal to authority could create a simple post saying hey if you have a shared data store that all services depend on and are accessing directly you are not doing microservices. and you also don't have microservices if you have to update everything in one go as part of a release.that way i could circulate it throughout the company and maybe get the point across. i've tried to argue unsuccessfully. after all we are doing k8s so we have microservices each is a pod duh! no you have a monolith which happens to be running as multiple containers...;0
16200710;HackerNews;2018-01-22;nice article but i'd point out two things1. 'death' is a bit too extreme. i think everybody is excited at first and tries to find an excuse to use microservices. we're assisting to a decline in that initial push that's all.2. i think the point about transactions is fair as well as the expertise and team concerns but the rest are mostly it's too hard and complex. it'll get better with time. i think that being a bit uncomfortable as a dev is not too bad that's what we're here for assuming there's a real need of course.;0
16200703;HackerNews;2018-01-22;i think microservices is so appealing because so many developers ilovei the idea of tearing down the old written 12 months ago crusty using a language they don't likeisn't in vogue and bloated using a patternmodel they don't agree with monolith and turning it into a swarm of microservices.as an infrastructure guy the pattern i've seen time and time again is developers thinking the previous generation had no idea what they were doing and they'll do it iwayi better. they usually nail the first 80 then hit a new edge case not well handled by their architecturemodel but was by the old system andor start adding swathes of new features during the rewrite.in my opinion only the extremely good developers seem to comprehend that they are almost always writing what will be considered the technical debt of 5 years from now when paradigms shift again.;0
16200689;HackerNews;2018-01-22;a microservice imo should just be a simple black box that takes in some input and returns some outputi am not quite sure what you mean. a microservice with rest api that has post method is not a microservice?;0
16200670;HackerNews;2018-01-22;will someone enlighten me as to why a microservice should have no dependent services? seems reasonable to me.;0
16200624;HackerNews;2018-01-22;that's plainly wrong. i get the gist of what you are saying and i more or less agree with it but you expressed it poorly.i'm not sure what you think side effects are but i'm using the standard computer science definition you can look up on wikipedia. if you have a microservice that modifies e.g. some hidden state it's a disaster waiting to happen. having imultiplei microservices that have database sideeffects will almost always end up with a race condition somewhere. have fun debugging that.;0
16200623;HackerNews;2018-01-22;or chaos or madness or bedlam.most people have enough trouble getting three methods in the same file to use the same argument semantics. every service is an adventure unto itself.we have a couple services that use something in the vein of graphql but some of the fields are calculated from other fields. if you have the derived field but not the source field you get garbage output iand they dont see the problem with thisi;0
