ID;Source;Creation Date;Content;Sentiment
16203459;HackerNews;2018-01-22;do you legit think that people are all just doing this as a fad?yes. that's been my experience. the idea that the existing code base could have problems shouldn't be a surprise to anyone. amazon almost fell over because of their code base. twitter too.most organisations aren't amazon. most organisations aren't twitter. and even these webscale organisations aren't as allin as the microservice advocates. i worked at last.fm for a time and while we did many things that could be classed as microservices from a certain perspective we didn't blindly microservice all the things microservices as mass delusion discounts a lot of people who are really thinking hard about how to handle the pros and the cons of things.most fads start from a core of sensible design. the web really did revolutionise commerce but many x but on the web companies of the late '90s really were dumb.;0
16203433;HackerNews;2018-01-22;here's my experience. some features are extremely good as microservices. and i wanted to use it. but i don't. why?1. setting up a microservices architecture itself is a convoluted process. if you're not a netflix or amazon that will run hundreds of microservices the upfront cost and time is not at all worth it. i would rather just run an app on digitalocean.2. if i decided to bypass step 1 and just use existing vendors like aws google microsoft etc. first i don't feel good about it because i know it's in each vendor's best interest to implement lockin which conflicts with my own interest.3. lastly none of the existing cloud function vendors have good user experience. aws lambda google cloud functions etc. all require you to go through all the authentication related stuff before running a simple function not to mention all the constraints that come with function based paradigm. again definitely not worth it unless you're trying to run hundreds of these functions.i think part 3 is critical because i was willing to ignore part 1 and 2 as long as i could get my function up and running really easily. but none of the vendors make it easy. sure there are frameworks that let you do that like apex and serverless but those also require setup. i would rather just run a digitalocean server for 5 which by the way can run multiple of those services as a regular server without me having to spend time dealing with the complexities of function servers.i thought about how this could be improved. sure there can be some heroku for functions saas but nobody is excited about building saas startups nowadays because they know they can't compete with large vendors in the very long run. unless you're comfortable with just building a lifestyle business which is totally fine but i personally won't rely on a lifestyle business saasthe only way this can be improved is if each root vendors like amazon ms and google actually implemented better ui but none of them are really focused on this since the reason they're doing this business in the first place is not for consumers but to make sure they have leverage in this space. if aws dominated 90 of this market the rest of the companies will be in a great risk in the long run;0
16203432;HackerNews;2018-01-22;while i'm not arguing with you i have had a different experience working with developers and microservices perhaps because the teams have been more seasonedexperienced and there is more of a collaborative environment.i found that a lot of the time developers start moving towards microservices when they find that a monolithic app becomes too difficult to work on. for example multiple teams working on the same codebase will often have accidental code conflicts. plus scaling a monolithic app because one part of it is under load isn't always cost effective or logical. so teams will start to break off components into microservices to make development easier and less painful. naturally this has to be weighed up as microservices bring a different set of challenges 'gotchas' etc etc but in my experience the teams have done a proper job discussing the pros and cons.;0
16203329;HackerNews;2018-01-22;it's much harder to deploy a library fix to production producing a new build of integrated app in large team is a big deal than a microservice.;0
16203310;HackerNews;2018-01-22;yes we do. the ecosystem is great and microservice architecture may be manageable even in small teams but it's always a process that defines the success. from my own experience the biggest technical problem of microservices in java can be the performance of the whole system in a monolith there's much less logging and state management no network latencies and mismatching parallelism settings. discovery auth messaging configuration management etc are solved.;0
16203260;HackerNews;2018-01-22;one thing ive noticed with microservices is the business rules duplication. everyone tries to solve their problem so the same rules start popping up ofc implemented differently and mostly unknowingly in all these microservices. the problems start when the business requirements change and you need to change all microservices.;0
16203252;HackerNews;2018-01-22;this is a well thought out and well reasoned article.it resonates on many of the pain points of microservices. i also nearly broke out laughing at his definition of microservice madness netflix are great at devops. netfix do microservices. therefore if i do microservices i am great at devops.because it is so hilariously accurate it's almost painful.i do want to point out something the author implies which is that there iarei benefits to microservices as a pattern...and as a pattern it is likely here to stay. it's an advanced pattern that comes with tradeoffs and complexity increases on the ops side. in the best case you're trading developer complexity for operational complexity and perhaps also getting better reliability but this is not a guarantee.additionally projects like kubernetes istio and envoy are all tools aimed at making certain operational complexities of microservices easier...so the operational trade offs are likely to change dramatically this year.but in the end we can all still hope that madness dies in 2018 though.;0
16203231;HackerNews;2018-01-22;because i find debating about the pro's and con's about microservices somewhat cumbersome i tried to let the code speak and record a screencast series on exactly this topics. because i feel that especially in the java world microservices are an utter abomination most of the time. comments more than welcome!;0
16203184;HackerNews;2018-01-22;microservices is a backend service pattern. mvc model view controller is a frontend pattern to enforce separation between data ui and interaction logic.;0
16203163;HackerNews;2018-01-22;what we need is a polyglot paas that's only runs microservices lambda is the closest to that ideal right now.;0
16203099;HackerNews;2018-01-22;what i love about some microservice iimplementationsi so not microservices in general is that people use fast and scalable data platforms to analyze data in microseconds but then slap a rest api in front of them ideally with slow authentication and logging and ideally in a different availability zone so instead of waiting 20 ms for your metric you get it in 3 seconds.i love without es microservices for their isolation principle people can kill offrewrite parts of the system without affecting other parts written possibly in a whole different language etc. but lets not abuse it. if you put every tiny function behind an api what you'll get is a slow and unmaintainable mess.;0
16203085;HackerNews;2018-01-22;we are such a totalitarian part of the species. someone writes about microservices and my next project i'm building services for each feature because some manager heard it increases reliability. the fact is its always science. if you don't want your inconsistent dataset from somewhere else in the corporation taking down your application then chunk a part of the application into your own container to manage calls rather than allowing the event loop to block up. it doesn't have to be 'micro' it has to exist for some reason if not it is just your developers trying to be cool.;0
16203056;HackerNews;2018-01-22;they're only following their incentives.what's gonna look better on a devs cv 'spent a year maintaining a crud monolith app' vs 'spent a year breaking monolith into microservices with shiny language x to boot'.we can be a very fashion and buzzword driven industry sometimes.edit this perverse incentive goes all they way to the top through to cto level. sometimes i wonder if businesses understand just how much money and effort is wasted on pointless rewrites that make life harder for everyone.;0
16203030;HackerNews;2018-01-22;microservice is certainly a buzzword but it's not just serviceoriented architecture. mircoservice architecture is modular design with all the advantages of effectively infinite scale incredibly flexible orchestration and the resilience provided by the public cloud providers. it has it's own set of challenges and it isn't the right solution for every problem. but it can be fantastic when used properly. i've written plenty of well performing api endpoints in microservices and i've also done a fair bit of business process automation with them.;0
16202972;HackerNews;2018-01-22;i use microservices and i experienced many venefits. more in general it follows unix phylosophy.;0
16202840;HackerNews;2018-01-22;i suppose it depends if those 10 people are purely developers or include the other teams you'd need monitoring devops etc. for a critical highperformance microservice i can easily see it needing the involvement of 2 devs at least one senior product owner project manager qa devops monitoring etc.;0
16202552;HackerNews;2018-01-22;there is no such thing as microservices it's just services otherwise known as a serviceoriented architecture soa. a service is a logical grouping of functionality as it makes sense in your business domain. a small service for a large company can be bigger than the entire product of a startup there is no standard unit of measure.computers also don't care how code is deployed and different services can be bounded by classes or namespaces or assemblies or packages or processes or completely separate apis reached over the internet on the other side of the planet.microservices can perhaps be defined as more of a deployment model but even then it's 99 about the team and organization structure. as companies get larger there is a trend towards smaller teams in charge of separate functionalities that create deploy and operate their own service. this can be effective in managing complexity and creating efficiency although definitely not absolutely necessary.all that being said outside of the major software companies i have seen exactly 0 uses of microservices where the benefits were worth the effort if any benefits even appeared at all.;0
16202462;HackerNews;2018-01-22;decoupling codeinfrastructure is not a bad practice. as it so often turns out to be microservicesmonoliths mean different things to different people and your mileage may vary. difficulties may be introduced going either way.choosing the right tool for the job is difficult there are many variables at play. there's a lot of value to people sharing their perspectivesexperience about these issues. at the same time i think the overall discussion shouldn't be so dichotomous.;0
16202459;HackerNews;2018-01-22;good quality code can increase the chance of meeting deadlines but working long hours can also increase the chance of meeting deadlines.no that's not true except in a very superficial sense. yes long hours can increase the chance of meeting deadlines... but often it doesn't or more precisely it only works if the code quality is decent.code quality is not about following whatever patterns are en vogue today or using the latest dev language. it is mostly about simplicity dealing with few things at a time and making those things explicit. if you need to understand the entire solution and the entire domain model and all the edge cases before making the tiniest of modifications long hours are not going to help you.to go back to microservices many companies claim to build microservices but actually build a distributed monolith. this doesn't help productivity it actively harms it.;0
16202441;HackerNews;2018-01-22;not the op but also having worked on multimillion user apps off the top of my head zero downtime deployments small failure domains if you make a bad update to a service only related functionality suffers the rest keeps working frequent small deployments like several times a day easy and quick integration testing cause you only have to test the functionality of one service not the whole system easier debugging cause if one functionality isn't working it's easy to analyze only the logs of the service responsible for that functionality and optionally move to others later having identified some part of the cause. also every microservice is a new clean slate you can quickly learn from your mistakes and try out new approaches. not diametrically different but you have the ability to iterate moreedit another one is that if you keep the microservices actually small and well described by an api you can easily quickly and safely heavily refactorrewrite old services.;0
16202283;HackerNews;2018-01-22;the author omitted an important one microservices are the new source of spaghetti code.when trying to implement as multiple microservices something that should actually be a single servicei.e. the ms's are not useful as independent unitsanswering a single api request is an amazing mess of distributed calls all over the place and unnecessary serializationdeserialization of queries.;0
16202212;HackerNews;2018-01-22;they can manage those teams by writing libraries no need for microservices.;0
16202185;HackerNews;2018-01-22;if you can't debug one and only one microservice at a time then it's not really a microservice.it depends on what you want to debug. it is like unit test vs integration test. if you are finding a bug related to integration between multiple services you definitely need to debug on multiple services.;0
16202061;HackerNews;2018-01-22;the ops cost of inoti using microservices is a lot higher than you'd think too. at some point when you have hundreds of engineers and your monolith is compiled together from libraries written by a dozen different teams and you have to try and make one heroic release per week except half the time it fails and you have to go back and fix it and absolutely no one in the company can ship a new feature because you're blocked.;0
16202008;HackerNews;2018-01-22;thats how i meant it that the advantage of microservices is bite size pieces of work so 10 people on the same service sounds like theyd step on each others toes. i run a bunch of services but theyre each debugged enough to be fairly low maintenance and small enough that the edges are well defined.its 8 or so but its possible for me to handle it all. if we add features theyre going to be new services so adding big features to the services i manage is unlikely. it is more likely that i get a new service on my plate in 6 months time than getting additional members of the engineering team to work on already completed services.im obviously not entirely alone... ill ask for help if i need it and i help out with other peoples stuff too but i am primarily in charge of them and i am responsible for keeping everything working well.;0
16201954;HackerNews;2018-01-22;my two cents would be that tooling makes all the difference with microservices especially in terms of developer productivity. having tooling which allows me to test changes to a microservice locally and easily is a huge win and without that tooling microservice development becomes much more difficult. making it easy to test a service locally including its network interactions lets me be more confident that my code will work in production and reduces a lot of the cognitive overhead of developing one component among thousands.;0
16201949;HackerNews;2018-01-22;i think that it is accurate to say that in a system composed of microservices a microservice should not effect the state of other microservices in the system other than by consuming them.whether it should iconsumei other microservices is less clear and gets into the choreography vs. orchestration issue choreography provides lower coupling but may be less scalable.;0
16201941;HackerNews;2018-01-22;the scope of a microservice is commonly a bounded context in ddd. so depending upon the problem you might be talking about a lot of code.;0
16201924;HackerNews;2018-01-22;i feel like several of the purported benefits of microservices could be realized in a monolith as well.independent development just stick to your own part of the app.reusability write a libraryisolated deployments and deployment velocity i suppose not isolated but theres no reason you can't achieve great velocity with a monolith.a less often cited advantage that i do think has a lot of merrit is the ability to choose different languages and tools for different problem domains.;0
16201898;HackerNews;2018-01-22;in fact if you have stateless services then i'd be inclined to consider skipping microservices altogether and consider using a serverless model.what? isn't a serverless model necessarily a microservices solution?;0
16201883;HackerNews;2018-01-22;do you legit think that people are all just doing this as a fad?as you say there are a lot of pros and cons to any architecture or paradigm which is why we're still talking about it and saying things like right tool for the job and not just using the one true methodtm.i legit think that a lot of people using the new hotness as a form of cargo cult programming with no understanding of the methods they're considering or how they apply to the problems they're trying to solve.it's not just microservices that are improperly applied. i've been in the industry long enough to see dozens of languages technologies paradigms processes and everything else hailed as the second coming of christ and applied inappropriately all over the place until the shinyness wore off.and i mean... when we start talking about developing for amazon scale we're already talking about situations that don't apply to 99 of developers. not a great argument that their cases aren't inappropriate applications of the pattern.;0
16201835;HackerNews;2018-01-22;wrt 2. data isolation argument.it is not clear to me why data isolation is your view is exclusive to microservices.i have build non trival rbacabac authorization platforms using pdp and embedeabble pep and did not find that it was useful by micro services only. and i did not feel that it can only be called via 'micro service' pipeline.in a way the authorization is a separate service yes but it should be offering an embeddable pep policy enforcement point that one can embed link or call outofprocess if needed from pretty much anywhere monolith or any runtime component.authorization decisions require very very low latency as you are authorizing pretty much every data or function interaction.in fact for data interaction authorization engines offer sqlrewritingfiltering so that the actual 'enforcement' happens at the layer of database you are using not even at the layer of the component that's accessing the data.;0
16201794;HackerNews;2018-01-22;i think these are appealing for 2 reasons1. there is a believe that component isolation taken to extreme by microservices enables better productivity of the development department.that is more features more prototypes more people can be moved in and out a given role. so that those 5 crusty programmers are not a bottleneck for the 'next great idea' that a product manager or cio reads up on.2. there is a constant battle for the crown of i am modern eg data science micro services big data that is going on in every development or technology organization. where the closer you are in your 'vision' to google or netflix the more 'modern' you are.the rest of the folks is 'legacy'. so you get budgets you get to hire you get to 'lead'. microservices is the enabler to help to win this battle although probably for a short term.i personally do not believe that microservices bring anything new compared to previously used methods of runtime modularization i do not think they replace the standards like corba although i think they will end up eventually replicating it with better thought out standards and tools.;0
16201747;HackerNews;2018-01-22;i mean there's no reason you can't do that i think that's a fine approach personally. i'm not really sure you gain much from focusing on developing tons of microservices at that point though. in general it's going to add complexity to your project and at the end of the day you're still deploying it as one big single service so i'm not really sure you gain much from the added complexity. that said i'm not really huge on microservices to being with so i may not be the best one to talk to about them;0
16201713;HackerNews;2018-01-22;microservices bring more advantages for management than technical people. easier to manage smaller team easier to hire we can hire good people with different skillset easier to scale and so on...;0
16201705;HackerNews;2018-01-22;microservices in practice are like polyglot throwing away type safety for no good reason. this shit needs to stop.;0
16201671;HackerNews;2018-01-22;they haven't hit the proverbial nail with the hammer they've hit the railroad spike with a sledge imo it's 100 about your environment and the demands and obligations your development team has against it's own obligations to deliver. i'm not going to say microservices are the cornucopia smoking gun or even smoldering slingshot but much of the dissent in this thread seems predicated on the idea that they are the end result and not merely an optional path to take for desired outcomes of deliverability.;0
16201652;HackerNews;2018-01-22;a little over two years ago my little team of three gasp! succumbed to the allure of microservices. after six months of writing custom solutions for problems i'd created i bagged it. the one upside of our microservice architecture was how simple it was to consolidate back into a single app. only took a couple months. i believe the theoretical benefits of microservices namely hard domain boundaries remain compelling but geez i also learned its benefits are extremely circumstantial.;0
16201638;HackerNews;2018-01-22;just for the record i'm one of the people who thought that putting a corba orb inside gnome was a ifantastici idea. we're all young once!microservices are just another way for us to do premature subsystem decomposition because we ialwaysi think that we can build components with stable apis that will be small clean and reusable. it's even more fun to put that subsystem into a different process because who doesn't like a little bit of extra latency in their processing? i jest but it's not such a silly idea. by making sure everything is in another processes and using the most inefficient ipc system available tcpip you ensure that nobody is going to do stupid things similar to what people tend to do with threads. the multiprocessing aspect appeals to people because it helps them break down the problem into isolated chunks and reason about them.the key here though is to realise that you almost never need multiprocessing. the design challenge is actually the same whether you isolate your processing in different processes or not. however it's imuchi easier to refactor your code when you haven't put road blocks in your path first. if you are doing that then it is easy to extract the functionality into a separate process if you need to or even a thread if you happen to work in an os that thinks that thread processing should be more efficient than process processing.in short don't practice i must protect myself from the stupid programmers programming and instead concentrate on writing good code with your coworkers.;0
16201615;HackerNews;2018-01-22;when i see a team of 7 deciding to go with microservices for a new project i know they're gonna be in for a world of unnecessary pain.faced this a couple of years ago and i was the lone dissenting voice suggesting this was not going to go well. then i learned that microservice in reality just meant everything was going to be one nodejs process running endpoints with ios and android clients hitting it which... didn't really fit my understanding of microservice that's just service.;0
16201613;HackerNews;2018-01-22;i think my point was misunderstood probably because i did a poor job of explaining it as i was cramming a hamburger in my facehole and watching the pats win the afc i think in many cases microservice architectures appeal to engineering organizations with poor communication and cooperation skills where developers desire to be strongly independent because of the lack of management creating a cooperative and coordinated dev and work environment. i think that's actually saying something very similar to the conway law idea brought up by the other poster.;0
16201586;HackerNews;2018-01-22;the big benefit of microservices is being able to easily reason about or scale services but adding dependencies usually sacrifices those benefits.thank you that makes sense.;0
16201572;HackerNews;2018-01-22;i think the context is pretty clear microservices.if it takes 10 people to manage one service it is not a microservice by definition. it is more like a 10xmicroservice or a macroservice.;0
