ID;Source;Creation Date;Content;Sentiment
12509394;HackerNews;2016-09-15;cannot agree more with this based on experience of small startup. let's say you want to develop a mobile app and rest api for it hosted somewhere in cloud. there's so much hype about it so you want to do it right it's right indeed but for some distant future until which your startup needs to survive. so the possible solution is to take some common stack like spring cloud and build a number of microservices with service discovery config server oauth and api gateway.it appears it's not so easy 1. first documentation as always is not the best and you'll have to spend time figuring out how to wire together different parts of the system and build various configurations of it for local development ci build and production. 2. then there's debugging issue. once you've figured out how to work with docker good news it's really easy today you may want to do some debugging in ide but it becomes really painful to launch everything correctly with attached debugger if the services interact with each other. 3. finally it's production deployment setup and associated costs. besides the complexity of deployment do you really want to pay for 1420 ec2 instances at the time of the launch of your service and burn the money on 0 cpu activity? it will take months probably years to get user base sufficient for utilizing this power.the better approach is to develop single server app with future scalability in mind. you can still have separate components for each part of domain you just wire them together at packaging time. this server app still can scale in cloud with correctly set up load balancer and database shared between nodes.fortunately we spent not much time on building microservices about 1mw to figure out the costs and benefits and were able to refactor the code to simpler design but many developers should not care about them at all at early days of their company.;0
12509313;HackerNews;2016-09-15;because scaling a monolith is not a realistic approach. every single monolith i have worked on has been refactored as domain specific microservices and in every case it was a resounding success.;0
12509265;HackerNews;2016-09-15;like all things one size doesn't fit all. not everything is a nail regardless of how shiny the hammer is. having said that when the situation is right microservices are great.some of us have been through this all before with soa or in my case with com. each individual component is simpler but the documentation between the components becomes absolutely vital.we ended up keeping a copies of the interfaces in a central location with documentation of all changes per version so that everyone would know how to talk to all the other systems.and don't think that the interfaces won't change. they will. and often across many systemscomponents. like a ripple.;0
12509253;HackerNews;2016-09-15;there's some good points here and some i disagree with. one area though where i think he misses the point is additionally many of these stories about performance gains are actually touting the benefits of a new language or technology stack entirely and not just the concept of building out code to live in a microservice. rewriting an old ruby on rails or django or nodejs app into a language like scala or go two popular choices for a microservice architecture is going to have a lot of performance improvements inherent to the choice of technology itself.languages and tech stacks generally have tradeoffs. considering rails vs go you could consider the massively oversimplified tradeoff to be that rails is better for prototyping and iterating quickly while go is better for performance. in an ideal world you'd write your webapp in rails but put the performanceintensive stuff in go. you'd need to communicate between the two by say http. suddenly you have services.the performance gains of using a new stack aren't orthogonal to services they're actually one of the key selling points of services you can use whatever stack is most appropriate for the task at hand without needing to commit the entire project to it. you can use postgres for the 99 of your app that's crudy and i dunno cassandra for the 1 where it makes sense. it's difficult although not impossible to do that cleanly within a monolith.;0
12509219;HackerNews;2016-09-15;i think it's more of whether or not you need that scale. if you don't have the resources for it to make sense to optimize everything like that you're probably wasting your time iandi making things slower by pursuing microservices.;0
12509204;HackerNews;2016-09-15;yes i have definitely experienced this. at the company i work at we have dozens of super tiny services that could have been replaced with a single class or module in a codebase.each of the dozens of microservices gets it's very own dedicated aws load balancer rds instance and autoscaling group in multiple regions. just the infrastructure management alone is monumental.iedit punctuation.i;0
12509173;HackerNews;2016-09-15;my approach is to design like microservices and develop like a monolith. thinking about microservices will force you to define module their boundary and interfaces. a monolith will simplify deployment refactoring. once your code matures you'll know if any microservice has to be taken out and deployed seperately.;0
12509152;HackerNews;2016-09-15;why would you not be able to scale a monolith? you can apply the same principles to it stick a load balancer in front of a micro service and scaling based on measured load?a microservices allows you to scale up very particular components of an architecture but there is nothing stopping a monolith from being horizontally scaled in just the same way. in aws i would make the monolith deployed with an ami in an autoscaling group with a load balancer in front.;0
12509129;HackerNews;2016-09-15;microservices like nosql databases and complex deployment systems docker are very important solutions to problems a very small percentage of the development community has.it just so happens that the portion of the community is the one most looked up to by the rest of the community so a sort of cargo cult mentality forms around them.a differentiator in your productivity as a nonhugecompany could well be in not using these tools. there are exceptions of course where the problem does call for hugecompany solutions but they're rarer than most people expect.;0
12509066;HackerNews;2016-09-15;this could be titled if you do things wrong it won't be good.a lot of his examples are of people doing things poorly or incorrectly. i could make the same arguments about object oriented programming my saying it's bad because someone makes every function a public function.for example microservices are absolutely more scalable if done correctly with bulkheading and proper fallbacks and backoffs and proper monitoring altering and scaling.but those things are hard to do and hard to get right.;0
12509062;HackerNews;2016-09-15;agreed most of the points this article makes are invalid as well. google has been running the microservices pattern forever and seems to scale fine. for example he mentions that costs are ndoe based but no where in a microservice pattern does it say each service has to run on its on vm;0
12509057;HackerNews;2016-09-15;i for one feel the same way when someone tells me they are building microservices for a small application that they don't ever plan to scale to that levels. imo amongst us there is a widespread issue of here's the new cool thing my applicationsystem has to do it. the other day a friend was talking on and on about setting up a hadoop cluster for what i saw as a onetime use batch script.;0
12509030;HackerNews;2016-09-15;as someone working with this setup right now coming from what is fondly referred to around here as the godmonolith of our 1.0 version i couldn't disagree more....but as always this is an artform writing and designing not laying down pavement.there's no right way and any blanket statement about anything is false.don't use microservices where they don't make sense make educated decisions and choose the best option for your situation.it made sense in our situation because all our services have very very very specific rules and boundaries and there's no overlap anywhere.;0
12509025;HackerNews;2016-09-15;one suggestion i would make if you are going to use microservices is to consider using grpc rather than rest. you can save yourself a lot of the hassle involved in the communication that way and make things quite a bit faster.;0
12509023;HackerNews;2016-09-15;the title should be i've never implemented microservices properly so you should avoid them.;0
12508957;HackerNews;2016-09-15;from personal experience microservices enforce a clear interface and isolation pattern. this is achievable many ways but having discrete deployed code makes it very hard to violate rather than being disciplined.licensing costs can go drastically up as most modern licensing is nodecore based. as can deployment procedures get more complicated.i would love to understand how this article believes that the modules in a monolithic system can be scaled horizontally if they are actually a single code base in a single system. either the system isn't monolithic or it they have never really done it. sticking a load balancer in front of a micro service and scaling based on measured load requires tools and technologies but is very scalable. it also allows you to do rolling deployments of drainingrotate outupdaterotate in that allows you to get near no planned downtime.distributed transactions are the devil but you don't need to do them in a microservice design. it requires design work on the front end to clarify what the system of record is but if each service has a domain it controls and all other services treat it as the truth it's rather simple. i say this having researched doing payment transactions across geographically diverse colo's and we treated that as a shardingreplicationrouting issue very successfully.ninja edit starting with a microservice design is most likely overkill for a lot of systems but either way clear interfaceboundaries in your system are good and healthy;0
12508941;HackerNews;2016-09-15;raises some good points but i think the title isn't really correct. it's not don't use microservices it's more about making sure you understand the implications of having a microservice architecture and making sure it's not an excuse for not writing a monolith or soa properly.;0
