ID;Source;Creation Date;Content;Sentiment
1dmi48v;Reddit;2024-06-23;Title:You Probably Don’t Need Microservices, Content: https://www.thrownewexception.com/you-probably-dont-need-microservices/;0

l9vyedv;Reddit;2024-06-23 12:57:55;what most people don't understand is that microservices solve organizational and not technical problems. microservices are a pattern to enable different teams to build solutions that are focusing on a single domain. no need to unverstanden the whole business. this decouples these teams but naturally comes with its own challenges e.g. dependencies of other teams to your api. however the idea is that these challenges are easier to solve then having hundreds or thousands of developers work on a monolith. but people tend to think microservices solve scalability issues. this is also true because if you break your application into smaller components and maybe even group them by their functionality you can scale them based on their needs. but thats not the unique selling point. microservices help you scale your organisation.;0
l9w2xcs;Reddit;2024-06-23 13:44:44;i remember one situation in a previous company where a bounded context had so many little services that any change required many teams to work together to deliver it. and even worse the performance was awful. we tried baseball and it didn't work. a monolith smeared out over different containers is not a microservice architecture.;0
l9vr77r;Reddit;2024-06-23 11:31:26;i feel like this is becoming a more common narrative... finally. i'm in the belief that microservices are mostly just a hype thing that are being pushed onto people by cloud providers to make more money. huge companies like google and netflix holding ted talks and keynotes of how great microservices are for them completely ignoring how they're actually the minority and how 99.9 of companies will be better off keeping things simple in one monolith.;0
l9wg37s;Reddit;2024-06-23 15:34:49;the article is summarized some of the pains with microservices well. what it doesnt do is to put equal effort into describing the pains of alternative designs. so yeah sure. any given architecture will have problems. there will always be trade offs. in that sense the article is spot on. you dont always need microservices. i just wish it had been said differently. focus on your needs as an organization and pick an architecture that match today and the coming years.;0
l9vy3pr;Reddit;2024-06-23 12:54:40;microservices and monoliths are kinda of pick your poison they both suck but for different reasons. but i have seen people make careers out of pushing microservices and not having anyone who can apply competent analysis to a problem. but what i really hate about microservices is the testing so many mocks of other services just to test one api change. then it is a case of maintaining and updating the mocks in some cases different teams making different mocks of the same api. and the resiliency and performance testing of the different apis. and those who pushed the microservices hand wave the problems away. monoliths have their own massive problems with testing.;0
l9w12nw;Reddit;2024-06-23 13:26:25;there are microservices and then there are microservices. one type of microservices is a distributed system where a bunch of microservices coordinate to perform some business process. this is obviously easier to do in a monolith since you get things like transactions and shared data models. with microservices you have to adopt complex patterns like the saga pattern to coordinate microservices and use patterns like cqrs to synchronized data between microservices. i personally would avoid going down the microservices path in this situation unless a really good reason presented itself. another type of microservices is just a group of completely separate programs. there is a temptation to add features to existing monoliths because you don't have to create another repo another cicd pipeline etc. but then you have a monolith that is a bunch of random services cobbled together because of convenience not because it makes sense for them to belong together. so you have to deploy unrelated features for a change to one service. in this context i don't see what's wrong with creating a new microservice at the beginning or pinching out a microservice out of an existing monolith.;0
l9wa21i;Reddit;2024-06-23 14:48:31;i see articles like this all the time. if you have a simple domain don't complicate it with microservices and a distributed architecture. just use a monolith. if you're working in a complex domain and require the ability to deploy at scale use microservices. there's almost never a single solution for these kinds of problems. just use what works for your unique situation;0
l9y17vz;Reddit;2024-06-23 21:30:09;my simple argument against the causal use of microservices is that in many decades of programming experience the number one bugaboo is threading. by threading i mean any separate bits of code which need to communicate with each other while running at the same time. microservices is threading but with even less ability to replicate and debug. when these separate bits then need to readwrite the same data problems often arise. serious very hard to debug problems. there are all kinds of strategies involving queues with workers locks data isolation etc but i really don't see those as viable solutions which are any better than not having used microservices in the first place. i don't agree with most of the other arguments for microservices such as scalability this is a very rare requirement. most scalability is pretty straight forward with normal architectures. you see a machine is approaching its limit so you get another machine or a bigger machine. there are going to be very specific use cases where server load is wildly dynamic say running an event ticket service. these are the exceptions not the rule. division of labour. this is just a cheat for a bad architecture with bad managers. the result is more going to be a bunch of jira chasing slaves with a few devops gods who dictate the architecture far more than is healthy. cost. nope. not happening except for those weirdo edge cases. development ease this is a huge lie. yes it is easier to onboard someone to go jira ticket chasing in a smaller module but now they might work at a place for years without an understanding of the greater whole. most companies system should easily run in a dev environment on a single laptop. the percentage of systems where this is not the case is going to be a tiny fraction of 1. to make it hard for a dev to see and posses the entire dev environment is just weird again job security for some devops guy who would reply i can just spin up a dev environment for them to work in. the key word in this sentence is i not they i do like that some elements of microservices have propagated out into the more realistic world. things like putting the db in one container admin in another front end in another back end in another etc. this allows for interesting load sharing. for example maybe there is a brutal ml driven process which needs to run every night. it can run on its own machine at its own pace without disturbing the other machines. or if the db becomes a choke point the db can be spread out on multiple machines to share the load. way easier with containers.;0
l9xpo7c;Reddit;2024-06-23 20:20:40;will someone please just tell me the truth do i need microservices or not?;0
l9yr035;Reddit;2024-06-24 00:04:23;all software is either 1. shit or 2. will become shit i like how microservices let teams throw away the old shit in favor of new shit they feel ownership over every few years. binding everything together even with the latest and greatest modularizarion strategies ever imagined still means you have a system everyone hates in a few years as staff rotates and didnt fight the battles the people that wrote it did. you rarely get budget to rework the foundation of a monolith because the riskreward is never worth it to the business. rebuilding a discrete application that only does a few things is always easier to sell and lets teams experiment with new things. there are plenty of downsides to this as the article spells out but ill take that trade at any org where you dont know the name of every engineer working in the stack.;0
l9z79uj;Reddit;2024-06-24 01:53:28;the thing i need less of are blogs which tell me that i don't need microservices.;0
l9vpfm1;Reddit;2024-06-23 11:08:59;here's the gist the post argues that many companies adopt microservices architecture unnecessarily. it emphasizes that monolithic architectures can be simpler and more efficient for many projects. the complexity and overhead of microservices can lead to increased costs and development time. the author highlights that the decision should be based on specific project needs rather than following trends. practical examples and case studies are provided to illustrate the potential drawbacks of microservices and the benefits of monolithic systems. if the summary seems innacurate just downvote and i'll try to delete the comment eventually click here for more info i read all commentshttps;0
l9wuxfm;Reddit;2024-06-23 17:13:12;my own experiences have been 1. microservices at the api or internal function are a pain they add complexity and often need to be cohesive for the overall function making them less reliable because more moving parts and longer string makes it easier to break. but function based miniservices on scaling or logical boundaries are a gift from heaven vs a legacy monolith or megalith. the yscaling is the foundation and needs to be right. 2. xscaling is deceptive. it seems simple conceptually and seems like the right direction but some things that seem xscaled just aren't. they may be sharing state and end up with multiplicative load. they may make the system nondeterministic and difficult to work with when one clone is aberrant. 3. zscaling is an oldie but a goodie. predictable pragmatic low surprises but if you have to do aggregation of state across the zones and on demand that becomes annoying and painful. our current strategy is to have zscaled low value high volume moving high valuemvp type data to xscale and breaking up yscale across the discrete logical products and it seems to be doing well much more flexible performant and adaptable than before and i think a lot of fun to work with.;0
l9y7rv3;Reddit;2024-06-23 22:09:00;wait you're telling me that microservices aren't a silver bullet? can such things be?;0
l9ymlyn;Reddit;2024-06-23 23:36:27;more microservices more apps you need to constantly keep up to date and patch;0
l9yvhtc;Reddit;2024-06-24 00:33:51;you probably dont need microservices ftfy;0
l9z1br9;Reddit;2024-06-24 01:12:32;its safe to say that if youre reading advice on microservices from reddit you definitely dont need microservices. if your company is big enough that your bosss bosss boss has hired management consultants to tell you need microservices then maybe its time to consider it.;0
l9z44bx;Reddit;2024-06-24 01:31:32;monorepo and microservices are false futurisms which don't fit majority of the use case. people do it because it's supposed to be done this way;0
l9w0aoc;Reddit;2024-06-23 13:18:21;ive worked in two companies one is pretty much a household name in the usa that went really big on microservices. i hated it so fucking much. i never want to work on a microservice ever again.;0
l9ww1cj;Reddit;2024-06-23 17:20:06;as your monolith grows you'll wish you did microservices;0
l9xezcy;Reddit;2024-06-23 19:16:05;i think they solve all of those organizational scalability and reliability issues. but they also introduce their own variants of all of those. and not every company observes the same categories of issues with either paradigm. most companies will never notice scalability issues truly related to a monolithic architecture but plenty of them need global redundancy and partial failures. depending on their manpower microservices make development easier or harder. its just way more complex than „theyre great „they suck or even „you will probably never need them. i personally work in a small startup and we process like hundreds of requests a day. we still need global redundancy and isolation for data protection and extreme reliabilityavailability requirements for some services yet very generous acceptable downtimes for others. teamwise it doesnt make much sense to split the way we did but domainwise and also considering vastly different performance requirements for the machines it does. we are a very unique case but thats my point not every company is your basic websiteecommerce platform. there are many different businesses out there with very different operations and therefore needs. the microservice decision or really any architectural decision is unique to each one of them and thats what makes these blanket statements in either direction so annoying.;0
l9w75e7;Reddit;2024-06-23 14:23:47;this is an argument i see often but nobody is yet to explain how or why it would be any different from simply building your monolith process from multiple smaller packages each managed by a different team. your software is already written by dozens of different teams through all the libraries it depends on why not use that method for your internal modules as well? i've recently implemented this in jsts with an internal npm repository and it worked great. one team manages the users package and uploads new versions to npm whenever they're ready another team manages the teams package that depends on the users package. you can even run them independently in separate processes if you really want since they both have their own main.js file that you normally don't run when running it as a monolith. in my mind this kind of destroys the whole it enables teams to work independent of each other argument for microservices no? the only downside is at deployment time when releasing a new version of a core package would require rebuilding of the depending packages as well assuming the change needs to be reflected immediately. sure this is why microservices might be ideal for faang sized companies but for the remaining 99.9 this is a complete nonissue.;0
l9w6klx;Reddit;2024-06-23 14:18:41;do you use dependencies in your software? those are built by other teams with which you have 0 communication and are not even part of your organization yet nobody even thinks twice about using and including them. you can apply this within your organization as well where teams release new versions of dependencies which are integrated into a larger deployment. there is some discipline involved here but considering the huge downsides of microservices once components must communicate over a network that seems like a trivial issue.;0
la03fra;Reddit;2024-06-24 05:53:18;microservices don't have to be split up by repository. you can write a bunch of microservices all in one monorepo. you could even write them all in one single codebase and then deploy out modules onto separate servers. microservices just refers to where the code runs not to anything organizational. i've worked on projects completely by myself and one of the most productive techniques i've ever used is building stuff with serverless functions. according to fred george the only thing used in modern programming that comes close to his original definition of microservices are serverless functions. writing everything as a bunch of dead simple functions that interact in really highlevel ways like raising events and responding to events is just an incredibly easy way to architect simple systems.;0
l9y741g;Reddit;2024-06-23 22:05:06;what most people don't understand is that microservices solve organizational and not technical problems tell that to my org. the main managers behind our switch to them also believe everybody should be able to jump into any other teams code and just start changing things with no guard rails. also believes believes all the microservice should share most the same liberaries but no architect or liberary maintainers. it's all so clearly incoherent and the disaster of a delivery we've had is the most damning evidence. worst part is they're fairly clueless to it all.;0
l9ytcsz;Reddit;2024-06-24 00:19:44;microservices are not about organizational strategy and they are not about scalability. these things can be happy byproducts i guess though ive never seen it convincingly argued that microservices actually help scalability. microservices are about operability and deployability. if youre an organization deploying thousands of changes a day then getting all those changes rolled out across the fleet in a monolithic application becomes a massive headache. its a lot easier and simpler and cheaper to be able to roll out changes only to a small subset of the fleet for the particular microservice containing the change.;0
la00bgt;Reddit;2024-06-24 05:27:18;i see startups adopting microservices in a misguided attempt to reduce technical debt. the logic is microservices now avoids needing to break apart a monolith later. what everybody should understand is that breaking apart a monolith later is better than paying all the conceptual pain involve with microservices today.;0
l9yw2r7;Reddit;2024-06-24 00:37:40;what most people don't understand is that microservices solve organizational and not technical problems. i think what proponents of microservices don't understand is 1. it's debatable if microservices even address these organizational problems. 2. microservices make a backend architecture dramatically more complicated. 3. this additional complexity comes with significant cost both directly to engineering and the business as a whole.;0
l9ww95v;Reddit;2024-06-23 17:21:25;what most people don't understand is that microservices solve organizational and not technical problems. no proponents often give different answersdefinitions. beentheredonethat. murkiness is a yellow alert warning of fadcult. do note independent version deployment of components is often included in claims. i noticed if your shop settles on a primary rdbsms brand one can use the db as the message communication board for splitting a big app into multiple smaller ones multiple executables for example if you need such splitting. but make sure splitting makes sense for shop needs first. and stored procedures are perfect for the small shared services micro services. the bigger services are applications written in an app language java c python etc. or at least subapps. the message sharing tables double as a log which is handy for troubleshooting. have a status flag to mark processed messages. perhaps make a trigger or nightjob to chop out older data periodically to keep small. this way you don't have to mess with jsonoverhttps. since you will probably connect to a db anyhow you don't need to manage a separate json connection service reuse. most small and medium shops do settle on a primary rdbms. if you work for a giant conglomerate with different db brands then json could make sense.;0
l9wa8zi;Reddit;2024-06-23 14:50:07;it's sort of like everyone who thinks they want tdd really wants code that is written so it could be tested or at least could be very simply modified to be tested such as by taking a function as an argument to modify behavior at test time n 1 but i'm currently in a role where everyone is excited about the new direction of converting microservices into modules in a monolith in a monorepo. devdeploy time has gone down by orders of magnitude for the parts of the system that have been pulled into this paradigm. i think a lot of teams end up in ball of mud monolith territory and microservices look like the antidote and in some ways are easier than having the vision of how to accomplish the same degree of modularity in a single service only splitting out services when they ought to be from a runtime perspective e.g. workers that shouldn't or can't come from the same process;0
l9z3igq;Reddit;2024-06-24 01:27:25;remember amazon prime video using microservices to process videos? imagine transferring high bitrate 4k videos service to service. this particular usecase isn't compatible with microservice architecture at all.;0
l9x5kex;Reddit;2024-06-23 18:18:45;almost everyone who think they want microservices actually just want modular code. microservices are modular code structured so that breaking modularity is expensive so it's easier to solve problems within the modular structure than to bypass it just this once. in most organizations a developer will eventually have an incentive to propose do it badly quickly and cheaply as an option to the manager and the manager will have an incentive to choose that option over do it the right way less quickly and less cheaply. microservices try to change the cost structure so that the options are do it badly expensively and slowly and do it the right way less expensively and less slowly so that the incentives discourage breaking modularity. in theory we could go with a modular monolith and change the incentive structure but we usually don't have the power to change organizationwide incentive structures and even if we do there's no good way to prevent it from changing back later on.;0
l9w95p3;Reddit;2024-06-23 14:41:06;they are not just a hype... the main thing microservices bring is that they allow a complex problem to be split into bite sized chunks that can fit into a mind of a single developer or a team. what people often don't realise is that they trade one problem complexity of management of too big monolith for another complexity of managing many small pieces working together. depending on your usecase and how exactly you handle it one may be better than the other for you.;0
l9wgbd6;Reddit;2024-06-23 15:36:27;what google and other big players have that almost nobody else have are clear interfaces with draconian rules about state. if you want a global presence on the web and you have 200 stateless webservers scattered around the globe you likely won't find it too difficult to manage. now if you rely on 20 apis scattered in their own microservice realm and you are a programmer worth your salt that won't be difficult either as long as it's all stateless. the hard part is managing state whether it's acls actual data or service dependencies that nobody seem to really acknowledge exist in most systems for whetever reason. as long as you have a plan for each of those and make the scaling part truly stateless microservices work very well. but microservices as you said were hype and too many people with limited cognitive abilities had to work on this... even last week a guy came to me saying he needed 4 machines to launch a new service and wanted my input to make all of it work. that was you typical webserver with bespoke config db and api endpoints. that thing did not need to scale and each of them were stateful. when i said alright so you want that to scale out so if the web server get's overloaded i can just spawn a new web server and put a load balancer in front right? the guy said oh god no! you can't just do that! which is exactly why microservices are getting such a bad press now.;0
l9w8loj;Reddit;2024-06-23 14:36:25;let's not blame the service providers for the incompetence of the companies doing microservices wrong. i'm pretty sure it's counterproductive for these providers to always have to deal with accounts that complain to them about their costs of operation. some of these companies struggle to even make sensible and coherent packaging schemes in each of their code bases. also most of the talks about microservices given by these big tech companies that i've seen so far have been clear about the caveats. it's not their fault people listening to them think they have the same scale and the same problems.;0
l9x8f6g;Reddit;2024-06-23 18:36:13;dont underestimate hardware changes. 20 years ago your server had 12 cores per socket and just a few gigs of ram. storage solutions were slow disk drives and 100gb was consisted big data. spreading a large app across many systems was pretty necessary for standard business stuff even for medium sized companies. today a company can afford a single socket with a hundred cores a terabyte of ram and terabytes more of fast ssd storage. in the same time processing power has gone up 100x or more the needs of those medium businesses has only gone up slightly. the result is that monolithic systems start making a lot of sense again to reduce the overhead and increased dev time of microservices.;0
la0743r;Reddit;2024-06-24 06:25:35;microservices should never be reading or writing the same data. each service should have its own infrastructure up to and including their own data store. as an example of a microservices you might have a payment service which is stripe payments but in house. a llm service which is firecracker but in house. a model store service which is hugging face but in house. a authentication service which is google identity but in house.;0
l9zul6w;Reddit;2024-06-24 04:42:23;1 for the tco angle . not a huge microservices fan but your argument is an angle i had not considered before.;0
l9xdzzu;Reddit;2024-06-23 19:10:06;you know this kind of reasoning does not help your case. it actually makes no sense if you think about it. let's apply this reasoning to another situation. you probably shouldn't smoke if you want to maintain your health you don't need to exercise. you don't need to eat right. etc. basically what you said could be twisted to apply to literally anything. you can't just adopt the arguments in favor of splitting up functions and files and presume that is an argument in favor of microservices. they're obliviously not the same thing. thus your argument blatantly targets people who don't think too much about what you're saying;0
la1mvv3;Reddit;2024-06-24 15:17:46;yes you can do microservices poorly.;0
