ID;Source;Creation Date;Content;Sentiment
l9y2thi;Reddit;2024-06-23 21:39:43;you can't really use what businesses are doing e.g. the way the cloud is taking over as a metric for whether something is objectively good or bad better or worse businesses will usually do what's most profitable regardless of developer burden accumulation of technical debt etc. the only useful information is that x thing can be done with microservices and that it's performance is acceptable.;0
l9xmw6m;Reddit;2024-06-23 20:03:57;if the technical debt in your monolith is so large you wish you used microservices then starting out with microservices will make you wish you wrote a monolith. why? skill issues.;0
l9w8jmi;Reddit;2024-06-23 14:35:57;in a monolith its pretty hard to prevent distant coworkers from using other teams untested private methods and previouslysinglepurpose database tables. like a law of nature this leads inexorably to the giant ball of mud design pattern. of course microservices have their own equal and opposite morbidities you take what couldve been a quick inmemory operation and add dozens of network calls and containers all over the place. good luck debugging that.;0
l9w8od9;Reddit;2024-06-23 14:37:03;because a microservice is more than a library. you get leaky abstractions where the service consumer now needs to understand performance implications of that new database transaction you added or that one failure mode of a new rpc to another service. and that's only assuming things go well. what if someone introduced a critical bug? do you have to roll back the whole platform? if you push all of the operational burden down to whoever deploys the binary you run into organizational issues.;0
l9wr082;Reddit;2024-06-23 16:48:21;it's not managing software it's managing people. each microservice has different teams responsible for their operation. they have their own databases firewall rules authorization sets design teams qa groups etc. by having this separation you can create change and still not involve too many people. it also reduces cognitive load on developers while coding. the smaller domains and clear boundaries mean there is simply less stuff to consider when doing the work.;0
l9whsp2;Reddit;2024-06-23 15:47:03;the difference is that other components can only consume the parts you have chosen to publish using this api. this basically enforces other teams to not rely on hacks or behaviour you do not expose. for example in a monolithic application you could consume data just from a database table. however the table may be owned by a different team and therefore they will make changes. this can't happen in a microservice environment because if you proper implement the boundaries the only possibility to use your services is to use it through the api which is kind of a contract. i don't say that people do not try to work around this but its a lot harder to shot yourself in the foot.;0
l9wh08w;Reddit;2024-06-23 15:41:24;100 this. people seem advocate microservices because it forces them to create an explicit clear api for their library. but they should already be doing that for any library they write.;0
l9w8o3x;Reddit;2024-06-23 14:36:59;because as a single service how would you manage oncall and other operational challenges? microservices are the equivalent of it works on my machine.;0
l9xtj2v;Reddit;2024-06-23 20:43:52;right it does still require coordinating rollouts and introduces more surface area for fuckery. also shared infrastructure means you have to settle on a hardware config that's equally unoptimized for the worst case of all teams. also if you're going to the trouble of splitting into different processes you might as well just split to separate containers on k8s at that point. i don't think microservices are a magic bullet and they can create more problems than they solve but they do have some distinct advantages and disadvantages vs. plain submodules. you're effectively trading simplicity for stronger submodule isolation which can be a good or bad trade depending on whether you actually need stronger submodule isolation.;0
l9xvsc6;Reddit;2024-06-23 20:57:21;i think there are different ways to do a monolith and microservices. i feel that the topic here is to use a monolithic repository to manage your application versus separate repositories which often forces a microservice architecture i suppose another flavor is having a single application that aggregates all the different repositories together but i don't think people commonly approach things this way because it's a lot of extra work to emulate the a mono repository set up. for most faang sized companies they can do whatever they choose. this is always abstracted away from the individual team. for example facebookmeta is a monolith as a repository and they have a complete suite of teams focused on making that experience work well for each developer at the company. amazon is a mix but they're more oriented towards the micro services and separate repository development. they also have a bunch of interesting stuff which makes exposing apis and calling apis from other internal services which makes it easier since all the code isn't in the same repository. if you have amazon friends they call this thing smithy but i've known it as the predecessor called coral.;0
l9ynohr;Reddit;2024-06-23 23:43:13;this is an argument i see often but nobody is yet to explain how or why it would be any different from simply building your monolith process from multiple smaller packages each managed by a different team. for our microservices i can build deploy and update them completely independent of input from any other team. the bigger the team working on a service the more likely you are to start falling into things like release schedules planned feature releases long manual approval processes.;0
l9yoa5q;Reddit;2024-06-23 23:47:03;this is an argument i see often but nobody is yet to explain how or why it would be any different from simply building your monolith process from multiple smaller packages each managed by a different team. trying to deploy a monolithdo merge conflicts for services worked on by an entire company sounds like an absolute nightmare. this happens with games and there's so much organization that goes into deploying one binary to players. having to do that for all services for a live service game sounds like it would immediately kill any velocity not to mention the issue with scaling independent parts of the app. most people don't need microservices but the reactionary point of view of they introduce as many problems as they solve is just not accurate. there's definitely a subsection of folks that moved toward microservices because it was a fad but by and large they exist because they solve problems and it's easier to deal with the problems they introduce than the ones that would be present without them.;0
la0qv3b;Reddit;2024-06-24 09:58:59;is it then just a sevice? if you read what microservice preach then you can have anywhere between 0.5 to 2 microservices per developer. so we have 5 microservices per a team of 12 devs and you can't just understand a domain of one servie they are really intertwined and you still need to figure out how the whole system works in order to participate in the development.;0
l9wevou;Reddit;2024-06-23 15:25:54;libraries and services have very different operational characteristics. nobody in their right mind would argue that something that could be operated as a library should be a microservice. even an organization the size of google prefers libraries over microservices. the organizational problem starts when there actually is a material operational burden involved in deploying the service. now someone needs to understand what that operational burden is and needs to be able to reason about the impact a deployment has on the platform. that's the problem that microservices try to solve.;0
la033q4;Reddit;2024-06-24 05:50:25;15 minutes? try 2 hours. that's what it's like at my current company. amazon literally invented microservices in 2001 because tests on the daily monolith build took an entire night to run.;0
l9wh7ts;Reddit;2024-06-23 15:42:56;in other words it is just a hype. managing a big monolith is much easier than managing microservices. it is extremely difficult to test an integrated microservice and it's much easier to do the same for a monolith.;0
l9zyaus;Reddit;2024-06-24 05:11:05;imagine you're building a website. as part of writing that app you want to let users pay for stuff but you don't want to build out payment processing. so then you go out do some research and decide to use stripe. stripe gives you a nice and convenient api and they handle all the pci compliance and payment processing. microservices are stripe but inhouse.;0
l9whf9j;Reddit;2024-06-23 15:44:23;where's the micro in here. they are just services. soa and seperation of concerns predate microservice by a lot.;0
l9w0ozr;Reddit;2024-06-23 13:22:31;i am the single dev guy left on a project with some 30 microservices.;0
l9whck8;Reddit;2024-06-23 15:43:52;that's also why i strongly disagree with this point in the article low coupling and high cohesion are hard to get right. it gets even harder to get it right in a microservices architecture. you may end up with very small microservices also called nanoservices that are tightly coupled and with low cohesion. i remember one situation in a previous company where a bounded context had so many little services that any change required many teams to work together to deliver it. and even worse the performance was awful. this example is very good because on top of that the teams wanted to create another service to aggregate all the information to improve performance. the idea of merging little services to have more cohesion was considered bad because it and i e looked like a monolith. this is not a monolith vs microservice problem. it's a badly designed code problem.;0
l9we3fk;Reddit;2024-06-23 15:20:06;not sure if i'm reading your comment right is the concern that exceptions thrown from a module could bring down the whole monolith? in that case microservices have the same issue you have to handle errors from an rpc exactly like a normal function call and additionally take into account network latency and connectivity issues.;0
l9wirq2;Reddit;2024-06-23 15:53:53;i think no one said that this can't work. there are good examples that this is possible. but like i said its an organziational challenge that is solved using microservices. for some companies microservices work better then changing two decades of management decisions in how the corporate structure has been formed.;0
l9x3gdq;Reddit;2024-06-23 18:05:45;nobody in their right mind would argue that something that could be operated as a library should be a microservice. yes they would. been living under a rock? the op article is a response to that blanket mentality. when there actually is a material operational burden involved in deploying the service what the hell does that mean?;0
la0h51t;Reddit;2024-06-24 08:05:14;no no they literally had microservices. they converted it into a monoloth application. but it still runs on serverless but uses a single ecs task. it makes sense for them to use monolithic serverless function as they want to be able to process the videos as they come. and i would imagine this is highly variable. https;0
l9w2gtw;Reddit;2024-06-23 13:40:16;microservice architecture has unsurprisingly an emphasis on the small size of the services. soa on the other hand doesn't preach a particular size of deployed applications. soa puts the emphasis on the apis that's actually the meaning of service in soa. applications having a standardized formalized apis wasn't that omnipresent obvious as today. it was often the case that one application exposed several services. in contrast ms arch preaches separation of services into applications you could make an equation that service is an application.;0
l9vumq8;Reddit;2024-06-23 12:13:57;also the wrong answer size of the microservice is irrelevant it's about the services having no shared dependencies and able to run independently of one and other. if you have separated them into their own concerns why would they be doing http calls to other services breaking the dependency rule;0
l9vzk5e;Reddit;2024-06-23 13:10:32;microservices often communicate via rpc not over http. in that sense they to operate like function calls;0
l9wa9uk;Reddit;2024-06-23 14:50:18;distinct os service and then have them communicate with http instead of function calls. this is absolutely incorrect. if you are spitting up a monolith and splitting it into services using blocking http calls then you have totally missed the point of microservices. blocking http calls dont give you independent deployment and development. you want an event based architecture. each microservice has their own db kept in sync via events. you can google eventual consistency for more information.;0
l9zm10q;Reddit;2024-06-24 03:39:29;some yahoo in another team sees the code and flips it to public that's how. since it's all viewable in a giant codebase they can. slowly but surely all methods effectively are public if folks want. the alternative is forcing interfaces or being a total micro managing nutcase. forcing interfaces is the biggest win microservices across teams has. ...until the latest staff eng convinces the org to move to a mono repo with your microservices architecture. now you have the worse of all worlds since it's distributed network calls and everything can be easily flipped public!;0
l9wab3n;Reddit;2024-06-23 14:50:35;sounds like youre assuming that 1. your runtime actually enforces publicprivate object access and 2. other teams arent allowed to modify your teams code or write to your tables without permission. in my experience those are not things to be taken for granted. private methods arent firmly protected in ruby python etc. expectations on when its a good idea to import or change another teams code vary wildly based on organization and experience levels. the upside to microservices in this context is that its harder for other teams to take hard dependencies on things you didnt intentionally expose as part of your public api. these restrictions are easier to enforce when the other teams code isnt running in your process and their process doesnt have access to your database passwords.;0
l9wpxk3;Reddit;2024-06-23 16:41:35;when your new service ships everyone is upgraded at once ready or not. i have a bit of experience working with such an architecture. it's a recipe for disaster and i would hesitate to call it a microservice architecture. what you end up with is a monolithically deployed worstofbothworlds collection of tightly coupled services that gives you all the problems associated with microservices with none of the benefits. edit btw we ended up fixing that. not by moving to a monolith as the article suggests but by properly decoupling services.;0
l9xipq6;Reddit;2024-06-23 19:38:49;microservices are worse than the disease. 100000x slower calls between modules extra deployments no transactions refactoring becomes harder inevitably leading to a maintenance nightmare compile time errors become runtime errors etc..;0
l9xem9g;Reddit;2024-06-23 19:13:52;yes. you are right. what i like best about microservices is the fact that they're easy to use and you can just jump right in and start coding!;0
l9yqrmr;Reddit;2024-06-24 00:02:54;yeah i know what you mean. we implemented a colossal microservice system that was supposed to simplify and replace the existing mess of legacy services that ultimately querywrite data tofrom a single 3rd party source. the funny thing is that this project is kind of what you are proposing a lift and shift solution that would allow us to abandon the mess of adaptors and 12 hop roundtrip requests we had fallen into. but here we are multiple years down the road and incompetent leadership constant changes to our data model and the need to deliver something even if we haven't talked to our consumers and figured out what that thing actually is or even figured out who the hell our consumers are has led us to essentially build a monster of a system that nobody wants to use. so now we are building the adaptor layers for our consumers and and we need to segregate those adaptors by product! and its all becoming a big mess again.;0
l9wjcrk;Reddit;2024-06-23 15:57:56;most people who are doing this are using containers and are setting limits and letting something like the k8s scheduler handle eviction and moving services around. no place ive seen using microservices has been using nonclustered hosting. similarly all dbs have been out of cluster;0
l9wnm29;Reddit;2024-06-23 16:26:40;ok so addressing specific concerns into their own service is enough for it to be a micro service? in your example invoicing etc would typically be linked to a dedicated crm and there would be a small adapter that updates the crm. but that would violate one of the principles of being a microservice having its own database. as the crm would need to be centralized. microservice bros would add like layers of caches local copies instead of querying the crm directly to fetch the data and to display it. sounds like a strawman but shit like this happened to me. there are microservice purists shall i say. if independent business functions would have their own services and that would be it. i'd actually call myself a microservice fanboy. i personally don't like nosql and each service having its own independently deployed database.;0
l9xlyo4;Reddit;2024-06-23 19:58:19;your runtime actually enforces publicprivate object access this is a weird argument. i can use reflection to call a private method in .net but unless i absolutely have to i shouldn't. i should a find a different way of accomplishing my task or b talk to who wrote the method and ask them to offer a public method. expectations on when its a good idea to import or change another teams code vary wildly based on organization and experience levels. microservices aren't going to solve this team makes things private that shouldn't be this team circumvents access modifiers or these two teams don't talk to each other because justin is a poopiehead. at best they're going to hide such organizational problems which is bad in the long run.;0
l9wlunq;Reddit;2024-06-23 16:15:04;teams develop these modules in their own git repositories and publish them to a package repository like artifactory. then your application pulls them in as prebuilt binaries that can be plugged into your part of the application. you can compose the librariespackages together to form a larger application the way you would with microservices just using inprocess calls instead. its true that this application would need to be deployed as a monolith. but the point many are making is that the main benefit of microservices is less about scaling individual services and more about scaling organizationally by allowing teams to develop and release their part of the domain separately.;0
l9xigri;Reddit;2024-06-23 19:37:21;at some point you have to trust that your developers aren't trying to actively sabotage the integrity of the project and have noncode means to enforce this. after all this same question could be asked of code inside a microservice. what if some subcomponent decides to randomly delete records in the microservice database to solve some immediate problem and it breaks the application? that's either malfeasance or a bug and you deal with it accordingly.;0
l9ydvpd;Reddit;2024-06-23 22:44:34;its all about trade offs i guess. with a monolith that is deployed on a regular schedule you know when something could break and can roll back the version to a knowngood state. with microservices that are deployed on individual team schedules a break could happen at any time and knowing what broke things isnt always easy so rolling back to a knowngood state is harder. plus with microservices you have n teams rolling their own deployment processes with varying amounts of competence. as compared to a monolith where the sole deployment process can be hardened.;0
l9yvor5;Reddit;2024-06-24 00:35:07;i just realised everyone talking about microservices scaling better were missing the forest for the trees. microservices allow the right team to be quickly blamed for scaling issues forcing them to take ownership of their fuckup and fix it. that does have business organisational value. ive lost count of the number of times ive seen a team try to wriggle out of their responsibilities by blaming everyone but themselves. if theres only one overarching performance metric for the whole system this is possible. if each team builds their service in isolation it isnt.;0
l9ykwwb;Reddit;2024-06-23 23:25:57;while i'm in favor of a clean operational model some of these are not problems tied to monilith. you are talking about deployment model not development model. a module... how is a 20x slower downstream service any better? don't tell me in the same machine i can't stop that function from using all the cpus. thread pools have been used for years to provide the same feature with less overhead. seems like allowing developers to have zero sense of deployment model awareness and spamming threads everywhere just because thay can have their own environment is a great swe practice. team a... this point makes very little sense to me. which non faang service need 2 days to run a pipeline? they should see again if it takes more than 2 hours for a release pipeline. tests? if it's unrelated why should both test pipeline run together? if you refer to qa time how can a microservice model tests that the old team b code and new team a code is valid together in 2 days if the whole testing process take the same amount of time? you don't need to deploy both changes at the same time monolith or microservice. i agree that coupling release is terrible having to restart deployment machine is a no from me especially on things that rely on jit. point 3 4 5 feels like just a repeat of 1 and 2. im not original commenter nor i support him but i agree with his idea. a library offer much more flexibility than a microservice. i can easily adapt a library to a microservice not the otherway around. certain languages even support transparently using both. one such way is decorate the exposed object and forward them to the deployed actual service.;0
l9vzkar;Reddit;2024-06-23 13:10:35;again this doesn't mean anything. separation of concerns doesn't mean nothing in your system is allowed to communicate to another part of it. but if a microservice is to be inependent of other services then it can't do a http call as that would be a dependency service a should still work even if service b is down;0
l9w8oiy;Reddit;2024-06-23 14:37:05;it allows the development work to scale. you can have separate teams with separate deployment and monitoring efforts. microservices are almost always about allowing more people to work together on the same overall project. otherwise no one would opt for a distributed system. theyre much more complicated to build and maintain. you can just only have so many people working on a single codebase effectively;0
l9xildg;Reddit;2024-06-23 19:38:05;but splitting your code into multiple small services that communicate via http is still absolutely microservices. that is nothing but soa and that does not give you independent deployment and development which is the primary advantage of microservices.;0
l9z7apa;Reddit;2024-06-24 01:53:38;this is a weird argument. it is. it definitely is. it assumes that some of your coworkers will be psychopaths who disregard every aspect of good coding practice so they can ship some pile of shit an hour faster. that's insane. that should not happen. that said i've worked with people like that. i've encountered whole teams and even business divisions that work that way. so engineering in a way that protects your team and your services against that is unfortunately less silly than i'd like it to be. do microservices solve the organizational problems? no. they do however help contain them and limit the runtime fallout. you don't have to worry about the next team over the one with the psychos screwing with your database tables if they don't have access.;0
l9wbbu2;Reddit;2024-06-23 14:58:50;have you perhaps mistaken me for a fan of microservices or of monoliths? theres no one right answer in this field only a series of besteffort compromises.;0
l9x0r5u;Reddit;2024-06-23 17:49:15;if you have a heavyweight lookup service you only have to beef up the machine that's running it in order to perform lookups in the user request path. if you have a lookup library you have to beef up every machine that's performing lookups in the user request path. this is a problem that a whole lot of systems don't have. but it's hard to work around it without microservices if you do.;0
l9y7g8g;Reddit;2024-06-23 22:07:06;there are lots of ways for developers working on a codebase to step over unenforced boundaries without intending to do damage especially as the codebase gets older and more complex and the people who originally built it are in short supply. this is true generally just not about soa. i'm certainly not promoting microservices as a panacea but characterizing something that often doesn't work as pretty simple is a red flag for me.;0
l9y2g92;Reddit;2024-06-23 21:37:32;in what world is it easier to onboard a new developer by teaching the entire business domain vs one focused subdomain? false dichotomy. why would having a monolith require a new developer to learn the entire business domain? what are you talking about? it sounds like you are brainwashed to me. we have to use microservices otherwise we're going to have to teach every developer every aspect of our entire program! what?;0
