ID;Source;Creation Date;Content;Sentiment
l9w1rp8;Reddit;2024-06-23 13:33:21;you can do http calls. it's better if you do asynchronous communication but it's not forbidden. you can have stateless services that provide functionality just via restrpc calls. that's why the circuit breaker pattern was invented https service a should still be fault tolerant.;0
l9w1sey;Reddit;2024-06-23 13:33:33;you separate the domains you don't isolate them. they can still contact each other but they should be able to do simple business logic independently. caching data from other microservices is very common. they also commonly use the same database servers but with different schemas so they don't get entangled. that way you can just lift the individual schemas to separate database servers when scaling becomes an issue. a simple view of a microservice is as a single deployable unit including databases and stuff. this doesn't mean it can't require other services to do some work but it does mean it can't require other services to be deployed. so it can't require data from other services on load.;0
l9zfovi;Reddit;2024-06-24 02:53:37;yes eventually you will have one final test for the whole system but that's also true for a microservice solution no? no you don't. services are entirely tested in isolation and every team is only responsible for their component working correctly. support issues route directly to the responsible team if their part of the user experience is resultantly broken. you never have to test the system as a whole because the concerns are entirely separated. as long as each team integration tests their dependencies on other team's systems and the userfacing teams properly test their component then the system is holistically tested. as an example there's probably hundreds of teams and systems that end up feeding onto the product page on amazon. the vast majority of the testing of those components is happening so far down the chain that the teams who actually build the widgets for the userfacing web page doesn't even know about or think about what is happening in those systems. it's just a trusted contract and any issues get routed down the chain appropriately. by releasing a new version of their package? how is this any different from a third party package releasing a new version? and how does that actually get into the running production code? in a monolith someone ends up owning the deployment process and it means that every change is bottlenecked on that release. with soa each team fully owns their own deployments and there's no contention whatsoever for that process.;0
l9zvygp;Reddit;2024-06-24 04:52:48;yes eventually you will have one final test for the whole system but that's also true for a microservice solution no? no. think of microservices as saas sub processing but in house. when you use stripe in your app you never actually test their integration with visa. at most you do integration testing with mock data returned from stripe.;0
l9yy4fm;Reddit;2024-06-24 00:51:09;thats ignoring the premise of this entire conversation. the original comment stated that microservices solve an organizational issue. this is true. this isnt to say that theres no other solutions or that organizations could still be successful maintaining certain monoliths. but the implementation of that architecture is specifically to address that issue. and also i said every domain not every part of the program. as we keep stating microservices are appropriate with massively complex or diverse business domains. i have worked in companies with these types of problems that needed to be solved while also maintaining the monolith which was the core application or product. its not some kind of insane concept like you keep making it sound.;0
l9w9rqa;Reddit;2024-06-23 14:46:10;ive never worked on a true microservice system. i suspect unless you have an engineering org with 100s of people you dont need it. monoliths andor a systems with a few central components are underrated. in some sense its kind of weird to me to start with a distributed system design. seems like if you did that you over engineered up front. unless youre working in a domain that lends itself to being naturally distributed or something;0
la1yogf;Reddit;2024-06-24 16:33:45;there are ways to optimise. if you only commit what you change in one service in a modular monolith where services don't depend directly to each other then you can go thousands of commits every minute and even every second ad infinitum. nothing works for a shitty monolith though other than hacks definitely not microservices that's for sure. you need to be conscious on cohesion and coupling all the way to deployment from local to prod. it's not that you don't need. you simply can't do microservices at all sometimes.;0
l9wssmc;Reddit;2024-06-23 16:59:41;i've been writing software for over twenty years now and couldn't agree more. i actually came up with the exact same architecture style independently and dubbed it library first approach. in the end good architecture is about getting the boundaries right which is way easier to do in a monolithic code base which for example requires the same language being used. also requiring the teams to build libraries forces modularity in the same way that decentralised architectures such as microservices or scs do but without the cost and complexity of the network. you also still keep the ability to move one of the libs into its own independent service at any time. and just orchestrating a few libs within a main project enables modular reuse and composition again without all the headaches of the network. some languages make it easier to set up and enforce boundaries between modules and i wish more languages would make this a core concern but it's nonetheless easily possible to enforce boundaries without a network border. and it's definitely preferable.;0
l9x02bo;Reddit;2024-06-23 17:45:00;im trying to reason about how this is fundamentally different from microservices outside of replacing synchronous apis calls with in memory api calls which is definitely an improvement. i suppose another advantage is breaking api changes are caught right away and easily as the code will no longer compile. many of the drawbacks of microservices remain such as domains not being properly split up potential n1 queries everywhere cascading failures stale data etc. would love to hear your opinion on this maybe im missing something;0
l9wphrx;Reddit;2024-06-23 16:38:47;for whatever reason you might prefer runtime integration than build time. and multiple packages enforce the later. also especially on backend you don't need an additional layer to glue your dependencies. two reasons top of my head. i'm all in favor always choosing solution that fits your needs both business and organisation. be it packages monolith or microservices;0
la4i2eb;Reddit;2024-06-25 01:11:36;are you talking about web dev in the context of microservices she deployments? if so you can bundle the code dependant libraries using pnpm and restart the server using a load balancer to maintain uptime elastic beanstalk in aws or a lambda behind api gateway. runtime loading of libraries is not a problem in this context maybe a few kbs or mbs in the worst case scenario. of course in node there's the node modules problem which is fixed by not uploading the whole folder but rather rely on pnpm lock to build on the ci server.;0
la7dcok;Reddit;2024-06-25 15:40:23;it's the same thing one module per folder regardless of the language there's always a command to start and a script to deploy. only your runtime need to support the language. if your tech doesn't really allow good microservices implementation then go traditional servicebased. microservices is essentially a deployment strategy that requires efficient module design.;0
