ID;Source;Creation Date;Content;Sentiment
17502644;HackerNews;2018-07-11;“Recall that the original motivation for separating each destination codebase into its own repo was to isolate test failures. However, it turned out this was a false advantage. ”<p>At least they finally got to the right conclusion, they were on the wrong path to begin with.<p>People seem to be blaming Microservices when they weren’t even close to understanding what they were doing and why. I’d be much more interested in an article about issues faced with Microservices where they actually tried to slice their functionality based on their domain.;0
17502633;HackerNews;2018-07-11;If you're using microservices why are you using shared libraries? Wouldn't it make sense to break the common portion into a separate service and define an API for it?<p>I swear more people writing microservices need to read about flow-based programming and perhaps the actor model.;0
17502549;HackerNews;2018-07-10;"See the below response for more details. But that’s not how modern testing works (neither is my feature flag suggestion).<p><a href=""https://www.developerhandbook.com/unit-testing/writing-unit-tests-with-nunit-and-moq/"" rel=""nofollow"">https://www.developerhandbook.com/unit-testing/writing-unit-...</a><p>It works similarly in almost every language.<p><i>For a certain class of applications and organizational constraints, I also would prefer it. But it requires a much tighter alignment of implementation than microservices (e.g., you can't just release a new version of a component, you always have to release the whole application).</i><p>Why is that an issue with modern CI/CD tools? It’s easier to just press a button and have your application go to all of your servers based on a deployment group.<p>With a monolith, with a statically typed language, refactoring becomes a whole lot easier. You can easily tell which classes are being used, do globally guaranteed safe renames, and when your refactoring breaks something, you know st compile time or with the correct tooling even before you compile.";0
17502494;HackerNews;2018-07-10;I found the frustrations with microservices too setting up a pretty substantial ETL system using Amazon Lambda among other services.<p>Originally you couldn't trigger Lambda functions from SQS (seemingly the most obvious integration). You could use Kinesis but small print says Lambda concurrency is restricted to the Kinesis streams which gets very expensive.<p>Visibility/monitoring into most microservices is not good (Iron.io is quite nice but any concurrency is really expensive). I don't like the workflow for deployment and testing either.<p>So I shifted to single EC2 instance with my application and Beanstalkd w/ my own configurable workers. Way cheaper, easier to manage, normal programming workflow, etc.<p>For some use-cases Lambda and other services are really nice and efficient but there's usually a lot of hidden limitations so be sure to spend a lot of time evaluating before committing. You often spend way more time fighting the microservice drawbacks than the benefits are worth.;0
17502420;HackerNews;2018-07-10;Getting the feeling Segment didn't really stop using microservices.<p>Sounds like they just redrew their service boundary, from Integration APIs to Business Function.<p>Centrifuge sounds like a new service deals with connecting to integration APIs, so they've replaced 140+ services with one.<p>Another service they've spun up is Traffic Recorder, and its responsibility is to eliminate the need for http requests when testing integrations.<p>Feels like the biggest change is going from so many repos to a monorepo.;0
17502415;HackerNews;2018-07-10;"What exactly are you trying to accomplish?<p>If you are testing a single microservice and don’t want to test the dependent microservice - if you are trying to do a unit test and not an integration test, you are going to run against mock services.<p>If you are testing a monolith you are going to create separate test assemblies/modules that call your subject under test with mock dependencies.<p>They are both going to be part of your CI process then and either way you aren’t going to publish the artifacts until the tests pass.<p>Your deployment pipeline either way would be some type of deployment pipeline with some combination of manual and automated approvals with the same artifacts.<p>The whole discussion about which is easier is moot.<p>Edit: I just realized why this conversation is going sideways. Your initial assumptions were incorrect.<p><i>you may want to test only A: with monolithic architecture you'll have to produce another build of the application, that contains mock of B (or you need something like OSGi for runtime module discovery).</i><p>That’s not how modern testing is done.<p><a href=""https://www.developerhandbook.com/unit-testing/writing-unit-tests-with-nunit-and-moq/"" rel=""nofollow"">https://www.developerhandbook.com/unit-testing/writing-unit-...</a>";0
17502401;HackerNews;2018-07-10;"I have been doing some tech advice jobs on the side to see what's going on in the world and it's really scary what I found. Only yesterday I was talking with the cto of a niche social networking company that has a handful of users and probably won't get much more who was telling me the tech they use; Node, Go, Rust, Mongo, Kafka, some graph db I forgot, Redis, Python, React, Graphql, Cassandra, Blockchain (for their voting mechanism...), some document database I had never heard of and a lot more. A massive, brittle, SLOW (!) bag of microservices and technologies tied together where in 'every micro part' they used best practices as dictated by the big winners (Facebook, Google, whatever) in Medium blogs. It was a freak show for a company of 10 engineers. But this is not the first time I encounter it; 3 weeks ago, on the other side of the world, I found a company with about the same 'stack'.<p>People really drink the koolaid that is written on these sites and it is extremely detrimental to their companies. PostgreSQL with a nice boring Java/.NET layer would blow this stuff out of the water performance wise (for their <i>actual real life usecase</i>), would be far easier to manage, deploy, find people for etc. I mean; using these stacks is good for my wallet as advisor, but I have no clue why people do it when they are not even close to 1/100000th of Facebook.";0
17502400;HackerNews;2018-07-10;I like that they highlight the tradeoffs between isolating faults and optimizing resource utilization. However, you don't need microservices to achieve isolation. You can have different worker pools of the monolith configured to handle different destinations. The monolith actually gives you more flexibility in how you approach the tradeoff. With microservices you're forced into one pool of workers per destination, but with the monolith you can choose any mapping of pools to destinations that makes sense.;0
17502379;HackerNews;2018-07-10;The thing people failed to realize is that microservices are a way of structuring people in teams in an organization, not a way of structuring a product architecture.<p>To use words that are mine, microservices are a hack on Conway's law. One team should be responsible for 2-3 microservices and should have a lot of autonomy.;0
17502325;HackerNews;2018-07-10;"The problem is it's not clear when to use what. Some get confused and use it in the wrong place.  Here are some questions to ask before you use microservices.<p>Does the service need an independent and dedicated team to manage its complexities, or is it a &quot;part time&quot; job? Try a Stored Procedure first if its the second.<p>Is the existing organization structure (command hierarchy) prepared and ready for a dedicated service? (Conway's law) Remember, sharing a service introduces a dependency between all service users. Sharing ain't free.<p>Do you really have a scalability problem, or have you just not bothered to tune existing processes and queries?  Don't scrap a car just because it has a flat tire.";0
17502271;HackerNews;2018-07-10;Every microservice on its own little cluster of VMs for HA and performance...<p>A couple of hundred VMs is nothing in a scenario like that. Good luck trying to debug anything.;0
17502258;HackerNews;2018-07-10;You will end up with something like OSGi. That can be the right choice, but is also a quite 'heavyweight' architecture.<p>For a certain class of applications and organizational constraints, I also would prefer it. But it requires a much tighter alignment of implementation than microservices (e.g., you can't just release a new version of a component, you always have to release the whole application).;0
17502221;HackerNews;2018-07-10;Thesis: monoliths in one repo<p>Antithesis: microservices in separate repos<p>Synthesis: microservices in a monorepo;0
17502174;HackerNews;2018-07-10;I agree completely.<p>I think that regardless of whether microservices works for anyone or not, they came about to address a real issue that we still have, but that I’m not sure anyone has fully solved.<p>I think that microservices are an expression of us trying to get to a solution that enables loose coupling, hard isolation of compute based on categorical functions. We wanted a way to keep Bob from the other team from messing with our components.<p>I think most organizations really need a mixture of monolithic and microservices. If anyone jumps off the cliff with the attitude that one methodology is right or wrong, they deserve the outcome that they get. A lot of the blogs at the time espoused the benefits without bothering to explain that Microservices were perhaps a crescent wrench and really most of the time we needed a pair of pliers.;0
17502137;HackerNews;2018-07-10;"<i>&gt; Recall that the original motivation for separating each destination codebase into its own repo was to isolate test failures.</i><p>This seems like a weird reason to adopt microservices. Can't you isolate tests within the same repo using folders?";0
17502130;HackerNews;2018-07-10;I once scoffed at microservices.<p>Then I was tasked with building a scalable platform around a message broker system.<p>Then the switch clicked. I get it now.;0
17502121;HackerNews;2018-07-10;This misses the mark completely.  A separate repo and service simply for different serialization and routing?  Each performing the same basic function.  That’s not a legitimate use-case for microservice separation and was doomed from the start.;0
17502120;HackerNews;2018-07-10;It's exactly the other way around:<p>If you can afford all your components sharing the same database without creating a big dependency hell, then your problem is _too small_ for microservices.<p>If your problem is so large that you have to split it up to manage its complexity, start considering microservices (it might still not be the right option for you).;0
17501902;HackerNews;2018-07-10;"<i>I'd wager that microservices, a lot of the time, are basically used as a management structure</i><p>Conway’s Law in action, or in reverse <a href=""https://en.wikipedia.org/wiki/Conway's_law"" rel=""nofollow"">https://en.wikipedia.org/wiki/Conway's_law</a>";0
17501896;HackerNews;2018-07-10;Yeah. We're currently in a second push to introduce microservices and this time I'm on board. The first time was more about enforcing code ownership and such, and that was going to be a mess.<p>Now, people are  pondering things like: Ok, management of elasticsearch has performance issues and it's a general pain if the elasticsearch documents change. So let's try to move the schema of elasticsearch documents into a strictly semver'd artifact. And let's move management of our search indexes into a service depending on that artifact, so the schema changes in a controlled way. And ops and the search team can scale and optimize the service as they need to minimize search outages.<p>Creating smaller services based on problems is a good thing.  Creating smaller services because of ... reasons... not so much.;0
17501730;HackerNews;2018-07-10;"Didn't take long for &quot;we used shared libraries, and then found out we couldn't deploy independently&quot;. Sounds like you weren't quite doing microservices?";0
17501685;HackerNews;2018-07-10;They're both bad.  It feels like a reverse Sophie's Choice to have to pick one.<p>The real friction in the system is always in the boundaries between systems. With microservices it's all boundaries.  Instead of a Ball of Mud you have Trees and No Forest.   Refactoring is a bloody nightmare.  Perf Analysis is a game of finger pointing that you can't defuse.;0
17501557;HackerNews;2018-07-10;We should bring Categorical concepts into microservices. Maintain compose-ability between entities rather than forming a graph of intercommunicating objects similar to OOP.<p>I don't know if adhering to these principles will make microservices better.;0
17501549;HackerNews;2018-07-10;There's actually no reason you can't architect microservices like this. You can put RabbitMQ or some AMQP service as a comm layer between services. But then you have to architect your system to be event-driven. It's not a bad approach.;0
17501542;HackerNews;2018-07-10;well, we can think of the synthesis as returning to monolithic services with the understanding the sufferings of microservices.;0
17501467;HackerNews;2018-07-10;This is really missing the point. Microservices are not about code organisation - they are about runtime separation.<p>And even kernels have kernel threads, which are basically local microservices. Anything which needs to scale beyond a single system is more deserving of microservices than a kernel.;0
17501462;HackerNews;2018-07-10;But does this timeline apply to microservices or monoliths? Methinks both...;0
17501451;HackerNews;2018-07-10;"I can't help but think that this is an experience report covering &quot;microservices-done-wrong considered harmful&quot;. There are definitely pitfalls to the microservice approach, but there are canonical answers to all of these issues. That said, the right approach is the one that fits with your team's disposition, skill-set, and experience level, so ditching microservices might well have been the correct choice in this case.<p>&gt; Eventually, all of them were using different versions of these shared libraries. We could’ve built tools to automate rolling out changes, but at this point, not only was developer productivity suffering but we began to encounter other issues with the microservice architecture.<p>In the extreme case where you have 150 microservices and 3 devs, I think that spending a few days to build a tool that auto-updates your common deps and re-runs your tests would be a good investment. Or you could pay someone else to do this with a service like <a href=""https://www.dependencies.io/"" rel=""nofollow"">https://www.dependencies.io/</a>. Handling common code is one of the known pain points in microservices, so it's worth tackling head-on. (Last I saw Netflix handles this by the rule &quot;no services can share code unless it's by an open source library&quot;, which encourages common code to be thoughtfully packaged and released.)<p>&gt; The additional problem is that each service had a distinct load pattern. Some services would handle a handful of events per day while others handled thousands of events per second. For destinations that handled a small number of events, an operator would have to manually scale the service up to meet demand whenever there was an unexpected spike in load.<p>I can see this being tricky to tune, and am hesitant to opine without knowing the details, but if you can fix the problem by bundling all the services into a single monolith (i.e. aggregating all load into N nodes), then you should also be able to fix the problem by using a cluster scheduler like k8s with equivalently sized nodes. As long as you don't have bursts that are an integer factor of your baseline system load, both approaches should work equivalently (to the first order). It sounds like they were running individual instance(s) per microservice, which isn't a good fit for very bursty services.<p>And as a bonus, with a cluster scheduler you get a number of primitives to do resource reservation, which you don't get for free if you're merging all of your services back inside a single monolith. This means the problem of back-pressure from a single misbehaving endpoint -- which was one of the reasons they moved to microservices in the first place -- will probably come up in some form down the road.<p>&gt; Recall that the original motivation for separating each destination codebase into its own repo was to isolate test failures. However, it turned out this was a false advantage. Tests that made HTTP requests were still failing with some frequency. With destinations separated into their own repos, there was little motivation to clean up failing tests. This poor hygiene led to a constant source of frustrating technical debt.<p>I don't have anything to say here except... don't do this? If your tests are failing you should be fixing your tests (or removing them if they aren't adding value), not adding new integrations. Consistently-failing tests are a big warning sign that your CI/CD process is not in good shape, and a healthy CI/CD process is a strict precursor to doing microservices successfully.<p>&gt; The outbound HTTP requests to destination endpoints during the test run was the primary cause of failing tests. Unrelated issues like expired credentials shouldn’t fail tests.<p>Your UTs shouldn't be hitting your external dependencies; the correct solution here is the one that they eventually landed on, i.e. to either record/replay real HTTP requests, or to mock out the HTTP responses manually. You still need real integration and smoke tests in a production-like environment to make sure that you've not missed a change in the remote API schema. IME this is one of the biggest challenges of working with external APIs, and I don't envy the task of maintaining 150 integrations, however this issue seems unrelated to microservices.";0
17501431;HackerNews;2018-07-10;"<p><pre><code>  +
  -js
  -java
    -monolith.jar {guava, netty, etc }
      -svc1
      -svc2
  -python
  -go
</code></pre>
For biz code, I've seen this kind of lib-ifying architecture provide a nice microservices workflow. The unifying heuristic is: Any dependency goes into the lib project. Anything unique to the service that requires no dep should usually go into the service project. The nice thing about this is it modular with fast compiles and preserves optionality. Since everyone is using the same deps, the code can live in the svc project or the lib project. A bit of namespacing convention makes it's trivial to shuttle the code between the two projects to wherever it's most natural to have it.";0
17501375;HackerNews;2018-07-10;"the model in GP is useful, but it doesn't account for the unequal distribution of information.  e.g.  some people are perceiving the cycle at a different phase and can be convinced  to work &quot;harder, not smart&quot; for an interval to shift their position within the cycle.<p>E.g. &quot;Let's get really good at microservices so we don't need a monolith.&quot;  IOW there's no consensus about when to dig in and go deeper.  And even if there was, some people would leverage that information and try to pull ahead of the others digging in.";0
17501322;HackerNews;2018-07-10;Easy until you have 100,000 of them anyway, in which case it's expensive and slow to run it for every dev. (At that point you have enough devs that microservices 100% make sense, though);0
17501319;HackerNews;2018-07-10;"The whole article reads like BS to me.<p>So the initial problem was a single queue? Well, then split the queue, no need to go all crazy splitting all the code.<p>Switching to 100+ microservices? There is no need to switch to 100+ repos too, runtime services don't need to have one repo per service, just use a modular approach, or even feature flags.<p>100+ microservices, some of them with much lower load than others? Then consolidate the lower load ones, no need to consolidate &quot;all&quot; of the microservices at once.<p>Library inconsistencies between services? No, just no, always use the same library version for all services. Automate importing/updating the libraries if you need to.<p>A single change breaks tests in a way you need to fix unrelated code? WTF, don't you have unit tests to ensure service boundary consistency and API contracts?<p>Little motivation to clean up failing tests? Yeah... you're doing it wrong.<p>Only then you figure out to record traffic for the tests? HUGE FACEPALM, that's the FIRST thing you should do when dealing with remote services!";0
17501314;HackerNews;2018-07-10;I think what was missed, in the article, is that the fundamental problem was centered around a shared architecture of destinations and shared code.<p>You cannot possibly have every destination be a separate repo and then have the development lifecycle of your shared code be so active that it ultimately puts at risk the architecture of your entire organization.<p>What makes shared code so perfect is having stability such that you extract your variant code into your non-shared code. Shared code should evolve at a much slower pace than your non-shared code or you risk this very outcome.<p>Microservices are not dead, nor are they the solution to everything. We need better architects.;0
17501308;HackerNews;2018-07-10;"I'm not sure how worthwhile it is writing any more &quot;microservices are dumb&quot; articles - all the people who have spent the last 5 years leaving microservice messes in their wake appear to have moved on to creating &quot;serverless&quot; messes of lambda functions which people like you and me are going to be going around tidying up in about 5 years from now.";0
17501296;HackerNews;2018-07-10;"(a) a prototype
(b) a set of applications that share a database.<p>You would have to have an oddly disconnected schema if modifications to the program don't result in programs accessing parts of the database that other programs are already accessing. If this isn't a problem it means you're using your database as nature intended and letting it provide a language-neutral, shared repository with transactional and consistency guarantees.<p>so maybe not microservices, but fine nonetheless.<p>EDIT: two more comments:<p>- this is exactly what relational databases were designed for. If people can't do this with their micro-services, maybe their choice of database is the issue.<p>- &quot;micro-service&quot; as the original post suggests, is not synonymous with good. &quot;monolith&quot; is only synonymous with bad because it got run-over by the hype-train. If you have something that works well, be happy. Most people don't.";0
17501225;HackerNews;2018-07-10;"One example I'm familiar with that <i>sounds</i> like microservices is the Robot Operating System (ROS). At its heart it's just a framework for pub/sub over IP, it just happens to be targeted towards robotics. A ROS system comprises of 'nodes' for each logical operation e.g. image acquisition -&gt; camera calibration -&gt; analysis -&gt; output.<p>The system is defined by a graph of these nodes, since you can pipe messages wherever they're needed; all nodes can be many-many. Each node is a self-contained application which communicates to a master node via tcp/ip (like most pub/sub systems a master node is requried to tell nodes where to send messages). So you can do cool stuff like have lots of seprate networked computers all talking to each other (fairly) easily.<p>It works pretty well and once you've got a particular node stable - e.g. the node that acquires images - you don't need to touch it. If you need to refactor or bugfix, you only edit that code. If you need to test new things, you can just drop them into an existing system because there's separation between the code (e.g. you just tell the system what your new node will publish/subscribe and it'll do the rest).<p>There is definitely a feeling of duct tape and glue, since you're often using nodes made by lots of different people, some of which are maintainted, others aren't, different naming conventions, etc. However, I think that's just because ROS is designed to be as generic as possible, rather than a side effect of it running like a microservice.";0
17501224;HackerNews;2018-07-10;In my experience, there's a lot of cargo culting around microservices. The benefits are conferred by having a strong team that pays attention to architecture and good engineering practices.<p>Regardless of whether you are a monolith or a large zoo of services, it works when the team is rigorous about separation of concerns and carefully testing both the happy path and the failure modes.<p>Where I've seen monoliths fail, it was developers not being rigorous/conscientious/intentional enough at the module boundaries. With microservices... same thing.;0
17501208;HackerNews;2018-07-10;I'm thinking it's more of a software business life cycle. Microservices are somewhat easier to deploy, which makes it easy for developers to add capabilities to be used by UX developers. Once the eye candy and rough functionality is in place, the sales team signs up new clients. The company draws down investment in developers and puts more money into infrastructure. The product moves from developer land to system land which is monolithic and can handle heavier loads.;0
17501175;HackerNews;2018-07-10;<i>I'd wager that microservices, a lot of the time, are basically used as a management structure rather than for their benefits as pure tech</i><p>A lot of software is used to control or impose someone's will on others organizationally.;0
