ID;Source;Creation Date;Content;Sentiment
17501150;HackerNews;2018-07-10;How on earth did you end up with 100s of services?<p>I can't imagine you have applied Conway's law.<p>I think there's some serious confusion between FaaS and microservice architecture.;0
17501138;HackerNews;2018-07-10;"Microservice based architecture will continue to be used quite a bit as many weaker engineering leads have latched onto it as a way to solve interpersonal problems on their team and letting everyone have their own little fiefdoms.  It creates a terrible scenario and a very dysfunctional team, but the hype cycle and a few high scale orgs mentioning it means its part of the &quot;mainstream&quot; now and something that ill-informed leads will be pushing for the next decade, whether it makes sense for the specific context (it doesn't) or not.";0
17501108;HackerNews;2018-07-10;"I have had thinkings on how efficient Micro services are compared to a Monolith.<p>In a micro service architecture, the request bounces through different service layers, json serialization, network transfers.<p>In a monthlith normal application, especially if its on one machine, the request touches main memory and then CPU cache.<p>Latency Numbers Every Programmer Should Know, I especially think of the Send 1K bytes over 1 Gbps network vs cache latency of microservices/monolith.
<a href=""https://gist.github.com/jboner/2841832"" rel=""nofollow"">https://gist.github.com/jboner/2841832</a><p>Ie instead of micro services 10000 ns for a network transfer you could fetch within 10ns from CPU cache in a monolith, that is 1000 times more efficient.<p>Are we beyond the peak of inflated expectations on Micro services and towards the Plateau of productivity?
<a href=""https://en.wikipedia.org/wiki/Hype_cycle"" rel=""nofollow"">https://en.wikipedia.org/wiki/Hype_cycle</a>";0
17501088;HackerNews;2018-07-10;"&gt;  Just as bad, just in a different way.<p>Actually worse in many ways:<p>- Harder to test<p>- Harder to debug<p>- Harder to deploy<p>- Harder to monitor<p>- Harder to reason about, refactor, change/add functionality<p>- You've (basically) turned a lot of the operations your services need to perform into RPCs, probably killing performance on top of everything else, leading to<p>- More complex/demanding (or just MOAR) infrastructure requirements<p>- Higher dev, maintenance and infrastructure costs<p>- Slower delivery of value to the business and customers<p>- Potentially crippling opportunity costs<p>It surprises me how often people don't see this coming. Seriously: keep your systems as simple as you possibly can. Unless you're Netflix, dozens or hundreds of microservices probably isn't as simple as you possibly can.";0
17501083;HackerNews;2018-07-10;"&gt; Our initial microservice architecture worked for a time, solving the immediate performance issues in our pipeline by isolating the destinations from each other. However, we weren’t set up to scale. We lacked the proper tooling for testing and deploying the microservices when bulk updates were needed. As a result, our developer productivity quickly declined.<p>Well, I'm not surprised. Microservices are made possible by advances in automated testing, CI, and deployment. You should have those things anyway, even if you have a monolith -- but to go to microservices without them is a pretty bad decision.";0
17500967;HackerNews;2018-07-10;"&gt;I think that with the rise in popularity of functions as a service (lambda, gcf, azure), we are heading more and more towards nanoservices.<p>There are some pretty big asterisks next to running &quot;nanoservices&quot;. Mostly how expensive they actually are to run at large scale and the weird caveats that can happen due to them not always being up.<p>And I wouldn't advocate for &quot;always-up nanoservices&quot;.<p>The basic answer to both &quot;nanoservices&quot; and microservices is do what you think is right but don't go too far. There are good reasons to make a nanoservice and good reasons not to, same with microservices.";0
17500945;HackerNews;2018-07-10;"This coincides with my own experiences in the financial sector. Distributed computing is undoubtedly the way to scale, but the trick is making the distributed nature of the system completely invisible (or as much as possible) to the developers, the applications and the supporting staff.<p>I have seen this phenomena of thinking that a large system, broken down into tiny parts, is somehow easier to manage time and time again over 30 years of development. In every case, the one thing the central thinkers fail to realize is that complexity is like conservation of energy - it can be transformed, but it cannot be destroyed.<p>Also, when it comes to large teams I have seen one thing work when it comes to sharing a resource(s) critical to a larger system - shared pain.  If the central/reusable  code/service breaks everyone's stuff, then everyone forms a team to immediately address the problem before continuing on. The solution is almost never &quot;find a way to let the other teams continue while something important is on fire.&quot; It seems like a major motivation for a microservices architecture seeks to avoid the pain - which perhaps is not the best reason to use microservices.<p>I like the idea of unseen, but indispensable, complexity. For instance, the human brain is probably the most complex thing in the world, but the interface is fairly simple :)";0
17500931;HackerNews;2018-07-10;If you have 140 somewhat similar entities that all share common code, then they don't fullfill the very important microservice criterion of being independent. In your case, I would recommend to use a plugin based system. Do it the other way around, have 1 application that contains the common code (previously shared library code) and create 140 plugins. This way you can update the single application, load all plugins, execute the tests, check if everything is fine and deploy the application. Every plugin can live in its own repository and can be versioned separately, but a new version can only be deployed if it works with the latest version of the application.;0
17500902;HackerNews;2018-07-10;"&gt;It's worse than that; it's my observation that most microservice architectures just ignore consistency altogether (&quot;we don't need no stinking transactions!&quot;) and blindly follow the happy path.<p>If two microservices have to share databases, they shouldn't be microservices.<p>One microservice should have write access to one database and preferably, all read requests run through that microservice for exactly the reason you mentioned.<p>&gt;I've never quite understood why people think that taking software modules and separating them by a slow, unreliable network connection with tedious hand-wired REST processing should somehow make an architecture better.<p>If you're running microservices between regions and communicating with each other outside of the network it is living in, you're probably doing it wrong.<p>Microservices shouldn't have to incur the cost of going from SF to China and back. If one lives in SF, all should and you can co-locate the entire ecosystem (+1 for &quot;only huge companies with big requirements should do microservices&quot;)<p>&gt;ustomers couldn't care less, except that it now takes far longer to implement features that cross multiple services - which, if you've decomposed your services zealously enough, is pretty much all of them.<p>Again, that is an example of microservices gone wrong. You'll have the same amount of changes even in a monolith and I'd argue adding new features is safer in microservices (No worries of causing side effects, etc).<p>I will give you +1 on that anyway because I designed a &quot;microservice&quot; that ended up being 3 microservices because of dumb requirements. It probably could've been a monolith quite happily.";0
17500887;HackerNews;2018-07-10;It’s basically a feature flag. I don’t like feature flags but it is a thing.<p>But if you are testing an artifact, why isn’t the artifact testing part of your CI process? What you want to do is no more or less an anti pattern than swapping out mock services to test a microservice.<p>I’m assuming the use of a service discovery tool to determine what gets run. Either way, you could screw it up by it being misconfigured.;0
17500884;HackerNews;2018-07-10;"I'd wager that microservices, a lot of the time, are basically used as a management structure rather than for their benefits as pure tech, so less mature teams can silo themselves off and avoid communication (e.g. &quot;I can work just on my backend image processing bit without dealing with the React guys now&quot;, &quot;now the CTO won't be on my back so much,&quot; or whatever).<p>The irony being that anything approaching SOA (or microservices) requires exactly the same amount of communication. More likely they require more since it's almost certain that such a decision introduced chaos.";0
17500880;HackerNews;2018-07-10;"Look at the package dependency tree of an average linux program. They are absolutely examples of &quot;microservices&quot; talking to each other.";0
17500872;HackerNews;2018-07-10;"&gt;The first item on the list was to consolidate the now over 140 services into a single service.<p>software engineering walks in circles. NoSQL people seem to be growing up and learning about consistency and transactionality.  I'm waiting for somebody to discover threads and shared variables back as a revolutionary way to improve performance and greatly simplify the implementation of a system of &quot;actors&quot;.<p>Joking aside,  i think greatest reason for Segment's microservices failure was that they didn't use Kubernetes.";0
17500870;HackerNews;2018-07-10;Sometimes, I've seen a lack of regard for data consistency within a monolith.<p>That is not completely on the developer, either. Pre 4.0 Mongodb, for example, does not do transactions. On the other hand, I've seen some pretty flagrant disregard for it just because there are not atomicity guarantees.<p>Microservices makes reasoning on that harder.;0
17500869;HackerNews;2018-07-10;"Surely this is &quot;no true scotsman&quot;? They've tried microservices and it didn't work for them, you're saying that if only they'd &quot;fixed&quot; their micro-services architecture it would have worked?";0
17500861;HackerNews;2018-07-10;"A number of comments touched on this, that microservices are also an organizational strategy: you have a team that manages that particular service.<p>My company is probably typical in that we implicitly use microservices because we have consume dozens of microservices <i>provided by other companies</i>.<p>We only have a handful of services we maintain, each with dedicated engineers.<p>And what becomes a service? You want to answer two questions:<p>1. Does it have a concrete business justification?
2. Does it have clear functional requirements?<p>If it has a business justification, it will get people assigned to keeping it running. If it has clear functional requirements, it will make sense to the people working on it which service does what.<p>That's still pretty vague, so you want to look at who has done it well, and why it worked for them.<p>Companies like AWS have been extremely successful in using microservices because every last one service has a business rationale, it's either directly making money (EC2, S3, SQS) <i>or</i> it supports the needs of customers who are using a service that makes money (VPC, Cloudformation, all their internal auth, billing, provisioning, security and such).<p>The caveat there is that the big B2B service providers are not a great model for companies that have a lot of business logic.";0
17500857;HackerNews;2018-07-10;If you're going to go microservices, you want service A to use service B's public API (MQ or RPC or whatever), not to quietly depend on the schema B happened to choose. And sharing a database server instance turns overloads into cascading failures, unless the stack is <i>very</i> good at enforcing resource limits on noisy neighbors.;0
17500851;HackerNews;2018-07-10;"To be blunt, its news to a lot of people, but it also isn't wrong. Microservices really shouldn't share a database, and if they do then they aren't &quot;microservices&quot;.";0
17500817;HackerNews;2018-07-10;Running E2E blackbox test is equally simple for all kinds of architectures, especially today, when it's so easy to create a clean test environment with multiple containers even on developer's machine. It may be harder to automate this process for a distributed system, but, frankly speaking, I don't see a big difference between a docker-compose file or a launch script for monolith - I've been writing such tests for distributed systems casually for several years and from my personal experience it's much easier to process the test output and debug the microservices than monolithic applications.;0
17500814;HackerNews;2018-07-10;Reading this post-mortem was very useful, and I appreciate the segment engineering team sharing it.<p>It seems like the primary problem causes were flaky/unreliable tests, and difficulty making coordinated changes across many small repositories.<p>Having worked on similar projects before (and currently), with a small team driving microservices oriented projects, I would probably recommend:<p>1) single repository to allow easy coordinated changes.<p>2) a build system that only runs tests that are downstream of the change you made (Bazel is my favorite here, but others exist). This means all services use the HEAD version of libraries, and you find out if a library change broke one of the services you didn't think about. This also allows for faster performance.<p>3) Emphasis on making tests reliable. Mock out external services, or if you must reach out to dependencies use  conditional test execution, like golang's Skip or junit's Assume if you can't verify a working connection.<p>If you still can't build a reliable service with those choices, then it's time to think about changing the architecture.;0
17500794;HackerNews;2018-07-10;They used microservices to paper over poor testing hygiene and software architecture. Forking one service into a bunch of different flavors of the same service multiplied the maintenance complexity. Services/microservices that are tightly coupled to shared libraries with lots of surface area  are an anti-pattern. Instead, I would make the shared libraries into a service, and make a standard interface for the destinations as plugins.;0
17500755;HackerNews;2018-07-10;OP can correct me if I'm wrong, but I believe the comment around Segements engineering team was most likely referencing the original decision to create hundreds of microservices in the first place.;0
17500735;HackerNews;2018-07-10;The fix, then, is to put that commonality into a new microservice the other microservices call.<p>The more I read about the problems people have with microservices, the more I'm convinced they've never read about flow-based programming.;0
17500668;HackerNews;2018-07-10;"&quot;packages&quot; and &quot;ports&quot; are both collections of &quot;microservices&quot; in your analogy, so you can't really assert the whole thing is a monolith.";0
17500661;HackerNews;2018-07-10;"The important part here, that the parent addressed, is the statement &quot;small team&quot;, as an organizational structure distinct from, say, a &quot;large team&quot; which has the opportunity to experience Conway's law.<p>It sounds like Segment very much prematurely optimized. Microservices is probably not a great approach below 20 developers, and becomes necessary past 100, at least in my experience.";0
17500657;HackerNews;2018-07-10;This is a classic case of not understanding micro services and trying to fit a problem around a tool.<p>At work, we have close to ~50 services(no one calls them microservices), but they do not suffer from this brittleness. We segregate our services based on languages. So, all C services go under coco/ , all Java services go under jumanji/ , all go services go under goat/ , all JS services go under js/. This means, everytime you touch something under a repo, it affects everyone. You are forced to use existing code or improve it, or you risk breaking code for everyone else. What does this solve? This solves the fundamental problem a lot of leetcode/hackerrank monkeys miss, programming is a Social activity it is not a go into a cave and come out with a perfect solution in a month activity. More interaction among developers means Engineers are forced to account for trade offs. Software Engineering in its entirety is all about trade offs, unlike theoretical Comp Science.<p>Anyway, this helps because as Engineers we must respect and account for other Engineers decisions. This methods helps tremendously to do this. No one complains, everyone who wants 1000 more microservices usually turns out to be a code monkey entangled in new fad, or who doesn't want to work with other Engineers.<p>You want to use rust? There is a repo named fe2O3/, go on. Accountability and responsibility is on your shoulders now.<p>If you think about it, an Engineer is tied to his tools, why not segregate repos at language level instead of some arbitrary boundary no one knows about in a dynamic ecosystem?;0
17500651;HackerNews;2018-07-10;Working at a large tech company, we tend to approach microservice division as information authority division.<p>If the data doesn't need to exist in the same database, put it in a new service with a separate database (or at least completely independent tables).<p>Ideally there is no shared code between services (and there shouldn't need to be, because each service owns completely disparate data), so the only coupling is the API definitions.<p>Each service is free to use whatever internal architecture they see fit as long as they honor the API definitions they provide to their dependent services.<p>In the case outlined in the article, the fact that each microservice had similar enough concerns to all use some common libraries and the same database makes me doubt that this should ever have been built as microservices to begin with.;0
17500639;HackerNews;2018-07-10;iamleppert does address that. As they said, microservices are supposed to mirror the structure of your team(s).<p>A single team should never be maintaining 140 different microservices. That's not a failing of the microservices architecture, that is a failing of massively abusing the microservices architecture. Arguably, a small team should never be managing more than 10 services (totally arbitrary number, but it seems like the upper limit to what a human can focus on).;0
17500620;HackerNews;2018-07-10;"That doesn't really say anything though: &quot;Things were bad, and it felt out of control, because of microservices. They didn't work, and actually made things worse and more complex. The things that were supposed to be good were bad. We didn't do good work, we did bad work, and slowly.&quot;<p>How do you address something like that coherently? I sort of agree with the OP, it kinda sounds like they just didn't know what they were doing. Or maybe that quote wasn't really the meat of their complaint?";0
17500613;HackerNews;2018-07-10;I'm hardly a microservice apologist, but sharing code or data  across services is a major smell. It means these things are related, and should likely be bundled together. Don't just break a service apart because it's de rigueur.;0
17500605;HackerNews;2018-07-10;"&gt; Usually microservices have their own databases<p>That's news to me, and seems insane.<p>Unless you mean &quot;their own database tables&quot;, not &quot;database servers&quot;. But that's just the same as having multiple directories and files in a Unix filesystem.";0
17500600;HackerNews;2018-07-10;"&quot;microservices is the architecture du jour&quot;<p>? There is nothing new about microservices. They've been a hot topic for far longer than Segment has been an idea.";0
17500592;HackerNews;2018-07-10;When I was designing a microservices architecture for a former employee, the justification for it was security. We needed separation of the components in the system because we were going to be handling money. It used ZeroMQ for communication, because I wanted something more lightweight and falut-resistant for message passing (in such a sensitive application, we didn't want to trust the network). Although it was of course fun to design, microservices weren't my first choice. It just made sense to us to use it in that particular scenario.;0
17500588;HackerNews;2018-07-10;"Nothing you said addresses the issues they mentioned:<p>&gt; In early 2017 we reached a tipping point with a core piece of Segment’s product. It seemed as if we were falling from the microservices tree, hitting every branch on the way down. Instead of enabling us to move faster, the small team found themselves mired in exploding complexity. Essential benefits of this architecture became burdens. As our velocity plummeted, our defect rate exploded.";0
17500578;HackerNews;2018-07-10;"But there is a big difference. These small targeted programs are invoked in user land, usually by the user. Microservices get invoked directly by the user when debugging is going on. Otherwise they are expected to automagically talk to each other and depending on the abstraction even discovery each other automatically.<p>Also I can pipe these tools together from the same terminal session, like<p><pre><code>  tail -f foo | grep something | awk ...
</code></pre>
You don't have that in general with Microservices. Unix tools <i>are</i> Lego, Microservices aren't. They are Domino at best.<p>Probably one could come up with an abstraction to do Lego with Microservices but we're not there yet.";0
17500577;HackerNews;2018-07-10;Before you go down the path of splitting your app up into microservices you should grok erlang/BEAM/OTP. Lots of thinking went into its creation that leads to highly reliable real time systems and at the very least some of the ideas can be lifted in informing how to best design things. (But really, you should probably just use it instead.);0
17500549;HackerNews;2018-07-10;Some people call this... microservices!  Common advice is that a microservice should align with a bounded context in domain driven design, which can involve a LOT of code.<p>Many large companies have millions of LOC behind their microservices.  Your average startup probably doesn't.;0
17500536;HackerNews;2018-07-10;"With web apps the main concern is data consistency between relations. On the OS level you have these same concerns with memory and disk, and there's database-like systems in the kernel and drivers to handle it. Essentially all these utilities are running within the same &quot;database&quot; which is disk and memory management handled by the kernel. Usually microservices have their own databases, which is where consistency hell begins";0
17500525;HackerNews;2018-07-10;In this case it sounds like they started with a microservice architecture, but CI/CD automation necessary for robust testing and auto-scaling was not in place. The problem of queues getting backed up might have been addressed by adding a circuit breaker, but instead they chose to introduce shared libraries (again, without necessary testing and deployment), which resulted in very tight coupling of the so-called microservices.;0
17500519;HackerNews;2018-07-10;"Yes, but &quot;monolithic&quot; web applications can be built in the same way. It might not be a 100% accurate usage of the term, but microservice/SOA advocates love to call modular applications monliths anyways, to the point that it's something that most people seem to do.";0
17500517;HackerNews;2018-07-10;I don’t see any reason you shouldn’t always design a system as domain specific micro services.<p>Now those micro services shouldn’t always be out of process modules that communicate over HTTP/queues, etc. A microservice can just as easily be separately compiled modules within a monolithic solution with different namespaces, public versus private classes, and communicate with each other in process.<p>Then if you see that you need to share a “service” across teams/projects, or a module needs to be separately, deployed, scaled, it’s quite easy to separate out the service into versioned packages or a separate out of process service.;0
