ID;Source;Creation Date;Content;Sentiment
17505262;HackerNews;2018-07-11;"Interesting perspective. I think that seeking and naming patterns &quot;microservices&quot;, &quot;agile&quot;, etc. is useful. It provides something like a domain specific language that allows a higher level conversation to take place.<p>The problem, as your identify, is that once a pattern has been identified people too easily line up behind it and denigrate the &quot;contrasting&quot; pattern. The abstraction becomes opaque. We're used to simplistic narratives of good vs evil, my team vs your team, etc. and our tendency to embrace these narratives leads to dumb pointless conversations driven more be ideology than any desire to find truth.";0
17505238;HackerNews;2018-07-11;"&gt; What exactly are you trying to accomplish?
Good test must verify the contract on the system boundaries: in case of the API, it's verification done by calling the API. We are discussing two options here: integrated application, hosting multiple APIs, and microservice architecture. Verification on the system boundaries means running the app, not running a unit test (unit tests are good, but serve different purpose). Feature flags make it only worse, because testing with them covers only non-production branches of your code.<p>&gt; Your initial assumptions were incorrect.
With nearly 20 years of engineering and management experience, I know very well how modern testing is done. :)";0
17505205;HackerNews;2018-07-11;It is weird that they took on some problems so easy. Shared libraries is one point. To get them right for hundreds slightly different services is something I don't even want to think about. The only strategy I can come up with is to maintain them as if they're a 3rd party lib and cannot contain business logic. So you're forced to build solutions around them and not with them.<p>Then there have been quite a few warnings to not use shared code in microservices.;0
17505131;HackerNews;2018-07-11;"As a microservice agnostic, i wonder how you can deal elegantly with transactions across services, concurrent access &amp; locks, etc. [Disclaimer: i have not read the article yet]";0
17505111;HackerNews;2018-07-11;"Another article with the TL;DR similar to &quot;we jumped blindly on the bandwagon, did obvious mistakes along the way, and microservices are the root of all evil&quot;.<p>Thanks, but no thanks.";0
17505040;HackerNews;2018-07-11;"&gt; It's hard to do right.<p>This is correct; I'd argue doing microservices right is even harder than doing a monolith right (like, keeping the code base clean).";0
17505000;HackerNews;2018-07-11;I’ve been tracking the comments and my sense is that almost no one here believes the business domain drives the technical solution.<p>Microservices, when constructed from a well-designed model, provides a level of agility I’ve never seen in 33 years of software development. It also walls off change control between domains.<p>My take from the Segment article is that they never modeled their business and just put services together using their best judgment on the fly.<p>That’s the core reason for doing domain driven design. When you have a highly complex system, you should be focused on properly modeling your business. Then test this against UX, reporting, and throughput and build after you’ve identified the proper model.<p>As for databases, there are complexities. Some microservices can be backed by a key-value store at a significantly lower cost, but some high-throughput services require a 12-cylinder relational database engine. The data store should match the needs of the service.<p>One complexity of microservices I’ve seen is when real-time reporting is a requirement. This is the one thing that would make me balk at how I construct a service oriented architecture.<p>See Eric Evans book and Vaughn Vernon’s follow up.;0
17504993;HackerNews;2018-07-11;Going back from 100+ microservice to 1 monolith is another extreme to me...Perhaps you can have 10 macroservices.<p>And shared library shouldn't contain business logic...;0
17504980;HackerNews;2018-07-11;"&gt; <i>To summarize, it seems like they made some mistakes, microed their services in a knee-jerk attempt to alleviate the symptoms of the mistakes, realized microservices didn't fix their mistakes, finally addressed the mistakes, then wrote a blog post about microservices.</i><p>You try to remove the critique from microservices, but for me these issues are actually good arguments against microservices. It's hard to do right.";0
17504950;HackerNews;2018-07-11;"It looks to me that the shared library issue got solved by the monorepo approach. They could have gone the monorepo way and still have microservices. 
Managing a lot of repos and keeping them consistent with regards do dependencies is not easy. In reality you do not want everyone to use a different version of a dependency. You might allow deviations but ultimately you wand to minimize them.<p>They also just might have had too many repos.";0
17504811;HackerNews;2018-07-11;"This is a common pattern, when it come to semi-idealistic memes like microservices or agile. I think it's a bad idea to have such hairy, abstract ideas travel too far and wide.<p>They become a bucket of clichés and abstract terms. Clichéd descriptions of problems you're encountering, like deployments being hard. Clichéd descriptions of the solutions. This let's everyone in on the debate, whether they actually understand anything real to a useful degree or not. It's a lot easier to have opinions about something using agile or microservice standard terms, than using your own words. I've seen heated debates between people who would not be able to articulate any part of the debate without these clichés, they have no idea what they are actually debating.<p>For a case in point, if this article described architecture A, B &amp; C without mentioning microservices, monoliths and their associated terms... (1) <i>Far</i> fewer people would have read it or had an opinion about it. (2) The people who do, will be the ones that actually had similar experiences and can relate or disagree in their own words/thoughts.<p>What makes these quasi-<i>ideological</i> in my view is how things are contrasted, generally dichotomously. Agile Vs Waterfall. Microservices Vs Monolithic Architecture. This mentally limits the field of possibilities, of thought.<p>So sure, it's very possible that architecture style is/was totally besides the point. Dropping the labels of microservices architecture frees you up to (1) think in your own terms and (2) focus on the problems themselves, not the clichéd abstract version of the problem.<p>Basically, microservice architecture can be great. Agile HR policies can be fine. Just... don't call them that, and don't read past the first few paragraphs.";0
17504729;HackerNews;2018-07-11;You are assuming that microservices must be deployed on the internet, however they can be deployed on another type of network or on a single OS installation, which would prevent them from being completely transparently updated.<p>Shared libraries can be an implementation of micro services. On a platform (e.g. Android) it can be that a shared library is updated and then all consumers are forced to update.;0
17504682;HackerNews;2018-07-11;"&gt; The disadvantage is obviously that creating such's a 'perfect architecture' is hard to do because of different concerns by different parties within the company/organisation.<p>I think you get at two very good points. One is that realistically you will never have enough time to actually get it really right. The other is that once you take real-world tradeoffs into account, you'll have to make compromises that make things messier.<p>But I'd respond that most organizations I see leave a lot of room for improvement on the table before time/tradeoff limitations really become the limiting factor. I've seen architects unable to resolve arguments, engineers getting distracted by sexy technologies/methodologies (microservices), bad requirements gathering, business team originated feature thrashing, technical decisions with obvious anticipated problems...";0
17504561;HackerNews;2018-07-11;"<i>it seems like they made some mistakes, microed their services in a knee-jerk attempt to alleviate the symptoms of the mistakes, realized microservices didn't fix their mistakes, finally addressed the mistakes, then wrote a blog post about microservices.</i><p>That seems... appropriate?<p>This is the general problem with the microservices bandwagon: Most of the people touting it have no idea when or why it's appropriate. I once had a newly hired director of engineering, two weeks into a very complicated codebase (which he spent nearly zero time looking at), ask me &quot;Hey there's products here! How about a products microservice?&quot; He was an idiot that didn't last another two months, but not before I (and the rest of the senior eng staff) quit.<p>I'm fully prepared to upvote more stories with the outline of <i>Microservices were sold as the answer! But they weren't.</i>";0
17504506;HackerNews;2018-07-11;I imagine that your development velocity with this monolith is enabled by the modularity of your code that was enforced as microservices. This benefit will wane and if you had started with a monolith would be much worse.;0
17504453;HackerNews;2018-07-11;"What do you mean by model checking? Usually anything with the keyword &quot;Design&quot; like design patterns for microservices have no science or mathematics to back it up.";0
17504357;HackerNews;2018-07-11;"It seems like splitting into separate repos was a rash response to low-value automated tests. If tests don't actually increase confidence in the correctness of the code they're negative value. Maybe they should have deleted or rewritten a bunch of tests instead. Which is what they did in the end anyway.<p>&gt;&gt; A huge point of frustration was that a single broken test caused tests to fail across all destinations. When we wanted to deploy a change, we had to spend time fixing the broken test even if the changes had nothing to do with the initial change. In response to this problem, it was decided to break out the code for each destination into their own repos<p>They also introduced tech debt and did not responsibly address it. The result was entirely predictable, and they ended up paying back this debt anyway when they switched back to a monorepo.<p>&gt;&gt; When pressed for time, engineers would only include the updated versions of these libraries on a single destination’s codebase... Eventually, all of them were using different versions of these shared libraries.<p>To summarize, it seems like they made some mistakes, microed their services in a knee-jerk attempt to alleviate the symptoms of the mistakes, realized microservices didn't fix their mistakes, finally addressed the mistakes, then wrote a blog post about microservices.";0
17504319;HackerNews;2018-07-11;You’re oversimplifying.<p>Architecturally speaking, there are some similarities between micro services and  libraries because they’re both forms of modularization and usually have an API, but there are some stark differences beyond the “dispatch mechanism”.<p>The main difference is that a service’s deployment lifecycle is completely up to the service admin.  Microservices are like websites - they can continuously evolve (within their API’s contract) without asking permission from consumers.  This is their main superpower and why they’re a way of scaling a development organization without slowing it down too much.<p>In the case of a shared library, it’s completely up to the host admin as to when to upgrade.  In the case of a static library, it’s up to the consuming software to determine when to upgrade.  A service can upgrade when it feels like it.<p>Issues of API backwards compatibility, forwards compatibility, extensibility, self descriptiveness, versioning, etc. are old issues but usually have different answers when upgrades are truly happening all the time and not just in theory.  It tends towards much fewer hard versions and more evolutionary backwards compatibility.<p>IOW, microservices aren’t a cure all, but they do encourage a set of behaviors.  Many articles detracting from them seem to have not wanted those behaviors in their org in the first place.;0
17504289;HackerNews;2018-07-11;"It appears to me that this isn't so much a case of &quot;microservices don't work&quot; as it is the case of several poor architectural choices. It is always really easy to be part of the crowd in the peanut gallery and say &quot;hah, you are doing it wrong&quot;, but when actually at the coalface the pressures and perspectives are different. Having said that, the microservices story isn't half as interesting as the Centrifuge story they link to in the article. Their approach (queues for everything) didn't work for them at their scale, so they invented something different (Centrifuge) that does. Poorly thought-out choices around microservices has little to do with the issue they solved.";0
17504220;HackerNews;2018-07-11;"It seems like their initial problems were:<p>1. Tests hitting 3rd party APIs are flakey &amp; slow
2. The job queuing mechanism can cause all jobs to be slowed by a single 3rd party API outage/slowdown<p>Eventually they arrived at:<p>1. Replay responses to speed up HTTP based tests
2. Create a smarter queuing mechanism in house<p>I'm not sure what microservices has to do with any of this. Anyway, kudos to them for having the courage openness to share their learning from mistakes!";0
17504211;HackerNews;2018-07-11;"It took me longer than it probably should have to realize that the term <i>microservices</i> was made by analogy to the term <i>microkernel</i>.  I think that part of my main issue with the &quot;microservices&quot; is that it conflates highly technical semantics with word forms that are a bit more wishy washy in meaning (i.e., a service is something formed more of human perception, not rooted directly in operating system abstractions).";0
17503970;HackerNews;2018-07-11;Glad you think so too.<p>The title and opening paragraphs gave me the impression they felt they were moving away from microservices, but maybe I didn't those bits correctly.;0
17503604;HackerNews;2018-07-11;3 full time engineers. No wonder they crashed and burned with microservices. Even a slightly distributed system, what I call miniservices, with an api and login server and half a dozen regular apps on top is way too much for such a small team. In a similar, but much smaller setup, I estimate at one point our two person team was spending as much as 25% of their time on cross-service (between the app and api / login server) concerns that would simply not exist with a monolith or something not distributed. That's 3 months out of every year of development time wasted on concerns that shouldn't even exist.;0
17503522;HackerNews;2018-07-11;The practices of Doctors are based off of science and theory. Design patterns and microservices while technical are not based off of science. They are ideas without quantitiative basis or science.;0
17503500;HackerNews;2018-07-11;"&quot;From an architectural perspective, there is absolutely no difference between a micro service and a library. The only real difference is in the dispatch mechanism.&quot;<p>I always tell people if you can't write and maintain a library then don't do microservices.";0
17503441;HackerNews;2018-07-11;Microservices do have various organizational tradeoffs. Individual teams can now own deployment, operation, language, and tooling choices for better or worse. This is probably advantageous for large companies where the number of teams scales beyond what a hierarchical control structure can support. In other words, a single devops team can't make good decisions and prescriptions about languages, tooling, deployment, etc nor effectively react to feedback from the dev teams. Control (power and responsibility) becomes distributed instead of centralized, with all the tradeoffs that entails.;0
17503317;HackerNews;2018-07-11;<i>With separate microservices and databases, you could just pause that microservice. With one application and one database, all teams need to be aware of the highest SLA requirements when doing their respective deployments, and design for it. It is certainly doable, but requires a higher level of alignment between the development teams.</i><p>That’s easily accomplished with a Blue-Green deployment. As far as the database, you’re going to usually have a replication set up anyway. So your data is going to live in multiple databases anyway.<p>Once you are comfortable that your “blue” environment is good, you can slowly start moving traffic over. I know you can gradually move x% of traffic every y hours with AWS. I am assuming on prem load balancers can do something similar.;0
17503295;HackerNews;2018-07-11;I saw this at my last company. Even worse breaking it into microservices allowed teams of 2 or 3 to start building entire realms where only they could commit and used it for internal politics.<p>I witnessed someone that wanted to leverage their service into a promotion so they started pushing for an architecture where everything flowed through their service.<p>It was the slowest part of our stack and capped at 10tps.;0
17503189;HackerNews;2018-07-11;Segment is very much built around microservices. They just consolidated 100+ of these destination services into a single one. That's it.;0
17503045;HackerNews;2018-07-11;"What this actually looks like is a case of very imperfect knowledge transfer within the technology industry. What's interesting about the entire craze of microservices and containers and the cloud is that they are not a new technology. This entire architecture -- the so-called lambda architecture -- has been the standard approach to developing high-performance trading systems on Wall St. since the early 90s. The architecture is literally 30 years old and certain technologies (event sourcing, event driven architecture) are even older.<p>The problem is that the all the best knowledge has clearly not made it out. For example, this design introduces a &quot;Centrifuge&quot; process that redirects requests to destination specific queues... congratulations you've just reinvented a message bus, a technology that goes back to the 80s. There is absolutely nothing new about virtual queues as described here but unfortunately the authors are likely not at all aware of the capabilities of real enterprise messaging systems (even free, open-source ones like Apache Artemis) and certainly not aware of the architecture and technologies and algorithms that underlie them and the (admittedly much more expensive) best-of-breed commercial systems.<p>(I won't even go into the craziness of 50+ repos. That's just pure cargo cult madness.)<p>Watching the web/javascript reinvent these 30 year old technologies is a little disheartening but who knows they may come up with something new. (Then again, recently the javascript guys have discovered the enormous value of repeatable builds. Unfortunately the implementations here all pretty much suck.) Still, we ought to perhaps ask ourselves why this situation has come about...";0
17503032;HackerNews;2018-07-11;Microservices benefits large teams. There’s just too much operational overhead for a small team to manage microservices. Large teams with monolith applications benefit from microservices as the communication issue of large teams is reduced by splitting the team into cross functional teams.;0
17502950;HackerNews;2018-07-11;I must agree. Seems like every step could have been solved without jumping to the conclusion that it was because we didn't use a monolith.<p>I've never understood the false dichotomy of microservices vs monolith... just split things when it makes sense. ¯\_(ツ)_/¯;0
17502882;HackerNews;2018-07-11;"&gt; It’s easier to just press a button and have your application go to all of your servers based on a deployment group.<p>It's not so much about the deployment process itself (I agree with you that this can be easily automated), but rather about the deployment granularity. In a large system, your features (provided by either components or by independent microservices) usually have very different SLAs. For example, credit card transactions need to work 24x7, but generating the monthly account statement for these credit cards is not time-critical. Now suppose one of the changes in a less critical component requires a database migration which will take a minute. With separate microservices and databases, you could just pause that microservice. With one application and one database, all teams need to be aware of the highest SLA requirements when doing their respective deployments, and design for it. It is certainly doable, but requires a higher level of alignment between the development teams.<p>I agree with your remark about refactoring. In addition, when doing a refactoring in a microservice, you always need a migration strategy, because you can't switch all your microservices to the refactored version at once.";0
17502843;HackerNews;2018-07-11;I don't think you reverted to a monolith. I think you built a singular service with more cohesion than when it was split into 140 repos. And it sounds like the split wasn't because of the microservices architecture but because you didn't have a good solution for the queue problem.;0
17502840;HackerNews;2018-07-11;It seems like splitting off small repos for everything is a solution looking for a problem. Some of the most successful software companies out there have monolithic repos, but not monolithic services.<p>The real solution is microservices in monorepos.;0
17502829;HackerNews;2018-07-11;"I've heard of even Unicorns throwing consistency out the window. Apparently Netflix has a bunch of &quot;cleanup jobs&quot; that comb the database for various inconsistencies that inevitably show up.<p>You can't have consistent microservices without distributed transactions. If a service gets called, and inside that call, it calls 3 others, you need to have a roll back mechanism that handles any of them failing in any order.<p>If you write to the first service and the second two fail, you need to write a second &quot;undo&quot; call to keep consistent.<p>Worse, this &quot;undo state&quot; needs to be kept transactionally consistent in case it's your service that dies after the first call.<p>In reality, nobody does this, so they're always one service crash away from the whole system corrupting the hell out of itself. Since the state is distributed, good luck making everything right again.<p>Microservices are insane. Nobody that knows database concepts well should go near them";0
17502767;HackerNews;2018-07-11;"My problem with <i>microservices</i> is the word 'micro'. It should just be <i>services</i>.<p>Problem domains (along with organizational structures) inherently create natural architectural boundaries... certain bits of data, computation, transactional logic, and programming skill just naturally &quot;clump&quot; together. <i>Micro</i>services ignore this natural order. The main driving architectural principle seems to be &quot;I'm having trouble with my event-driven dynamically-typed metaprogrammed ball-of-mud, so we need more services!&quot;.";0
17502762;HackerNews;2018-07-11;"&gt; The shared libraries made building new destinations quick. The familiarity brought by a uniform set of shared functionality made maintenance less of a headache.<p>&gt; However, a new problem began to arise. Testing and deploying changes to these shared libraries impacted all of our destinations. It began to require considerable time and effort to maintain. Making changes to improve our libraries, knowing we’d have to test and deploy dozens of services, was a risky proposition. When pressed for time, engineers would only include the updated versions of these libraries on a single destination’s codebase.<p><i>When pressed for time, engineers would only include the updated versions of these libraries on a single destination’s codebase.</i><p>I think I see the problem and it wasn't with microservices.";0
17502682;HackerNews;2018-07-11;This might come off as being snide, but I'm genuinely curious: was their solution really just having all the services in one repository? That doesn't seem like a problem with microservices at all but more of a devops problem. To be clear, I'm not arguing for microservices, I'm just trying to understand if this was really a problem with splitting off multiple repos. Maybe I'm just really dense and someone can set me straight.<p>I've actually had experiences with seemingly this same problem at a previous startup. Once we started spinning off individual repositories for small pieces of business logic stuff started to go downhill as the logistics of communicating and sharing one another's code became more and more complex.;0
17502648;HackerNews;2018-07-11;Been there. OTOH, my last job was at a startup that used a LAMP stack but made enough money to be self-sufficient and not depend on VC money to keep running.<p>When the legacy systems started to hurt us (because they were written by the founder in a couple of weeks in the most hacky way), we decided against microservices and went to improve the actual code into something more performing and more maintenable,also moving from PHP5 to PHP7.<p>As much as we all wanted to go microservices and follow the buzz, we were rational enough to see that it didn't make any sense in our case.;0
