ID;Source;Creation Date;Content;Sentiment
17499137;HackerNews;2018-07-10;Title:Goodbye Microservices: From 100s of problem children to 1 superstar, Content: https://segment.com/blog/goodbye-microservices/;0

17523513;HackerNews;2018-07-13;"You took the words right out of my mouth:<p>&gt;&gt;To summarize, it seems like they made some mistakes, microed their services in a knee-jerk attempt to alleviate the symptoms of the mistakes, realized microservices didn't fix their mistakes, finally addressed the mistakes, then wrote a blog post about microservices.<p>I read the article a few days ago and was struck by what a poor idea it was to take a hundred or so functions that do about the same thing and to break them up into a hundred or so compilation and deployment units.<p>If that's not a micro-service anti-pattern, I don't know what is!";0
17518584;HackerNews;2018-07-12;The failure her does seems like someone who have made microservices with the wrong bounded context (Domain Driven design). When one splits a monolith up into microservices it is essential to not split a bounded context into several micoservices (or 100+ in this case).;0
17512129;HackerNews;2018-07-12;"The issue is that it is rare and difficult to be able to synthesize all the changes happening in computing and to go deep.  So a certain “Pop culture” of computing develops that is superficial and cliche’d.  We see this in many serious subjects:  pop psychology, pop history, pop science, pop economics, pop nutrition.   Some of these are better quality than others if they have a strong academic backing, but even in areas such as economics we can’t get to basic consensus on fundamentals due to the politicization, difficulty of reproducible experiment, and widespread “popular” concepts out there that may be wrong.<p>Concepts like microservices synthesize a bunch of tradeoffs and patterns that have been worked on for decades.  They’re boiled down to an architecture fad, but have applicability in many contexts if you understand them.<p>Similarly with Agile, it synthesizes a lot of what we know about planning under uncertainty, continuous learning, feedback, flow, etc.  But it’s often repackaged into cliche tepid forms by charlatans to sell consulting deals or Scrum black belts.<p>Alan Kay called this one out in an old interview:
<a href=""https://queue.acm.org/detail.cfm?id=1039523"" rel=""nofollow"">https://queue.acm.org/detail.cfm?id=1039523</a><p>“computing spread out much, much faster than educating unsophisticated people can happen. In the last 25 years or so, we actually got something like a pop culture, similar to what happened when television came on the scene and some of its inventors thought it would be a way of getting Shakespeare to the masses. But they forgot that you have to be more sophisticated and have more perspective to understand Shakespeare. What television was able to do was to capture people as they were.<p>So I think the lack of a real computer science today, and the lack of real software engineering today, is partly due to this pop culture.”";0
17512051;HackerNews;2018-07-12;No, I’m assuming they must be deployed on an IP network of some sort, not necessarily the Internet.  A microservice by definition is a networked service.  The whole REASON the term was coined was to differentiate from services which often were developed and deployed  monolithically, as opposed to truly autonomous runtime processes (aka. bounded contexts).<p>Services, whether SOA, web services, messaging services, or network services etc, as in SOA, describe a client/server  architecture with an API.  Usually these APIs are designed by the principles of Domain Driven Design, where different teams map to bounded contexts that have their own published API.<p>Microservices are a form of SOA where each API also runs in its own process and thus has independent deployment lifecycle.  Many in the SOA world advocated for this 10-15 years ago (and often ignored), and now the industry has gone back and coined a term for this practice.<p>In an organization that does microservices properly at scale, like Amazon, you have teams that build and run and upgrade their service autonomously from others.  Read the Steve Yegge rant about Amazon and Platforms to understand this.  It allows tremendous parallelisation of effort and allows for thousands of deploys to production daily without breakage.  This is hard to pull off though, and   a new initiative doesn’t generally won’t more than a small handful of services.<p>If it’s a shared library, then call it a shared library.  It has a completely different lifecycle from a microservice.  In your Android example, shared libraries by definition are controlled by whomever can dictate OS updates, not the app developer.;0
17510041;HackerNews;2018-07-11;"<i>Verification on the system boundaries means running the app, not running a unit test</i><p>What is an app at the system boundaries if not a piece of code with dependencies?<p>If you have a microservice - FooService that calls  BarService. The &quot;system boundary&quot; you are trying to test is FooService using a fake BarService. I'm assuming that you're calling FooService via HTTP using a test runner like Newman and test results.<p>In a monolithic application you have class FooModule that depends on BarModule that implements IBarModule. In your production application you use create FooModule:<p>var x = FooModule(new BarModule)<p>y = x.Baz(5);<p>In your Unit tests, you create your FooModuleL<p>var x = FooModule(new FakeBarModule)
actual= x.Baz(5)
Assert.AreEqual(10,actual)<p>And run your tests with a runner like NUnit.<p>There is no functional difference.<p>Of course FooModule can be at whatever level of the stack you are trying to test - even the Controller.";0
17508513;HackerNews;2018-07-11;"&gt;&gt; A huge point of frustration was that a single broken test caused tests to fail across all destinations. When we wanted to deploy a change, we had to spend time fixing the broken test even if the changes had nothing to do with the initial change. In response to this problem, it was decided to break out the code for each destination into their own repos<p>We went through this painful period. Kept at it devoting a rotating pair to proactively address issues. Eventually it stabilized, but the real solution was to better decouple services and have them perform with more 9s of reliable latency. Microservices are hard when done improperly and there doesn't seem to be a short path to learning how to make them with good boundaries and low coupling.";0
17508286;HackerNews;2018-07-11;How much of the code was shared among these services?  It sounds like you essentially had mostly the same code running in 140 different configurations with only some translation logic and glue varying between each.  I'm not surprised you found this untenable.  This is akin to running a microservice per web page.;0
17507991;HackerNews;2018-07-11;Microservices are a great tool for the toolbox. Not everybody needs them. It has definitely seemed like a fad over the past few years to push everybody to use them (even projects or orgs that don't need them). I suspect that is what happened here;0
17507741;HackerNews;2018-07-11;"First of all, I'm 54 and started coding at 15 on punch cards, so I've seen pretty much every paradigm in the last 40 years.<p>It's certainly a truism that technology can be cyclical, but that's not relevant in this case.<p>The OP's statement and article &quot;Goodbye Microservices&quot; is anecdotal and incorrect.<p>I have been on teams developing microservice architectures for about six years and this particular paradigm shift has proven to be a dramatic leap forward in efficiency, especially between the business, technical architecture, and change control management.<p>When you develop a domain model, the business can ask questions about the model. The architects can answer them by modifying the model. The developers can improve services by adopting model changes in code. This is the fundamental benefit of domain driven design and works fluidly with a microservice architecture.<p>There's still a pervasive belief in technology circles that software should be developed from a purely technical perspective. This is like saying the plumber, electrician, and drywaller should design a house while they're building it. They certainly have the expertise to build a house, and they may actually succeed for a time, but eventually the homeowner will want to change something and the ad hoc design of the house just won't allow for it. This is why we have architects. They plan for change within the structure of a house. They enable modification and addition.<p>Software development is no different. The Segment developers have good intentions, but they needed to work with the business to properly model everything, then build it. Granted, it sounds like they're a fast moving and successful business, so there are trade-offs. But once the business &quot;settles&quot;, they really should go back to the drawing board, model the business, then build Segment 3.0.";0
17507668;HackerNews;2018-07-11;Lots of people judging/bashing the author (and team) that they made bad choices jumpinng on the microservice bandwagon when it clearly wasn't the correct thing to do.<p>Sure, but at the same time the team learned some valuable lessons, gained experience and hopefully matured. I applaud Alexandra for opening up and sharing that with us.;0
17507615;HackerNews;2018-07-11;"Thanks for sharing this video.<p>When she's discussing Compensations she mentions that the Transaction (T_i) can't have an input dependency on T_i-1. What are some things I should be thinking about when I have hard, ordered dependencies between microservice tasks? For example, microservice 2 (M2) requires output from M1, so the final ordering would be something like: M1 -&gt; M2 -&gt; M1.<p>Currently, I'm using a high-level, coordinating service to accomplish these long-running async tasks, with each M just sending messages to the top-level coordinator. I'd like to switch to a better pattern though, as I scale out services.";0
17507223;HackerNews;2018-07-11;I kind of get what systemizer is saying. People may think of evolution of technologies as cycles but it is never that. A new technology 'Y' is always developed because the incumbent 'X' has some shortcomings. And even after a period of disillusionment when we revert back to 'X', it is not always the same. We synthesize the good points of 'Y' back to 'X'.<p>Coming to this topic, I see Microservices as a solution to the problem of Continuous Delivery which is necessary in some business models. I can't see those use cases reverting back to Monolith architecture. For such scenarios, the problems associated with Microservices are engineering challenges and not avoidable architecture choices.;0
17507201;HackerNews;2018-07-11;Ugh. Sounds like a severe case of resume-driven architecture.<p>In my experience, you won't know whether you need microservices until you're on at least v2.0 of your application. By then, you have a better understanding of what your real problems are.;0
17507180;HackerNews;2018-07-11;"That's basically how microservices are operated on orchestrators like Kubernetes—just substitute &quot;container&quot; for &quot;VM&quot;, which is a mostly-academic difference from the perspective of your application. Operations tooling—distributed tracing, monitoring, logging...—is essential.";0
17507176;HackerNews;2018-07-11;"I think you are exactly right. Microservice architectures are definitely not automatically good, and there is nothing wrong with a well architected &quot;monolith&quot;.";0
17507112;HackerNews;2018-07-11;"&gt; I’ve seen the hype swing from micro services to soa and back to micro services a few times already.<p>SOA and microservices are the same thing; microservices is just a new name coined when the principles were repopularized so that it didn't sound like a crusty old thing.";0
17507084;HackerNews;2018-07-11;"&gt; it's much easier to process the test output and debug the microservices than monolithic applications.<p>You easier to debug end-to-end tests of a microservice architecture that monolith? That's not my experience. How do you manage to put side by side all the events when they are in dozen of files?";0
17507027;HackerNews;2018-07-11;"&gt; <i>I am a strong believer that microservices is over hyped.</i><p>In general, I fully concur: there are very few services that actually warrant a microservice architecture.";0
17507011;HackerNews;2018-07-11;"A model checker is a software program you use to validate a given mathematical model of a system. If the proposed properties of the model hold the model checker will let you know. More interestingly if the properties fail to hold you'll get a trace back into where your assumptions fell apart.<p>TLA+ is one such system that includes a language for writing models and a model checker to verify them for you. In the context of microservices you would write a model of your services and the checker would help you to verify that certain properties of your model will hold for all possible executions of the model. Properties people seem to be interested in are consistency and transaction isolation. You can develop a model of your proposed microservices architecture and work out the errors in your design before you even write a lick of code.<p>Or if you already have a microservice system you could write a model of it and find if there are flaws in its design causing those annoying error reports.<p>Amazon wrote a paper about how they use it within the AWS team [0]. Highly worth the read. And if any of this sounds interesting I suggest checking out Hillel Wayne's course he's building [1].<p>[0] <a href=""https://lamport.azurewebsites.net/tla/formal-methods-amazon.pdf"" rel=""nofollow"">https://lamport.azurewebsites.net/tla/formal-methods-amazon....</a>
[1] <a href=""https://learntla.com/"" rel=""nofollow"">https://learntla.com/</a>";0
17506945;HackerNews;2018-07-11;I have tests which verify DNA analysis. The test data vectors are large -- a few hundred MB here, a couple GB there. The hundreds of tests that use these test vectors still run in a few seconds.<p>If you're using a tape drive or SD cards, sure. But even a 10 year old 5400RPM on an IDE connection should be able to satisfy your tests' requirements in a few seconds or less.<p>I suspect your tests are just as monolithic as you think microservices shouldn't be. Break them down into smaller pieces. If it's hard to do that, then redesign your software to be more easily testable. Learn when and how to provide static data with abstractions that don't let your software know that the data is static. Or, if you're too busy, then hire a dedicated test engineer. No, not the manual testing kind of engineer. The kind of engineer who actually writes tests all day, has written thousands (or hundreds of thousands) of individual tests during their career. And listen to them about any sort of design decisions.;0
17506451;HackerNews;2018-07-11;Sounds like a typical case of hype driven development. When faced with a problem they threw buzzwords at it, hoping it would go away.<p>Had they taken the time to explore the root causes of these problems and how to best approach them, they probably wouldn‘t have taken the microservices approach to begin with.<p>I see this far too often. Instead of looking for solutions to problems, people look for problems to try the new hot solution they read about. Happened with ML/AI, NoSQL, Microservices, Blockchain, …;0
17506376;HackerNews;2018-07-11;All of these things you mentioned are either also required for a monolith (like DNS+DHCP) or are required for neither (isolated environments).<p>Does that mean that because of all the work required to properly set those up for a monolith, we better stay with microservices?;0
17506246;HackerNews;2018-07-11;"I am a strong believer that microservices is over hyped. I usually resist when senior management asks for us to use it (that proves the point of hype).<p>But by reading the first paragraphs of the article you see that the guys from Segment made a series of grave mistakes on their &quot;microservices architecture&quot;, the most important one being the use of a shared library on many services. The goal of microservices is to achieve isolation, and sharing components with specific business rules between them not only defeats the purpose, but results in increased headaches.<p>Without deep knowledge of the solution, it's hard to judge, but it seems this was never the case for microservices. They needed infrastructure isolation when the first delay issues surfaced, but there wasn't anything driving splitting the code up.<p>Sam Newman discusses on his book how to find the proper seams to split services (DDD aggregates being the most common answer) and it seems to people are making rather arbitrary decisions.";0
17506213;HackerNews;2018-07-11;I remember using BEA Tuxedo 15 years ago and I can't help wondering if theoretically one could do microservices using it or some OLTP to achieve consistency when needed. Has it progressed  over the years? Is there any free alternative to it? Or is it dead tech? When I used it it was hard and too much extra work, but it did the job successfully.;0
17506161;HackerNews;2018-07-11;"&quot;I've worked with microservices a lot. It's a never-ending nightmare. You push data consistency concerns out of the database and between service boundaries.&quot;<p>This exactly. Me too. Data consistency concerns in sufficiently large real world projects can be practically dealt with only 2 ways IMO: transactions or spec changes.";0
17506117;HackerNews;2018-07-11;I was too, of course a distributed system could also be built with DCOM and MTC (later COM+), and the DTC (Distributed Transaction Coordinator) could be used when you needed a transaction across services (or DBs, or MQs). Obviously the DTC was developed in recognition of the fact that distributed transactional service calls were a real requirement - something that current microservice architectures over HTTP REST don't seem to support.;0
17506075;HackerNews;2018-07-11;"It will be interesting to read your post in a few months time, when you hit the issues caused by using a monolith 
which could be resolved by splitting that service apart.<p>Introducing components to match on various forms of value seems odd.  Ideally standardise on those names; but if that's not possible (and you're using microservices), why not have a service to correct the name, rather than a library deployed to every endpoint?  Then you call that service with data containing `first_name` or `givenname` and it returns that message with the standardised form.  Or have a &quot;global key&quot; service; where you send the source system name and value, and have that translated for the destination via a lookup, allowing any field names or defined values to be translated by a generic reusable component:<p><pre><code>  Entity    | System Name | System Value | GlobalKey
  -------------------------------------------------------------------------------------------
  Boolean   | HR          | TRUE         | 52582622-4322-445b-bb7a-8ca118d0ca2b
  Boolean   | HR          | FALSE        | 688c2298-6b99-4c31-a356-1ab9b1caacde
  Boolean   | Finance     | 1            | 52582622-4322-445b-bb7a-8ca118d0ca2b
  Boolean   | Finance     | 0            | 688c2298-6b99-4c31-a356-1ab9b1caacde
  Boolean   | Sales       | Yes          | 52582622-4322-445b-bb7a-8ca118d0ca2b
  Boolean   | Sales       | No           | 688c2298-6b99-4c31-a356-1ab9b1caacde
  FieldName | HR          | GivenName    | 3de31cff-e4bb-4d4a-a819-fd96c7c5032e
  FieldName | HR          | Surname      | e799b891-1eeb-4598-85a5-a9534d3a3a4c
  FieldName | Finance     | First_Name   | 3de31cff-e4bb-4d4a-a819-fd96c7c5032e
  FieldName | Finance     | Last_Name    | e799b891-1eeb-4598-85a5-a9534d3a3a4c
  FieldName | Sales       | FirstName    | 3de31cff-e4bb-4d4a-a819-fd96c7c5032e
  FieldName | Sales       | Surname      | e799b891-1eeb-4598-85a5-a9534d3a3a4c
</code></pre>
As for &quot;handcrafted XML&quot;... the alternative looks like handcrafted code... For translation a language like XSLT which was designed for translating data from one format to another seems like a good choice.  You can also use this to get around your translation issue by defining a central &quot;universal&quot; format; so you can have XSLTs to translate messages from source systems to the universal format, then other XSLTs to translate from universal to the destination; so that adding or removing a system (/service) only impacts that system / you don't need to rewrite every point-to-point interaction of that service with another (OK, not point to point since we have microservices; but if they're not adding value by abstracting you away from point to point then essentially you've just got complex point-to-point interactions rather than simple point-to-point).";0
17505922;HackerNews;2018-07-11;The whole thing is released and deployed together, which is the usual distinction between microservices and not. I don't think anyone's advocating not using modules and folders to structure your code in your repository (certainly I hope not), but a single deployment artifact makes life a lot easier.;0
17505910;HackerNews;2018-07-11;The big problems with microservices come from distributed transactions being difficult and clocks getting out of sync. Multiple services on a single machine don't have that problem.;0
17505882;HackerNews;2018-07-11;you avoid them. you design your system (a set of microservices) in such a way that you don't need a transaction across service boundaries ( or rather database boundaries );0
17505807;HackerNews;2018-07-11;"Microservices are damn hard to implement correctly. Think how much math and algorithms must there be to correctly, test, version your model and API, load balance, gather logs, collect logs, archive logs, grep in logs, setup VMs/Dockers, DNS+DHCP and firewalls, load balance databases (master/slaves?) and your services, horizontal scaling maybe?, manage privileges and access, manage disk space, store and collect user-uploaded/generated files, isolate environments...<p>If you don't understand these concepts and how much work must be don't to correctly implement microservice architecture - you SHOULD STAY with monoliths, they are much easier.<p><a href=""http://principlesofchaos.org/"" rel=""nofollow"">http://principlesofchaos.org/</a>";0
17505651;HackerNews;2018-07-11;Oh man, this is just the tip of the iceberg with Microservices. There is nothing Micro about them, they are so difficult to deal with that it becomes impossible to actually iterate or build user value and introduces loads of difficult to debug problems.<p>We have architects here that dictate the design of the system but IMO they have not done the simplest implementation of anything. We have Kafka to provide ways of making each service eventually consistent so we delete something out of our domain service, but it requires absolutely huge amounts of code in various different other services to delete things in each place listening for events. Every feature is split across N different services which means N times more work + N times more difficult to debug + N times more difficult to deploy.<p>The system has been designed with buzzwords in mind - Go and  GRPC have been a disaster in terms of how quickly people have developed software (as has concourse - so many man hours wasted trying to run our own CI infrastructure it's unreal), loads of small services that are individually difficult to deploy and configure (and come with scary defaults like shared secret keys for auth - use a dev JWT on prod for example). The difficulty in dealing with debugging the system - there simply aren't the tools to understand what is going wrong or why - you have to build dashboards yourself and make your application resilient to services not existing.<p>Never ever try to build Microservices before you know what your customers <i>really</i> want - we've spent the last 6 months building a really buggy CRUD app that doesn't even have C and D fully yet. Love your Monolith.;0
17505610;HackerNews;2018-07-11;"You may also want to look into the Saga pattern - I found <a href=""https://www.youtube.com/watch?v=xDuwrtwYHu8"" rel=""nofollow"">https://www.youtube.com/watch?v=xDuwrtwYHu8</a> to be a handy high level overview for applying it to microservices.<p>Although personally, I've never felt the need to try and apply it specifically, but the idea is interesting.";0
17505538;HackerNews;2018-07-11;"I wonder if microservices will have a similar evolution as microkernels. While some microkernels almost closed the performance gap to monolith kernels, the communication overhead killed them. It turned out that the kernel's complexity could be reduced by moving some functions to the applications (&quot;library OS&quot;). Linux kernel drivers are only accepted when the functionality can't be done in user space. The extreme version is running single purpose, highly specialized unikernels on a hypervisor.";0
17505459;HackerNews;2018-07-11;"&gt; This isn’t an article about how microservices architecture is somehow bad, it’s an article about how bad Segment’s engineering team is.<p>Wow.  This is the level of discourse we've reached here now.<p>Why the ad hominem?  If you have an actual point to make on technical merit, by all means, make it.  Were you passed on in a job interview at Segment?  Why the hostility?  (honest question)";0
17505440;HackerNews;2018-07-11;Can't wait to write sane monolith with libraries instead of microservices.;0
