ID;Source;Creation Date;Content;Sentiment
34233829;HackerNews;2023-01-03;we've done the round trip of splitting up a monolith into microservices and then going back the other way. network api overhead being the biggest reason. this kind of hell is totally unnecessary until it iabsolutelyi is i.e. hard information theory requirements demand you spread your app across more than 1 physical computer.monolith is better in almost every way. the only thing that still bothers us is the builditeration time. we could resolve this by breaking our gigantic dll into smaller ones that can be built more incrementally. this is on my list for 2023.;0
34233788;HackerNews;2023-01-03;you have to scale up the entire thing which is huge expensive etc.yes yet people still do it that way. this is tradeoff against the costs of microservices. i'm not saying it is worth it but yes sometimes you can just inefficiently throw hardware resources at scaling problems. this is interesting. a monolith with some form of ipc? why not do microservices at that point? that sounds like microservicesish?because you are incrementally changing an existing monolith but still getting some of the benefits of scaling distinct workloads independently. if you do this right it does lend it self to reworking the new service to be become its own microservice. or you can just keep going with the shared codebase.;0
34233675;HackerNews;2023-01-03;which is irrelevant as many microservices do the same inside of them and the libraries that they consume.;0
34233672;HackerNews;2023-01-03;bring back the monoliths! divided up into modules and each of those modules being developed by another team but essentially still the same deliverable binary.you only need to agree on an api between the modules and you're good to go!microservices suck dick and i hate the it industry for jumping on this bandwagon hype without thoroughly discussing the benefits and drawbacks of the method. debugging in itself is a pain with microservices. developing is a pain since you need n binaries running in your development environment.;0
34233650;HackerNews;2023-01-03;1 microservice. it's up to the software engineer to scope out the microservices properly.;0
34233646;HackerNews;2023-01-03;we keep regurgitating this because most microservices are the 2nd coming of big data that fits into a usb stick.;0
34233595;HackerNews;2023-01-03;the maintenance cost is a debt that must be paid by all means. and microservices may be the cleanest solution if there are teams that develop businesses completely independent of each other.;0
34233557;HackerNews;2023-01-03;then why cannot you have separate repos and review processes for modules? this has nothing to do with microservices vs modules.;0
34233480;HackerNews;2023-01-03;i felt suspicious as soon as i saw jon carmacks website being mentioned in a conversation about microservices.;0
34233370;HackerNews;2023-01-03;you never want code with shared ownership to tolerate feature creep. thats impossible to keep on the rails. if youre going to use solid anywhere its in shared code.if your org doesnt suffer feature creep willingly i believe that means you can have a lot more flexibility with respect to conways law. a lowchurn project can maintain a common understanding. not all of them will of course but its at least possible. feature factories absolutely cannot and you shouldnt even try.what really kills a lot of projects though is an inverted dependency tree. and by inverted i mean that the most volatile code is at the bottom of the call graph not the top. in this case every build every deploy or in the microservices scenario every request can have different behavior from the previous one because some tertiary dependency changed under you. now you need all sorts of triggers in your cicd pipeline to guarantee that integration tests are rerun constantly to figure out where the regressions are being introduced. your build pipeline starts to look like one of those server rooms with loose wires everywhere and a bucket under the ac unit. nothing is stable and everything is on the verge of being on fire at a moments notice.;0
34233260;HackerNews;2023-01-03;yeah i think this is one of the very few places where splitting out something as a microservice makes sense. for example you mostly never want to openprocessexamineglance at userprovided pdfs on a box with any sort of unfiltered network access. ideally you do what you need to do within a sandbox that has no network access but that's really hard to do performantly.the primary reason for this is that pdfs can contain executable code and the common tools used to process them are full of unpatched cves.;0
34233233;HackerNews;2023-01-03;people keep regurgitating this you aint going to be google mantra but i worked there and in reality generic microservice stack is in a totally different league of complexity and sophistication of what google and co have. this argument is basically reductio ad absurdum;0
34233200;HackerNews;2023-01-03;monoliths r hard. microservices r hard. pick your poison and get good.;0
34233198;HackerNews;2023-01-03;the technical and organisational measures you need in place to do it safely are an extra step you need to take whereas with microservices they're built inthey aren't built in it's just that the need for them is impossible to ignore. developers and management can't help but recognize and respect modularity in microservices because the separation of services and the apis between them make the modularity obvious. when the separation between modules only exists in code and even then only when seen through the eyes of someone who understands the modular architecture of the codebase it is easily ignored inevitably forgotten and might as well not exist at all.;0
34233175;HackerNews;2023-01-03;yes and no. the central part of data flowed naturally through services i.e. passed in requests and webhooks not in responses. microservices maintained local state as well though it was mostly small and disposable due to wholeintra crashonly design. for example we didn't hesitate to shut something down or hotfix it except for busfactor periods when there's only few of them. they could also go down by themselves or by upstream and routers avoided them automatically.;0
34233153;HackerNews;2023-01-03;there is no need to have the microservices built along conways lawthis is a misunderstanding of conway's law. your code will reflect the structure of your organization. if you use microservices so will their architecture. if you use modules so will the modules.if you want a specific architecture have your organization reflect the modulesmicroservices defined in that architecture.;0
34233138;HackerNews;2023-01-03;but there are rules of blame.with microservices as long as you maintain the contract with caller services you can deploy whenever you want. if you have some kind of issue your team is solely responsible. if the caller services do weird things they are responsible for fixing them.if you are pushing changes to a module as part of a more monolithic or wrapper service if you do a deploy and break the whole big service you are now responsible for the entirety of any issue which is now more likely due to integration risk and unrelated changes from others especially because now there need to be coordination across many teams integrating hopefully via tests and observability. but this requires a highdegree of maturity for automated quality assurance and site reliability. if you don't have that the operational risks are very high. so that alternative is having some opslike function or other integration team responsible. or doing more topdown waterfall coordination.given the service maturity needed is rare microservices distributes that operational ownership in a way where there is more accountability.;0
34233097;HackerNews;2023-01-03;for code modularity to serve the same purpose i think there needs to be explicit languagelevel support because on a mediumsized or larger project when the modularity exists only in the minds of developers it might as well not exist at all. you need virtually all of your developers to understand the design and respect the seriousness of violating it and beyond a certain project size that isn't possible.developers do a much better job with microservices. i think it's easy for them to respect the seriousness of designing and changing the api of a microservice. in contrast they often don't respect or even realize the seriousness of making a change that affects the modular design of code.languagelevel support for defining and enforcing module interfaces might help developers invest the same level of care for module boundaries in a modular monolith as they do in a microservices architecture but i've yet to work in a language that achieves this.;0
34233020;HackerNews;2023-01-03;microservices has little to do with tech. it is a way of organizing teams of ipeoplei funnelling all communication between teams through well defined specifications instead of adhoc meetings. it is not clear where static typing or lack thereof comes into play here.tdd is a method of documenting your application in a way that happens to be selfverifying. you icouldi use a word document instead but lose the ability for the machine to verify that the application does what the documentation claims that it should. static typing does provide some level of documentation as well but even if you have static typing available static typing isn't sufficient to convey the full intent that your documentation needs to convey to other developers.;0
34233016;HackerNews;2023-01-03;devil's advocate a few ways the easiest being to scale up the whole monolith with more instanceas far as i know there's no way to granularly scale up a monolith. if the monolith has 20 or 50 or 100 modules and you need 1 or 2 of them scaled you have to scale up the entire thing which is huge expensive etc. another way is run multiple services using the same codebase so you have workload segmentation either via synchronous network calls or async worker systems.this is interesting. a monolith with some form of ipc? why not do microservices at that point? that sounds like microservicesish?;0
34232952;HackerNews;2023-01-03;i think it runs a bit deeper than that. microservices are how the business views its self.look once upon a time managers designed the system that iworkersi implemented. the factory assembly line or the policy manual.but now the iworkersi are cpus and servers. the managers designing the system the workers follow are icodersi. i say coders are the new managers.now this leaves two problems. the first is that there are a lot of managers who are now doing the wrong job. and explains perfectly why steve jobs gets involved in emails about hiring coders. but that's a different post.for me the second problem is microservices represent the atomic parts of a business. they should not be seen as a technical solution to anything and because the first problem managers arent managing workers anymore there is no need to have the microservices built along conways law.and so if you want to build a microservice it is not enough to consider the technical needs it is not enough to automate what was there you need to design an atomic building block of any your company. they become the way you talk about the company the way you think about the processes in a company.an mostly the company becomes programmable. it is also highly likely the company becomes built mostly of interchangable parts.;0
34232927;HackerNews;2023-01-03;while i mostly agree i don't think it's so black and white on the enforcement part and i actually think that a lot of recent developments actually put holes into this.the typical example is that when you have to explain something is the job of x and y. usually this means that x and y are breaking those boundaries. just make a semiprivate or even public api only used for that thing and you have a broken boundary again. or push it on a message queue etc.i think it certainly helps but then again it doesn't prevent it. having modules you have the same effect.so in the end you get more spots where things can get wrong and more operational complexity. if you stick to using them right i think you can also stick to using modules right with less complexities better performance easier debugability fewer moving parts.hackers will find a way to do hacky things everywhere. also this whole discussion reminds me of linus discussing how he thinks micro kernels add complexity a very long time ago. not sure if they should be considered modules or microservices though.sharing global state and so on while maybe it shouldn't be done lightly without thinking about it can and does make sense. and in most modern environments it's not like the most ed issues can happen too easily.also i strongly agree with pointing out that this is actually a niche topic. it's mostly big because that niche is where probably the majority of hn and startup people spend their time.;0
34232865;HackerNews;2023-01-03;100 true for certain classes of problem.if i want to calculate the price of a stock option that's an excellent candidate to package into a module rather than to expose as a microservice. even if i have to support different runtimes as presented in the article it's trivial.a different class of problem that doesn't modularize well in shared library terms is something with a significant timing component or something with transient states. perhaps i need to ingest some data wait for some time a process the data and then continue. this is would likely benefit from being an isolated service unless all of the other system components have similar infrastructure capabilities for time management and ephemeral storage.;0
34232847;HackerNews;2023-01-03;and also with modules you need the business processes to coordinate deployments across teams because they all live in the same wrapper application. that's what stops them being independent.if we're being technical some languages support hot swapping modules so no restart would be needed. setting that aside restarting an application isn't anything that needs coordination today. you wouldn't even restart the application. you'd deploy a new version swap over and shut down the old version.you don't restart the network every time you deploy a microservice.no but something changes in the network configuration so that the other microservices are aware of the deployment.;0
34232836;HackerNews;2023-01-03;that backplane is not an implementation but a set of understood guiderails for intermodule communication.then why is the author even discussing microservices in the first place? following your logic they are an implementation detail just like modules.;0
34232817;HackerNews;2023-01-03;but most people need it a lot less than they think. normally the database is your bottleneck and if you keep your application server stateless you can just run lots of themat my last job there were quite a few times where being able to scale some small microservice instance up from 2 4 instances or 4 8 or 8 12 was a lot easierquicker than investigating the actual issue. it'd stop production outageshiccups. it was basically encouraged.not sure how that can be done with a it's all modules in a giant monolith.;0
34232689;HackerNews;2023-01-03;the biggest appeal to me for microservices which might be in the list in terms of maintainability but isn't explicitly called out is that it ienforcesi the modularization. yes i want modules. but no i don't have the discipline to actually keep a code base modular. platforms and languages have evolved for rapid development and convenience and realities for modularization that aren't architectural for example compilation units or deployment.a failed lookup of a function is greeted by do you want to import x so you can call foo?. having a battery of architectural unit tests or linters ensuring at module foo doesn't use module bar feels like a crutch.now it might seem like making microservices just to accomplish modularization seems like a massive overkill and sa huge overhead for what should be accomlished at the language level and you'd be right.but that leads to the second largest appeal which is closely related. the one thing that kills software is the big ball of mud where you can't ireallyi change that dependency move to the next platform version or switch a database provider. even in wellmodularized code you still share dependencies. you build all of it on react or all the data is using entity framework or postgres. because why not? why would you want multiple hassles when one hassle is enough? but this really also means that when something is a poor fit for a new module you shoehorn that module to use whatever all the other modules use postgres entity framework react.... with proper microservices at least in theory you should be able to use multiple versions of the same frameworks or different frameworks all together.it should also be said that modules vs microservices is also a dichotomy that mostly applies in one niche of software development websaas development. everywhere else they blur into one and the same but sometimes surfacing e.g. in a desktop app offloading some task to separate processes for stability or resource usage like a language server in an ide.;0
34232681;HackerNews;2023-01-03;i have to believe these antimicroservices articles tend to be written by people who just don't need microservices and maybe who also don't have much experience applying them to useful effect. amazon cited in the article as an originator of the practice is a perfect example of where microservices are virtually unavoidable and central to the success of the company. there is no way to amazon could have been built on on a small number of monoliths. none.;0
34232656;HackerNews;2023-01-03;modules aren't an alternative to microservices in a reasonable way though. and for all modules solve the modularization problem at the code level they don't really solve modularization at the service level. the main alternative to microservices is monoliths and for many applications i far prefer microservices to monoliths. i want modularization in how i scale my app i don't want to spin up a whole bunch of servers that can serve almost any possible function in production. i'd prefer more delineated responsibilities. i don't think modularization solves this if after the modules you just throw all your modules in one big bucket and serve that up.;0
34232623;HackerNews;2023-01-03;transaction boundaries are a critical aspect of a system.i've often noticed that these boundaries are not considered when carving out microservices.subsequently workarounds are put in place that tend to be complicated as they attempt to implement two phase commits.;0
34232568;HackerNews;2023-01-03;and also with modules you need the business processes to coordinate deployments across teams because they all live in the same wrapper application. that's what stops them being independent.you don't restart the network every time you deploy a microservice.;0
34232504;HackerNews;2023-01-03;you need to do additional steps in both caseswith modules you need some sort of wrapper application to bring it all together.with microservices you need some sort of network layer so that the microservices can talk to each other.;0
34232472;HackerNews;2023-01-03;i'm not so positive on every microservice maintaining its own copy of state potentially with its own separate data store. i think that usually adds more ongoing complexity in synchronization than it saves by isolating schemas. a better rule is for one service to own writes for a table and other services can only read that table and maybe even then not all columns or all nonowned tables.ill go one step further and say that you should treat your data stores as services in and of themselves with their own wellconsidered interfaces and perhaps something like postgrest as an adapter to the frontend if you dont really need sophisticated service layers. the readwrite pattern you recommend is a great fit for this and can be scaled horizontally with read replicas.;0
34232456;HackerNews;2023-01-03;the biggest draw of microservices to those just adopting them is not scalability or separation of concerns but independent deployability move fast and deploy new features in a particular area unencumbered.good luck getting that property with a monolithic or modular system. qe can never be certain and let's be honest they should be skeptical that something modified in the same codebase as something else does not directly break another unrelated feature entirely. it makes their life very difficult when they can't safely draw lines.two different modules sharing even a database when they have disparate concerns is just waiting to break.there's a lot of articles lately dumping on microservices and they're all antiquated. news flash there is no universal pattern that wins all the time.sometimes a monolith is better than modules is better than microservices. if you can't tell which is better or you are convinced one is always better the problem is with iyoui not the pattern.microservices net you a iloti of advantages at the expense of way higher operational complexity. if you don't think that trade off is worth it totally fair don't use them.since we are talking about middleground one i'd like to see one day is a deploy that puts all services in one pod so they all talk over unix socket and remove the network boundary. this allows you to have one deploy config specify each version of each service separately and therefore deploy whenever you want. it doesn't have the scalability part as much but you could add the network boundary later.;0
34232439;HackerNews;2023-01-03;or hardware. i worked on an hpc product which used microservices of a kind but many of them were tied to specific hardware nodes. so much of what we think of as microservices relies on a fairly narrow set of assumptions and mostly makes sense in specific contexts i.e. cloud apis etc.;0
34232422;HackerNews;2023-01-03;microservices as a named architectural pattern are over a decade old at this point. anyone jumping on them because they're the new hotness is more than a little behind the times. i have exactly the opposite problem though the kind of problems i have worked on so far would not be solved by leveraging large number of developers that can independently work on an equally large number of small modular programs with a very well defined concise interface.if you don't have multiple teams working on it and you don't have specific chunks of functionality that you need to scale orthogonally then you don't have the problems microservices solve. so don't use them. that seems uncontroversial to me. i still think that these scenarios are prevalent in any company which existed before the 90s but i might be wrong or biased on thisthis is survivorship bias in a sense. microservices only make sense where access to cpu and network is cheap and ondemand largely. that's only started to be an assumption you could really make since amazon's ec2 convinced the world's cios that fungible tin was better than their own racks.that means you don't see microservice architectures in older companies and you don't see problems being solved with them ieven where it might have made sense retrospectivelyi because it ops would never have been set up to enable it.today you don't need a big rewrite to justify introducing microservices where they're needed. that's a straw man. all you need is a team that will be able to move faster if their deployment is decoupled from everyone else's.but fundamentally if your problem area smells like bunch of business rules and a database then again if you don't have the problem that the architecture solves don't use it.;0
34232365;HackerNews;2023-01-03;time to throw the cat amongst the proverbial pigeons and start the year 2023 off with discord and disharmony.microservices are a solution to a problem. tdd is a solution to a problem the same problem. both are solutions that themselves create more and worse problems. thanks to the hype driven nature of software development the blast radius of these 'solutions' and their associated problems expands far beyond the people afflicted by the original problem.that problem? not using statically typed languages.tdd attempts to reconstruct a compiler poorly. and microservices tries to reconstruct encapsulation and code structure poorly. maybe if you don't use a language which gets hard to reason about beyond a few hundred lines you won't need to keep teams and codebases below a certain size. maybe if you can't do all kinds of dynamic nonsense with no guardrails you don't have to worry so much about all that code being in the same place. the emperor has no clothes he never had.edit to reduce the flame bait nature of the above a bit. not in all cases i'm sure there are a very few places and scales where microservices make sense. if you have one of those and you used this pattern correctly that's great.and splitting out components as services is not always bad and can make a lot of sense. it's the micro part of microservices that marks out this dreadful hypetrend pattern i object to. it's clearly a horrible hack to paper over the way dynamically typed codebases become much harder to reason about and maintain at scale. adding a bunch of much harder problems distributed transactions networks retries distributed state etc in order to preserve teams sanity instead of just using tooling that can enforce some sense of order.;0
34232248;HackerNews;2023-01-03;instagramdoes anyone have a microservice map of instagram? i feel that would be helpful here.;0
34232220;HackerNews;2023-01-03;same thing with microservices unless you do a blue green deployment have a planned shutdown load balancer in between releases...;0
