ID;Source;Creation Date;Content;Sentiment
34237493;HackerNews;2023-01-03;i whether it's your http api interface changingiinterfaces don't change under microservices. communication by contract enshrines a contract. you imusti ensure that your api does not break legacy users no matter what changes you want to make going forward. you have committed to behaviour forevermore once you submit the contract to other teams.this may be another reason why ipc is often preferred over straight function calls as some languages particularly those with static types make extending functionality without breakage quite hard. an http api can more easily resort to tricks to return different results to different callers.i i think the redgreenrefactor loop of tdd doesn't bring much.iyou find little value in writing a specification for your work or you find little value in automatic validation that the program works according to your spec?redgreenrefactor is a little more specific in that it says that you should write a spec only for the work you know you are going to work on in the short term whereas tdd in general leaves room for things like writing the entire application's spec before getting down to business. i think this is most practical in the real world generally speaking. often you don't know what your entire application should do in the beginning making writing a full spec unrealistic.i i've never seen it applied well on a statically typed codebaseiinteresting as i have only ever seen specifications be it tdd or word documents written for work that is done in statically typed languages. in my experience the dynamic programming languages tend to attract the cowboy coders who don't understand why other future developers need more complete documentation or why specs are important and have no care to see that those things are done.;0
34237473;HackerNews;2023-01-03;proper design in a monolith would also protect you from failures of nonvital services e.g. through exception capture.so it seems like were trying to compensate bad design with microservices. its orthogonal imo.;0
34237287;HackerNews;2023-01-03;i don't really think microservices are fundamentally more scalableit depends on what you are scaling. i think microservices are fundamentally more scalable for deployment since changes can be rolled out only to the services that changed rather than everywhere. unless your language and runtime support hotloading individual modules at runtime.;0
34237184;HackerNews;2023-01-03;microservicesagreed the same database gets difficult but i guess where two things need to change dependently there's coordination overhead that's inescapable. you can in general use e.g. schemas to keep domains fairly separate. whether it's your http api interface changing or the change needs to be coordinated in the same process i don't think you have a way to avoid these meetings. or like the 3rd party team i work with you just change your http api and break production without telling us shrug.i guess my point is languages like java and c are much maligned for their boilerplate and it doesn't let 10x genius programmers go brrrrrr etc. but that boilerplate serves a purpose. projects in c i can't speak to java but i believe it has a similar concept compile to separate .dll's or .so's. in general a project will publicly expose interfaces i.e. contracts and keep its internals encapsulated. crucially projects all live in the same codebase in the same monolith they're folderdirectory level separation but on steroids. there are tricks with attributes and reflection that can break this separation but with the additional constraint that dependencies cannot be circular you're forced to make decisions about where exactly things live. this is where the dynamic crowd throw up their hands and say there are so many layers of pointless abstraction!. i'd agree these languages tend to too many layers but the layers provide the foundation which can support a project growing from 12 devs all the way through to 50.i'm maybe finally becoming a grumpy old programmer and i'm glad much of the consensus is swinging away from the notypes no schema no rules position of the past decade. people forgot chesterton's fence and decided the layers didn't provide anything then they added them back as network boundaries which was indescribably worse and more of a headache. testingi guess it's a semantics debate really. i think the redgreenrefactor loop of tdd doesn't bring much. i've never seen it applied well on a statically typed codebase and where i've seen advocates try and apply it i've seen them tunnelvision to suboptimal outcomes in order to fulfil the ceremonial needs of the process.i think a few tests that take place at the projectdllso boundary and use as much of the real dependencies as possible are far preferable to high coverage. this is probably a notruescotsman area of debate. maybe tdd has been done properly and productively by some groups i've never seen it and no one i've met ever has check out my confirmation bias!.;0
34237089;HackerNews;2023-01-03;what it is is using the wrong solution for a problem. viceversa the number of devs who justify monolithic apps is absurd. the justification of microservices is just as problematic.it is about striking a balance. no reason should something be overly compounded or overly broken up.;0
34237080;HackerNews;2023-01-03;another benefit of microservices is it allows you to have a permission boundary which can restrict the scope of damage if a single serverservice is compromised.and for that matter it can but not necessarily limit how much damage a bad code release can do.of course you don't get those benefits for free just by using microservices but impleminting those kind if boundaries in a monolith is a lot harder.;0
34237051;HackerNews;2023-01-03;answer is no.it is about where the shoe fits. if you become too heavily dependent on modules you risk module incompatibility due to version changes. if you are not the maintainer of your dependent module you hold a lot of risk. you don't get that with microservices.if you focus too much on microservices you introduce virtualized bloat that adds too much complexity and complexities are bad.modules are like someone saying it is great to be monolithic. noone should upright justify an overly complicated application or a monolithic one.the solution is to build common modules that are maintainable. you follow that up with multicontainer pods have them talk low level between each other.stricking that exact balance is what is needed not striking odd justifications for failed models. it is about what does my application do? and answering with which design benefits it the most.;0
34236913;HackerNews;2023-01-03;doesn't monolith usually refer to one really heavy app?no. backend server clusters are around almost as long as the internet exists.i would guess most of the time there's a high expense lots of memory in duplicating the entire monolith?that's right but there's a gotcha. everytime you split your monolith into parts that doesn't mean that each part will consume 1n of original monolith startup resource. there will be a floor of memory usage. consider 1 monolith that eats up 1gb to startup vs 4 microservices that uses 512mb each. right from start you doubled the wasted memory from 1gb to 2gb. that only gets worse the more services are created. another problem is that microservicecloud folks loves to create anemic machines. usually setting up 512mb ram and half a core cpu to a service that needs 380mb minimum thats 75 overhead and 25 of working memory. it's bonkers.;0
34236910;HackerNews;2023-01-03;why would using microservices reduce the chance of outages? if you break a microservice that is vital for the system you are as screwed as with a monolyth.;0
34236899;HackerNews;2023-01-03;it sounds like creating problem then spending timemoney on fixing it and calling it a win?there is a point when it all starts to make sense. but that point is when you go into billions worth business hundreds of devs etc. and going there has large cost especially for smallmedium systems. and that cost is not one off it's a daytoday cost of introducing changes. it's orders of magnitude chaper and faster head cound wise to do changes in ie. single versioned monorepo where everything is deployed at once as single working tested migrated version than doing progressive releases for each piece keeping it all backward compatible at micro level. again it does make sense at scale hundreds of devs kind of scale but saying your 5 devs team moves faster because they can work on 120 micoservices independently is complete nonsense.in other words micoservices make sense when you don't really have other options you have to do it it's not good startwith default at all and frankly sam newman says it in building microservices and so do people who know what they're talking about. for some reason juniors want to start there and look at anything nonmicroservice as legacy.;0
34236872;HackerNews;2023-01-03;i am a front end dev so microservice architecture is not something i am super familiar with my daytoday but i occasionally do work in our back end project which is a serviceoriented java project. the project is broken down into different services but they are aggregated in parent projects where the parent declares the modules in the pom.xml in the modules xml declaration.i like that architecture the services are abstracted with clearly defined boundaries and they are easy to navigate discover. not sure if java modules satisfy the concerns of the author or other hn users but i liked it.;0
34236859;HackerNews;2023-01-03;unexpected?!either way one of my biggest pet peeves is the nearubiquitous use of http amp json in microservice architectures. there's always going to be overhead in networked servies but this is a place where binary protocols especially ones like cap'n proto really shine.;0
34236840;HackerNews;2023-01-03;i think microservices are fine for businesses which have a general idea of how 'big' things could get with respect to their platforms. but if you're more in a company that has many oneoff programs scripts and the like then maybe microservices aren't a thing that you need. better organization is good but that shouldn't be just a microservices thing everyone benefits when you've organized not just individual projects and their source code but also just organizing what does what with external documents that can be updated to explain their purpose is useful. there's nothing worse than looking at source code or an program by name only to ask what is this thing?;0
34236753;HackerNews;2023-01-03;i have done a lot of service development for what would be called microservices.the article gets it right in ny opinion.1. it has a lot to do with organisational constraints.2. it has a lot to do with service boundaries. if services are chatty they should be coupled.3. what a service does must be specified in regards to which data it takes in and what data it outputs. this data can and should be events.4. services should rely and work together based on messaging in terms of queues topics streams etc.5. services are often data enrichment services where one service enrich some data based on an eventdata.6. you never test more than one service at a time.7. services should not share code which is vibrant or short lived in terms of being updated frequently.8. conquer and divide. start by developing a small monolith for what you expect could be multiple service. then divide the code. and divide it so each coming service own its own implementation as per not sharing code between them.9. iaas is important. you should be able to push deploy and a service is setup with all of its infrastructure dependencies.10. domain boundaries are important. structure teams around them based in a certain capability. e.g. customers bookings invoicing. each team owns a capability and its underlying services.11. make it possible for other teams to read all your data. they might need it for something they are solving.12. don't use kubernetes or any other orchestra unless you can't it what you want with cloud provider paas. kubernetes is a beast and will put you to the test.13. services will not solve your problems if you do not understand how things communicate fail and recovers.14. everything is eventually consistent. the mindset around that will take time to cope with.a lot more...;0
34236715;HackerNews;2023-01-03;it's not really about what's better it's about whats been standardized upon.i'm sure i could gain many of the advantages of microservices through an osgi monolith however an osgi monolith is not the hot thing of the day i'm likely to be poorly supported if i go down this route.ideally i also want some of my developers to be able to write their server on the node ecosystem if they so choose and don't want updating the language my modules run on in this case the jvm to be the biggest pain of the century.besides once my mau is in the hundreds of thousands i probably want to scale the different parts of my system independently anyway so different concerns come in to play.;0
34236555;HackerNews;2023-01-03;sure poorly implemented solutions rarely solve problems well.but implementing microservices is not an unsolvable problem. it's a problem that 1000s of organizations have solved.;0
34236348;HackerNews;2023-01-03;while we are on the topic i would like to point out that the decoupled nature of microservices is governed by queuing theory. microservices are especially susceptible to positive feedback loops and cascading failures.going back to systems thinking flow control concurrency and rate limiting and api scheduling weighted fair queuing are needed to make these architectures work at any scale. open source projects such as aperture0 can help tackle some these issues.0;0
34236339;HackerNews;2023-01-03;yeah it's bin packing not straight efficiency. also people seem to exaggerate latency for rpc calls. i often get the feeling that people who make these latency criticisms have been burned by some nominal microservices architecture in which an api call is made in a hot loop or something.network latency is real and some systems really do run on a tight latency budget but most sane architectures will just do a couple of calls to a database same performance as monolith and maybe a transitive service call or something.;0
34236336;HackerNews;2023-01-03;another way to look at this is microservices reduce the blast radius of problems.;0
34236326;HackerNews;2023-01-03;how do microservices help here? you can deploy a monolith 10 times and have the same risk distribution.;0
34236280;HackerNews;2023-01-03;so tell me who is making microservices for calls that could be done wholly in memory? how are you handling rollbacks and such for this in memory logic?aren't you still writing out to external data stores? if that's the case then its really not a comparison of in process to a rpc it just two rpc hops now no?;0
34236212;HackerNews;2023-01-03;there's two technical problems that microservices purport to solvethere's a third technical problem that microservices solve and it's my favorite isolation. with monoliths you provide all of your secrets to the whole monolith and a vulnerability in one module can access any secret available to any other module. similarly a bug that takes down one module takes down the whole process and probably the whole app when you consider cascading failures. in most mainstream languages every module even the most unimportant leaf node on the dependency tree needs to be scoured for potential security or reliability issues because any module can bring the whole thing down.this isn't solved at the language level in most mainstream languages. the erlang family of languages generally address the reliability issue but most languages punt on it altogether. the real reason that microservices may make sense is because they keep people honest around module boundaries.agreed. microservices like static type systems are rails. most organizations have people who will take shortcuts in the name of expedience and systems with rails disincentivize these shortcuts importantly they don't iprecludei them.;0
34236200;HackerNews;2023-01-03;you'll need to support loading two versions of each dll into memory and invoking both on some percentage of servers to be able to replicate a microservice though.the important part of microservices isn't just api boundaries it's lifecycle management. this can be done with a dll or jar but it's much harder today.;0
34236158;HackerNews;2023-01-03;that's just a microservice enabled by configuration.;0
34236123;HackerNews;2023-01-03;if done right microservices is a way to transform part of your organization challenge into a technical one which for many organizations is the right move.famous last words if done right... or you just multiply your organizational issue with a technical one.;0
34236106;HackerNews;2023-01-03;how the hell... like... who decided to do microservices in the first place if they didn't know this?microservices can have both design utility and simultaneously been a major fad.lurking reddit and hn you can watch development fashions come and go. it's really really profoundly hard to hold a sober conversation on splitting merits from limitations in the middle of the boom.tldr gartnerhypecycle.png;0
34236075;HackerNews;2023-01-03;microservices enable independent scale domains. this means they can be more scaleable and dense but it's not necessarily true.;0
34236052;HackerNews;2023-01-03;a better rule is for one service to own writes for a table and other services can only read that tablebeen there how do you handle schema changes?one of the advantages that having a separate schema per service provides is that services can communicate only via apis which decouples them allowing you to deploy them independently which is at the heart of microservices and continuous delivery.the way i see it today everyone complains about microservices 12 factor apps kubernetes docker etc. and i agree they are overengineering for small tools services etc. but if done right they offer an agility that monoliths simply can't provide. and today it's really all about moving faster than yesterday.;0
34236043;HackerNews;2023-01-03;but i don't see how monoliths can keep up with developer velocity when an organization reaches thousands of developers.you're likely right.i think what most detractors of microservices are pointing to is that most companies don't reach thousands of devs in size. or even hundreds.;0
34235959;HackerNews;2023-01-03;thats a really interesting point something that could probably be addressed by modulelevel logging and metrics. that said even as a promonolith advocate i can see why its preferable to not allow any one moduleservice to consume all the resources for your service in the first place. the service boundaries in microservice architectures can help enforce resource limits that otherwise go unchecked in a larger application.;0
34235849;HackerNews;2023-01-03;i was working at amazon when they started transitioning from monolith to microservices and the big win there was locality of data and caching.all of the catalog data was moved to a service which only served catalog data so its cache was optimized for catalog data and the load balancers in front of it could optimize across that cache with consistent hashing.this was different from the front end web tier which used consistent hashing to pin customers to individual webservers.for stuff like order history or customer data those services sat in front of their respective databases and provided consistent hashing along with availability providing a consistent writethrough cache in front of the sql databases used at the time.i wouldn't call those areas where it makes things more efficient rare but actually common and it comes from letting your data dictate your microservices rather than letting your organiation dictate your microservices although if teams own data then they should line up.;0
34235714;HackerNews;2023-01-03;if they wrote that using a bunch of labview microservices you could replace the services onebyone with cada until the whole thing was no longer labview.this is generally what i think the best part about microservices are an easy way to improve upon the mvp in any dimension. rewriting a whole monolith can take forever and probably will introduce a ton of bugs. but incrementally rewriting microservices won't stop feature development and is easy to ab test for correctness.;0
34235675;HackerNews;2023-01-03;as a general rule of thumb fully explore and exhaust your monolith options before you switch to microservices. they quite often create more problems than they solve.;0
34235624;HackerNews;2023-01-03;servers can only get so big. if your monolith needs more resources than a single server can provide then you can chop it up into microservices200 threads 12tb of ram with a pipe upwards of 200gbs. this isn't even as big as you can go this is a reasonable off the shelf item. if your service doesn't need more than this maybe don't break it up. i believe that this level of service can no longer accurately be described as micro.;0
34235493;HackerNews;2023-01-03;microservices are less efficient but are still more scalable.not at all. you can run your monolith on multiple nodes just as you can do with microservices. if anything it scales much better as you reduce network interactions.;0
34235466;HackerNews;2023-01-03;i didn't get this article. it seems like it contains two things 1. it was already invented before 2. all the wrong reasons why people decide to use microservices.but author clearly avoided the real reasons why you actually need to split stuff into separate services 1. some processes shouldn't be mixed in the same runtime. simple example batchstreaming vs 'realtime'. or important and not important. 2. some things need different stack runtimes frameworks. and is much easier to separate them instead of trying to make them coexist.and regarding 'it was already in simpsons' argument i don't think it should even be considered as argument. if you are old enough to remember ejb you don't need to be explained why it was a bad idea from the start. why services built on ejb were never scalable or maintainable. so even if ejb claimed to cover the same features as microservices right now i'm pretty sure ejb won't be a framework of choice for anybody now.obviously considering microservices as the only right solution is stupid. but same goes for pretty much any technology out there.;0
34235432;HackerNews;2023-01-03;i don't understand the argument around microservices purporting to fix scalability. say your system has modules a b and c in one app and that a requires more resources while b and c are relatively unused. won't b and c just irun lessi and thereby use appropriately fewer resources from within the same system as a? are microservices just an aesthetic separation it feels nice to know you're only scaling up a?;0
34235390;HackerNews;2023-01-03;you are absolutely right you do not know much about cruises.the things you listed are ... 45 different iapplicationsi mostly running directly on the ships and what is conspicuously missing are the parts that are managed shoreside likeitinerary planning your product is one or more cruises therefore you need to preplan the itineraries which ships to use when you will enter each port and when you will leave it and so on... try to imagine this like a mix between hotel management and flight company management inventory management i.e. reservation.you mention bookings like a microservice. this could work for iferryi line where you are basically selling a ticket for a single trip most of the time with no personal accommodation except maybe for the car.a cruise booking usually comes with a ton of ancillary services e.g. i live in berlin and i want to take a cruise in the caribbeans... therefore i need a flight to get there and back. this could be provided by a charter flight or a normal airline ... in either cases the ticket will be part of the booking itself take in account that cruise customers are mostly middleaged or older and relatively affluent therefore the last thing they would like to do is to create their own itinerary by booking services on 45 different websites.but i suppose it is better to stop there we are really ot now;0
