ID;Source;Creation Date;Content;Sentiment
34230641;HackerNews;2023-01-03;Title:Modules, not microservices, Content: http://blogs.newardassociates.com/blog/2023/you-want-modules-not-microservices.html;0

34284642;HackerNews;2023-01-07;i would never claim that our setup uses microservices. probably just more plainly named services.and yes that is correct we agree that once we expose a view we won't remove columns or change types of columns. theoretically we could effectively deprecate a column by having it just return an empty value. our use cases are such that changes to such views happen at an acceptable rate and backwards incompatible changes also happen at an acceptable rate.our views are also often joins across multiple tables or computed values so even if it's often quite close to the underlying tables they are intentionally to be used as an abstraction on top of them. the views are designed first from the perspective of what form of data do others services need?;0
34279551;HackerNews;2023-01-06;this only works if you apply backward compatible changes all the time. sometimes you do want to make incompatible changes in your implementation. database tables are an implementation detail not an api which you're trying to expose as a view etc.but hey every team and company has to find their strategy to do things. if this works for you that's great!it's just not a microservice by definition.;0
34279318;HackerNews;2023-01-06;i apologies for the delay in a reply.inot at all. i'm in no rush.i secondly what i think actually happens is that most companies using microservices aren't this disciplined and just end up bodging or implicitly coupling services.iif an organization is sufficiently large you may have no way to get another team on the line to even try. at that scale the other teams may as well work for other companies and that is what microservices models. if your organization is small i tend to agree that you won't succeed. you can't beat conway's law.i i find little value in providing that specification through the tdd approach or associated ceremony.ibut ultimately what's the difference between writing your spec in an executable way or writing it in a word document beyond the superficial differences in the languages? what is communicated to other developers ends up being the same.i i prefer as few tests as possible at as high a level as possible with as few mocks as possible. i'll take a single test that takes 15 seconds to run over 1000 tests running in milliseconds.iseemingly not all that common interestingly but go comes to mind as a language that provides constructs to define separation between specification tdd and developer tests. conceivably you could exclude your tdd specs from execution only running the tests that help in your development process.the value of tdd isn't in the execution but in what is communicated to other developers. that the specs are executable is merely a nice side benefit to help with confirming that the implementation conforms to the spec. you still get 90 of the benefit of tdd even if you never run the executable albeit granted at that point it iisi just a fancy word document.i i think there's a lot of healthy debate to be had about how much testing is needed. iperhaps but tdd isn't about testing. tdd is about providing documentation. i think there is less room for debate there. i'm not sure anyone who has ever inherited a codebase has wished it gave less insight into what the 'business needs' of the program are. again a word document can provide the same documentation but if you're going to write that word document anyway why not go the extra mile and gain the additional benefits that come with execution?;0
34271446;HackerNews;2023-01-06;i really miss the old days where when an app was down it was obvious... now apps just go unresponsive because of connectivity issues between services... we used to have frameworks that could communicate errors in one log it was a beautiful thing. as cloud infrastructure became more powerful to better host so called monolithic systems it was all scrapped to move to microservices which were made for less powerful infrastructure. everything was refactored to the point where it's expensive to go back... pretty crazy how much money the industry wastes on refactoring...on top of that the tendency to get complacent with unstructured data in a lot of systems is really creating a very complicated lockin when systems are developed for unique services on each cloud provider... bowls of spaghetti.hire solutions architects for dev projects make your apps future proof... i warn you. too much microservice customization leads to vendor lock in and expensive operational costs... this is why a lot of apps get sunsetted early.;0
34270797;HackerNews;2023-01-06;unfortunately people keep forgetting that microservice also requires organizational change. otherwise it's just a heavy overhead.;0
34267860;HackerNews;2023-01-05;the argument is simply the empirical observation that the vast majority of microservices deployments don't operate anywhere near the scale that actually requires microservices and is not going to operate at that scale in the foreseeable future. when scalability is the primary argument in favor of microservices how is that absurd?;0
34266531;HackerNews;2023-01-05;the ability to load balance across nodes is not as you claimed a particular advantage of microservices.are you replying to the right comment? i made no such claim.;0
34266165;HackerNews;2023-01-05;i'm comparing specifically against a monolith where you have an uber executable doing literally everything.i doubt that anyone here is advocating for a system that it literally everything in one os process. i bet even you would say that a process with a rdmbs connection is a monolith even though it doesn't fit your definition.as for modules they can run as a separate process on the same machine to isolate security critical elements.conversely i doubt that any reasonable microservices architecture has every instance of a microservice in its own subnet with a firewall and strict network access permissions... including one off generated api keys.most at best use a static api key per microsoervice inside one large secure network... which leads me back to my point they're not exactly easier to secure. methods may differ a little bit but the techniques are the same.then your example of a buffer overflow is going to be as bad for microservices as for monolith.unless you're going to invest in a variety of systems programming languages and oses in your stack your one buffer overflow turns into buffer overflow on every other microservice... making your claim of easier to isolate a little bit delusional. classic example of log4j bug where monolith or microservices once you're breached game over;0
34258675;HackerNews;2023-01-05;his point was that the comment was unclear if you'd also read it hastily i imagine his logic was something like how can ooms happen less often if you run more processes possibly on the same machine? while your comment actually wants to say if a specific service is affected by an oom with microservices only that specific microservice goes down since it's probably running on its own hardware.;0
34256170;HackerNews;2023-01-05;right i'm not advocating for one over the other i was just explaining issues solved by microservices. now instead of the oom killer taking your service down you have a flaky nic on another microservice box and now you need to figure out how to gracefully degrade.i love working with microservices at the scale of work but we're big tech. i can't imagine why a 5 person startup would want k8s and microservices. you don't need that scale until you have more than 2 teams and you're pushing at the very least 15 engineers at that point and usually the sales and marketing staff to make that investment worth it.;0
34254600;HackerNews;2023-01-05;i started at amazon in 2001 when we had around 400 servers running the website it was large but it was around the scale that most fortune 500 companies operate at.i'll agree that a team of developers with 20 microservices sounds obviously wrong which is really my point that the site should be divided around data and the orgs should probably reflect the needs of the datanot the other way around. and amazon back then didn't have that problem.;0
34252742;HackerNews;2023-01-04;i was part of a project that did exactly this same monolithic code base with config flags that transformed it into web server worker or scheduler. it allows scaling all parts separately but i can confirm it's easy to introduce bugs if you're not careful. since you're sharing the same db migrations also need to be backwardscompatible.a cool sideeffect is that you can usually run the whole thing in one app for development by just enabling all profiles as opposed to some microservice architectures where you need dozens of containers and dbs for replicating interservice bugs.;0
34250197;HackerNews;2023-01-04;no because that's not the service api. that's just a view over a table an internal data structure used to represent some business domain model which should be properly exposed through some implementationagnostic api. service b should not care how service a implements it.and the fact you must keep backward compatibility see the op answer above at the implementation level shows how fragile this approach is you will never be able to change a database schema ias you wishi just because you have consumers that rely on the internal details of your implementation a table. if you want to change a field from char to int you can't. how is it important for service b to know that level of detail? an api could still expose a domain model as char if you want to and maybe introducing new fields new methods whatever way. or maybe nothing at all maybe it's not necessary because the database field is never exposed but only used internally !!.on the other hand if you expose a database agnostic api e.g. http rpc ... whatever you can even swap the underlying database and nobody will notice.a good rule of thumb is if i change the implementation do i need to asktell another team? if the answer is yes that is not a microservice.;0
34250116;HackerNews;2023-01-04;i was arguing the opposite coordinated deployments already presumes more maturity than i was considering. i've only been at one company with sameday deployments. all the other places have been freeforalls where each group determines their own release schedule with their own pipelines. managing deployments between dependent services thus requires significant coordination overhead or none because you are stuck with what you get until the other teams deliver your needs on their own timeline.in chaotic environments like that microservices help with defining clear ownership of operational responsibility though at the cost of clear responsibility for the overall distributed system. this comes at the cost of making it hard to develop let alone ship changes that impact multiple microservices outside the scope of a single team or closely related sibling teams.the main point i was making was that with a more monolithic system managing that kind to organization disfunction necessitates topdown waterfall like control. so moving to microservices enables noncoordinated agility removing one layer of coordination problem a the cost of other problems.;0
34249775;HackerNews;2023-01-04;i do think using something like flatbuffers or capnproto where the serde is removed aside from the travel over the network could be a huge win. another thing i have always wanted to try is to develop a system using microservices with a rpc layer that uses immutable objects so you can later combine the services and convert rpcs to function calls.;0
34249558;HackerNews;2023-01-04;separate process vaults hsms and other techniques of offloading security credentialshow do give one module access to the vaulthsm without also giving any other code in the same process access? even in the event of a security compromise. and that still doesn't address the problem of a vulnerability anywhere in the monolith potentially exposing any sensitive data in processes memory such as user data including password. the implication that anything other than a microservice architecture must be exclusively an uber executable doing literally everything is naive.ok replace microservices with service oriented architecture. i'm comparing specifically against a monolith where you have an uber executable doing literally everything.;0
34248958;HackerNews;2023-01-04;yeah... the issue lies in cases where the decomposition is so extreme that you end up not able to deploy independently.and any benefit of a microservice owning it's own rdb is still that schema changes aren't easily reversible. specially when new non predefined data has been flowing in.stateless microservices are great in the sense that you don't have to build multiple versions of apis... but stateful microservices are just a pita.;0
34248862;HackerNews;2023-01-04;apologies for the delay in a reply. i think this has been a constructive discussion certainly for how i think about things. interfaces don't change under microservices. communication by contract enshrines a contract. you must ensure that your api does not break legacy users no matter what changes you want to make going forward. you have committed to behaviour forevermore once you submit the contract to other teams.i think this entails a couple of things.firstly it's a tradeoff. if we discover some incorrect assumption is baked in to both sides of an interface we're kind of stuck and have a hard time with the migration path going forward. this isn't unsolvable and paths exist to correct it but they're substantially harder than just updating both parts in the same commit. it moves coordination overhead as a tradeoff.secondly what i think actually happens is that most companies using microservices aren't this disciplined and just end up bodging or implicitly coupling services. probably the pattern i'm talking about is distributed monolith. not the good kind where you just scale out your monolith but where you drink the microservices koolaid and create microservices by adding network boundaries at random. this is the realworld application of microservices i have seen where i've seen it. i don't doubt some people can use it correctly with proper rigour. but my theory is the pattern took hold because using distributed monolith appears to help helps tame the complexity of a dynamic monolith. i find it incredibly hard to believe the niche pattern of microservices done correctly would have become so popularized otherwise. you find little value in writing a specification for your work or you find little value in automatic validation that the program works according to your spec?i find little value in providing that specification through the tdd approach or associated ceremony. i prefer as few tests as possible at as high a level as possible with as few mocks as possible. i'll take a single test that takes 15 seconds to run over 1000 tests running in milliseconds.again for me this is a question of what popularized this pattern?.i think there's a lot of healthy debate to be had about how much testing is needed. i think tdd appeared to provide the kind of guarantees that are really helpful in a dynamic language and gained a lot of advocates that way. when i had to write some type hint free python i naturally defaulted to writing tdd since keeping a large system in your head and error free is basically impossible without an exhaustive suite of tests. it's an approach that works very well in one context that applied to other contexts unquestioningly delivers a lot of pain.maybe you're lucky to have only worked with very deliberate and rigorous engineers in your career. outside the top tier we're working with architecture astronauts and people who jump on whatever hype cycle happens to be passing which explains my anger with these concepts.;0
34248600;HackerNews;2023-01-04;giving me an example that is created to work explicitly at systemcontainer level isn't the gotcha you think it is.iam profiles have their own limitationsseparate process vaults hsms and other techniques of offloading security credentials are the same for microservice architecture as monolith.the implication that anything other than a microservice architecture must be exclusively an uber executable doing literally everything is naive.;0
34248267;HackerNews;2023-01-04;hey we have a system like that at my company. microservices are self contained and responsible for exposing their interface via sdks created with a trpc like library. jump to definition works across the entire monorepo like a charm. could you take a look and give me any feedback?;0
34248216;HackerNews;2023-01-04;every organisation i've worked at that had microservices has had all of them released every other thursday at the same time by the same pipeline because they are tied to the organisation scrum schedule. also most changes are part of epics that span multiple microservices. if you are gonna argue that properly done microservices don't have that problem you are free to practice your perfect microservices alongside perfect scrum oop and communism.;0
34247639;HackerNews;2023-01-04;boring tech club ftwas a cto i couldn't agree more. for our internal product we use 100 boring technologies. the most modern you'll find is a react spa.i sigh when clients want to go the microservices route for a team of just a few developers. when you want to use nextjs for their tablesampforms app. when they choose to use kubernates instead of a couple ec2 instances.don't get me wrong these technologies are great for us because we can charge more for the wasted human time developing these overengineered solutions. but i always for my peace of mind try to talk them out of them. sometimes works sometimes doesn't at the end of the day it's their money.;0
34247592;HackerNews;2023-01-04;a monolith can also scale vertically with mechanisms to redeploy on fatal errors. if all starts failing you may have a problem. but you can get the same problems with a microservices that is in the critical pathnetworks could have unexpected delays routing errors and other glitches. at least with a monolith you can often find a stacktrace for debugging. i have seen startups that have limited traceability and logging when using micro services.when a small startup has to manage scalable k8s infrastructure in the cloud distributed tracing and monitoring is often not prioritized when you are a team of 5 developers trying to find a product market fit.i am not against microservices i work with them daily but you just trade one type of stability problem with another;0
34246539;HackerNews;2023-01-04;sorry you misunderstood.when you book a cruise your expectation is to get everything including hotel stays before or after the cruise along with flights to and from it as a single package provided by the cruise vendor or a travel agency. so the reservation system must take care of all of that.when i said 45 different websites i was trying to explain the point that a 60 yo highincome guy is usually not interested in getting the cruise itself on carnival.com then go look for excursions on carribeansexcursion.net and to book flights on lufthansa.de or airfrance.fr.it was a remark on the way the cruise business works and why it is so not about architecture.but once again i really believe that we are way off topic... personally i do not really feel like creating a ask hn are microservices a good choice for the cruise industry? but if someone feels like submitting one i will try to contribute.;0
34245487;HackerNews;2023-01-04;not necessarily. but if the solution in this case is to start breaking up the monolith into smaller services owned by specific product teams then you are moving towards microservices.;0
34245126;HackerNews;2023-01-04;couple of calls is normal. but if you make everything a microservice. and there are dependencies between them then by design its destined that some hotter loop eventually will contain rpc.;0
34244974;HackerNews;2023-01-04;rewriting a module from one tech stack to another is not much harder when that module was a part of a monolith and not a separate service except that you haven't paid the upfront cost of bootstrapping a new service putting in rpc calls etc. and in any case starting a project as microservices is already a bad practice due to a number of reasons the most important for me is that it's hard to change module boundaries which you will most likely get wrong in a new project.;0
34244775;HackerNews;2023-01-04;if you have many app servers and they all run copies of the same app you can roll out new versions to a few servers at a time. you just have to handle the db update first but you need to do that with microservices anyway they might use smaller databases and therefore making it somewhat easier.;0
34244741;HackerNews;2023-01-04;i think amazon and google and other faang entities work at another scale than 99.9 of the rest of the world. the problems they face are different including the impact of data locality.i've seen many systems where there are a few hundred to a few thousand users not hundred of millions or billions of users. there can also be teams of 510 developers who manages 20 microservices. i still don't think those projects have the same needs and could have done something else.;0
34244732;HackerNews;2023-01-04;there are so many misconceptions about what microservices are or what problems they are trying to solve. most people don't even experience the problems yet or ever they are meant to solve and they go straight to micro. 5 person teams making 5 services to power their product faceplam. a relatively simple b2b web application without any serious traffic also does not need microservices to handle its load.people just read up on whatever seems to be the newest coolest thing. the issue is that ms articles are usually coming from faangexfanng. these companies are solving problems that 99 of others do not.as engineers we should be looking for the most effective solutions to a given business problem. sadly i see engineers with seniorstaff titles just throwing cool tech termslibs around. boring tech club ftw;0
34244505;HackerNews;2023-01-04;so all your microservices implement sagas or other synchronisation patterns that ensure 100 data consistency?;0
34244230;HackerNews;2023-01-04;i'm not making a case in favor of starting with microservices for your startup that'd be insane to say the least. i'm just disagreeing with scalability is a feature. a feature is every addition on top of your minimum viable product. if at some point it becomes apparent that the business needs scalability then scalability becomes your minimum viable product.;0
34243670;HackerNews;2023-01-04;you can horizontally scale a monolith without going full microservices.;0
34243643;HackerNews;2023-01-04;id love for a language framework that allows for an application to be composed of modules that can either be run in a single process or deployed as multiple independently scalable processes with a mostly transparent rpc system requiring minimal boilerplate.my ide should be able to easily traverse the call graph. my development environment should be simple to setup.ive worked on microservices that required an insane amount of boilerplate to do simple things. like 7 layers of controllers clients services data services etc just to fetch a simple piece of data. and the developer experience of running dozens of services in a kubernetes cluster running on my dev machine was awful.does anything like this exist?i only dabbled many years ago but erlangotp comes to mind.and trpc for typescript calls in browser and server.;0
34243505;HackerNews;2023-01-04;i don't completely agree here.yes if you can't scale fast enough as you need to it can hurt your business. not being able to keep up with demand is a luxury problem that every business faces not just in tech. they would often be called 'growing pains' in a business and though they are bad they rarely contribute to the failure of a company.starting a startupserviceplatform with microservices before you even understand the bottlenecksmarket fitcustomers is usually not a good idea. you can come a very very long way with a monolith before you hit performance and scalability limits. and once you do you can always start breaking things up into smaller services for scalabity. obviously you need to make sure you are scaling on time to keep up with demand.'nail it then scale it' and 'premature optimization is the mother of all fups' are popular sayings for a reason.;0
34243492;HackerNews;2023-01-04;a benefit of microservices is that you can use specialised languages for different parts of the system. the core of your system might be written in java but you might one to use python for an ml heavy module. nonetheless i tend to agree that in an organisation with 100 microservices probably the ideal way would be to have 4 or 5 based on exceptions where you have modules that need a specific hardware profile e.g. a lot of ram or a different programming language than your core system. everything else could go into modules in a megaservice.;0
