ID;Source;Creation Date;Content;Sentiment
34235273;HackerNews;2023-01-03;i why can't the teams work on the same codebase and the same database?ithe same database is tricky because one team might want to change the schema breaking another team's work. you then need to have meetings to discuss the changes that will work for all parties and you've broken communicate only by contract and therefore no longer doing microservices. if you can ensure that there is no way for teams to trample over each other then you could use the same database.the same codebase is more feasible as long as the team boundary separation is clear. you are likely already doing microservices with other teams when you import thirdparty libraries. in practice though much like the database problem maintaining boundary separation is difficult if you can easily reach into other team's code so often each team's work will be parted into distinct codebases using ipc between them to ensure that the separation is unbreakable. this certainly isn't a requirement though just one way to keep people in line.i testing is certainly a way to provide a selfverifying application. tdd is a toxic hypedriven messitesting is a development tool to help test the functionality of a feature. if you are faced with a dynamic language you very well might write tests to ensure that types are handled correctly. static types can indeed relieve the need for some tests.tdd on the other hand is a documentation tool to relay to other developers what functionality is intended to provide and how it is meant to be used. it is strange to think that documentation is toxic. before tdd we wrote word documents containing the same information but often found that the code didn't do what the documentation said it did. what tdd realized is if the documentation is also executable then you can have the machine prove that the application behaves according to spec. it's not exactly magic.;0
34235204;HackerNews;2023-01-03;my take do microservices all you want but don't organize teams around the services!exactly. in order to reap the benefits of modularmicroservices architecture you need teams to be organized around productfeature verticals.imo its not about the internals of a productservice architecture but about encapsulating isolating and formalizing interorganizational dependencies.;0
34235159;HackerNews;2023-01-03;mostly valid but...on the ram front i am now approaching terabyte levels of services for what would be gigabyte levels of monolith. the reason is that i have to deal with mostly duplicate ram the same 200 mb of framework crud replicated in every process. in fact a lot of microservice advocates insist ram is cheap! until reality hits especially forgetting the cost is replicated in every developmenttesting environment.as for slow startup a server reboot can be quite excruciating when all these processes are competing to grind amp slog through their own copy of that 200 mb and get situated. in my case each new amp improved microservice alone boots slower than the original legacy monolith which is just plain dumb but it's the tech stack i'm stuck with.;0
34235125;HackerNews;2023-01-03;layers not modules not microservices like donkeys onions caching networking my feelings and perceptions.;0
34235087;HackerNews;2023-01-03;you know i don't really think microservices are fundamentally more scalable. rather they expose scaling issues more readily.when you have a giant monolith with the load the world endpoint it can be tricky to pinpoint the the load the world endpoint or as is often the case endpoints is what's causing issues. instead everyone just tends to think of it as the x app having problems.when you bust the monolith into the xyz and x and z got the load the world endpoints that starts the fires of x is constantly killing things and it's only doing this one thing. how do we do that better?that allows you to better prioritize fixing those scaling problems.;0
34235045;HackerNews;2023-01-03;microservicesi think at the root this idea that microservices provide this technical solution to a social issue coordinating teams at scale hides the driving motivation.why can't the teams work on the same codebase and the same database? again note my edited in disclaimer in the gp post that maybe at certain rare scales it's necessary. what is a well defined specification and why is it only a restprotowhatever network api? why not a defined interface or projectlibrary? why aren't teams at this scale working in languages that support defining these things in code without adding a complicating latency and errorinducing network call?statically typed languages are just superior at encoding this well defined specification. it's a large part of their reason for being. sure you can still bypass it and do reflection or other naughtiness but we shouldn't pretend a network call is the only solution. tdditestingi is certainly a way to provide a selfverifying application. tdd is a toxic hypedriven mess that has led many good developers astray. static languages have their own devils here mocking being chief among them not to mention the java clown brigade and their own enthusiastic adoption of originally smalltalk conceived tdd.i added tdd both to annoy people but also to illustrate the general point. these are both concepts derived from the obvious drawbacks of dynamically typed languages that are then treated as generalist answers to complexity in software.if you'll allow me some pseudointellectual waffle the complexity of a software system cdynamic csoftware ctotal that is complexity of dynamically typed languages and their lack of rigour plus complexity of software and the domain as a whole gives you total complexity. these approaches primarily target the dynamic complexity. therefore introducing them and all attendant drawbacks in places where total complexity doesn't include the dynamic complexity because tools and approaches to remove this source of complexity are used actually worsens the entire field.;0
34235038;HackerNews;2023-01-03;if you really require that sort of isolation then microservices are a bugridden ad hoc implementation of half of erlang.;0
34235011;HackerNews;2023-01-03;any way you slice it it's hard to managealigncoordinate a 100 devs.if done right microservices is a way to transform part of your organization challenge into a technical one which for many organizations is the right move.the biggest issue is if you aren't large enough to have challenging organizational issues it's much easier to just solve the very solvable organizational issues than implement and use microservices.;0
34234991;HackerNews;2023-01-03;at the heart of microservices we often find... ... the fallacies of distributed computing.i feel like im taking crazy pills but at least im not the only one. i think the only reason this fallacy has survived so long this cycle is because we currently have a generation of network cards that is so fast that processes cant keep up with them. which is an architectural problem possibly at the application layer the kernel layer or the motherboard design. or maybe all three. when that gets fixed there will be a million consultants to show the way to migrate off of microservices because of the 8 fallacies.;0
34234977;HackerNews;2023-01-03;managers arranging work is not why conway's law is true though. i think it behooves one to look at the actual text of the law any organization that designs a system defined broadly will produce a design whose structure is a copy of the organization's communication structure.it doesn't matter who defines or does the work the coders themselves in a team or the manager. it matters how communication is arranged. and communication naturally aligns itself along organizational and team boundaries.when a grouppersonwhatever writes an api they are mostly writing a document for other human beings. that is an act of communication. if you meet with someone everyday in a standup you're likely to put a less structured api between yourselves than if you meet with someone once a month or once a year. you're also going to create a finer grained subdivision of the api for them as you're likely working on closely related posts of the problem.organization creates communication and communication creates architecture. therefore organization creates architecture. plus conway is just a ... neat idea not a bound fateit is in fact bound fate. code is written to communicate with others.people come together they decide to solve a problem. they divide up that problem and create functions an api objects an api modules an api and servicesmicroservices an api. at each later they've written something that communicates with others. the structure of that code reflects the necessary communication to the other parties for their part of the problem. this the code is structured following the lines of communication in the organization.organization is how we structure communication that's it's primary point and thus organization architecture some wiggle room for communication paths defined outside that say a safe feature team.;0
34234905;HackerNews;2023-01-03;from what i can tell github transitioned over to microservices 2020 . by this point it had already grew to a scale that very few companies will ever reach.i'm not sure at what point the monolith codebase became absolutely enormous but i would bet that github grew to 1m active users with a monolith just fine.microservices might be necessary for the companies like github twitter google that grow to be huge but monoliths seem to work just fine for the vast majority of other companies.;0
34234904;HackerNews;2023-01-03;microservices are less iefficienti but are still more iscalablei.servers can only get so big. if your monolith needs more resources than a single server can provide then you can chop it up into microservices and each microservice can get its own beefy server. then you can put a load balancer in front of a microservice and run it on n beefy servers.but this only matters at facebook scale. i think most devs would be shocked at how much a single beefy server running efficient code can do.;0
34234879;HackerNews;2023-01-03;the best experience i've had with modular code in the java space was osgi. very cool to be able to upload a new jar and have it start working just like that. microservices and eda... not really a fan. yes you can release faster but operationalizing is a massive nightmare to me. of course one size doesn't fit all but i'm pretty convinced this is only a popular solution for now.;0
34234857;HackerNews;2023-01-03;microservices by definition do not share a db. if they do then you just have multiple processes in the same larger service.;0
34234840;HackerNews;2023-01-03;i've been thinking for a while about how to architecture systems and i wonder if perhaps we could generalize something like fuchsia's device driver stack design 1 for arbitrary systems and eliminate this monolithic vs microservice applications debate altogether.in fuchsia the device driver stack can be roughly split into three layers drivers which are components libraries with added metadata that both ingest and expose capabilities a capabilityoriented ipc layer that works both inside and across processes driver hosts which are processes that host driver instances.the system then has the mechanism to realize a device driver graph by creating device driver instances and connecting them together through the ipc layer. what is interesting however is that there's also a policy that describes how the system should create boundaries between device driver instances 2.for example the system could have a policy where everything is instantiated inside the same driver host to maximize performance by eliminating interprocess communication and context switches or where every device driver is instantiated into its own dedicated driver host to increase security through process isolation or some middle ground compromise depending on security vs performance concerns.for me it feels like the dockerlike containerization paradigm is essentially an extension of good old user processes and ipc that stops at the process boundary without any concern about what's going on inside it. it's like stacking premade lego sets together into an application. what if we could start from raw lego bricks instead and let an external policy dictate how to assemble them at runtime into a monolithic application running on a single server microservices distributed across the world or whatever hybrid architecture we want with these bricks being none the wiser?heck if we decomposed operating systems into those bricks we could even imagine policies that would also enable composing from the ground up with applications sitting on top of unikernels microkernels or whatever hybrid we desire...1 2;0
34234831;HackerNews;2023-01-03;without the organizational benefits of a microservice you are just just making intermodular calls really slow and fail intermittently.;0
34234813;HackerNews;2023-01-03;i don't think microservices are the answer to everything but i don't see how monoliths can keep up with developer velocity when an organization reaches thousands of developers.monoliths are way slower to deploy than microservices and when you have hundreds or thousands of changes going out every day this means lots of changes being bundled together in the same deployment and as a consequence lots of bugs. having to stop a deployment and roll it back every time a defect is sent to production would just make the whoe thing completely undeployable.microservices have some additional operational overhead but they do allow much faster deployments and rollbacks without affecting the whole org.maybe i am biased but i would love an explanation from the monolithevangelist crowd on how to keep a monolith able to deploy multiple times a day and capable of rolling back changes when people are pushing hundreds of prs every day.;0
34234796;HackerNews;2023-01-03;idk i feel like one of the benefits to uservices is isolation not in design or architecture as many comments say but isolation from one service affecting another.if i run a monolith and one leastused module leaks memory real hard the entire process crashes even though the mostusedmore important modules were fine.of course it's possible to run modularised code such that they're sandboxedresources are controlled but at that point it's like...isn't this all the same concept? managed monolith with modules vs microservices on something like k8s.i feel like rather than microservices or modules or whatever we need a concept for a sliding context from one functionone group of functionsone featureone servicedependent servicesall servicesetc.with an architecture like that it would surely be possible to run each higher tier of context in any way we wanted as a monolith containerised as lambdas. and working on it would be a matter of isolating yourself to the context required to get your current task done.;0
34234790;HackerNews;2023-01-03;i just want to point out that for the second problem scalability of cpumemoryio microservices almost always make things worse. making an rpc necessarily implies serialization and deserialization of data and nearly always also means sending data over a socket. plus the fact that most services have some constant overhead of the footprint to run the rpc code and other things healthchecking stats collection etc. that is typically bundled into each service. and even if the extra cpumemory isn't a big deal for you doing rpcs is going to add latency and if you get too many microservices the latency numbers can start really adding up and be very difficult to fix later.running code in a single process is much lower overhead because you don't need to transit a network layer and you're generally just passing pointers to data around rather than serializingdeserializing it.there are definitely some cases where using microservices does make things more cpumemory efficient but it's much rarer than people think. an example where you'd actually get efficiency would be something like a geofence service imagine uber doordash etc. where the geofence definitions are probably large and have to be stored in memory. depending on how often geofence queries happen it might be more efficient to have a small number of geofence service instances with the geofence definitions loaded in memory rather than having this logic as a module that many workers need to have loaded. but again cases like this are much less common than the cases where services just lead to massive bloat.i was working at uber when they started transitioning from monolith to microservices and pretty much universally splitting logic into microservices required provisioning many more servers and were disastrous for endtoend latency times.;0
34234696;HackerNews;2023-01-03;i always love that circular logic.hey our developers can't make modules correctly! let's make the api boundaries using http calls instead then they'll suddenly know what to do!and that unsupervised junior? at one place i joined that unsupervised junior just started passing data he needed via query string params in ginormous arrays from microservice to microservice.and it wasn't a quick fix because instead of using the lovely type system that tells you where the stupid method has been used you've got to go hunting for http calls scattered over multiple projects.all you've done is make everything even more complicated if you can't supervise your juniors your code's going to go sideways whatever.microservices don't solve that at all and it's pure circular logic to claim otherwise. if your team can't make good classes they can't make good apis either. and worse still suddenly everything's locked in because changing apis is much harder than changing classes.;0
34234357;HackerNews;2023-01-03;you don't want to fracture knowledge and make hiringtraining more difficultthese are not maxims of development there can be reasons that make these consequences worth it. furthermore you can still use just a single language with microservices nothing is stopping you from doing that if those consequences are far too steep to risk.you can also use several languages with modules by using ffi and abis probably.;0
34234324;HackerNews;2023-01-03;dynamic typing microservices unit tests just blows everything out of the water on development speed time to market.most important thing for lots of startups and companies is time to market.traditional static typing based approachs are just a bad joke 3 times slower on average in comparsion.that's why we have the whole microservices and dynamic typing thing going on because businesses that use it beat up businesses that don't. it's pretty simple really.;0
34234243;HackerNews;2023-01-03;as a senior software engineer the most tiresome type of software dev to deal with is not the junior developer it's the highly opinionated intermediatelevel dev. they say things like we'll obviously build the system using modern microservices architecture using node.js before they even know the requirements.;0
34234192;HackerNews;2023-01-03;yes it's very common design. sometimes called a distirbuted monolith. it's not microservices because the number of additional services is usually small and the codebase is still tightly coupled to itself even if well factored in terms of modules. i.e. everything is still tested together and there's still a single monolithic build and deployment process and no team can go off and decide to write a service in a different language.;0
34234146;HackerNews;2023-01-03;it's called conway's law .;0
34234111;HackerNews;2023-01-03;perhaps we should coin the phase 'embedded microservices'.;0
34234072;HackerNews;2023-01-03;it's easy to crap on ejb lots to disagree with but vendors like weblogic were trying to do interesting things with them when they were ascending. i recall they had a nifty feature where if you were trying to call a remote ejb and the container knew it was deployed locally it would automatically do a cheaper local call instead of rmi. it was awkward as hell but it did do that and it was faster. j2ee also had the concept of people roles as part of its prescribed sdlc something we could benefit from exploring especially the deployer role.ideally we could flexibly deploy servicescomponents in the same way as weblogic ejb. discovery of where components live could be handled by the container and if servicescomponents were deployed locally to one another calls would be done locally without hitting the tcpip stack. i gather that systems like kubernetes offer a lot of this kind of deployment flexibilitydiscovery but i'd like to see it driven down into the languagesframeworks for maximum payoff.also the right way to do microservices is for services to own all their own data and not call downstream services to get what they need. no n1 problem allowed! this requires inverting the arrowsdon't call me i'll call you and few organizations have architectures that work that way hence the fallacies of networked computing reference. again the services languageframework needs to prescribe ways of working that seamlessly establish and can periodicallyondemand rebroadcast data feeds that our upstreams need so they don't need to call us n1style.microservices are great to see even with all the problems they do solve organizational scaling problems and let teams that hate each other work together productively. but we have an industry immaturity problem with the architectures and software that is not in any big players' interest in solving because they like renting moar computers on the internet.i have no actual solutions to offer and there is no money in tools unless you are lucky and hellbent on succeeding like jetbrains.;0
34234052;HackerNews;2023-01-03;but i am itryingi to feel my way towards the idea that ithat was true when managers arranged systems for workers to followi and then we came along to automate the current process. but if we have a system where the workers are the cpus then the people doing the managing are the coders.the point ebing is that if workers are cpus and coders are managers then why worry about how the imanagers of the codersi are arranged. get rid of that management layer. conway is not implying the financiers of the organisation affect the architecture.this basically means that the microservices a company is built out of should more readily align to the realities of the business model. and instead of shuffling organisations around it would behove executives to look at the microservices.one can more easily measure orders transferred etc if the boundaries are clearer.plus conway is just a ... neat idea not a bound fate.there is a caveat with the architecture reflecting the organisation of the software teams but that usually follows the other tobeautomated structure as well.;0
34234043;HackerNews;2023-01-03;is this a common nomenclaturedesign? how does a monolith that makes ipcrpc calls to submodules not basically microservices?;0
34233968;HackerNews;2023-01-03;whilst i don't know much about cruises. let me make up an example for you.let's suppose we are acme cruise lines running a cruiselinermicroservice national coastguard ship arrival system feed handlerdatabase logs incoming messages on the feedmicroservice asian and australian joint ship monitoring systemdatabase logs incoming messages on the feedmicroservice cruiser arrival and departure timesdatabase cruiser arrival and departures times in a standard formatmicroservice customer bookings and paymentsdatabase customer bookings and paymentsmicroservice fuel management systemdatabase ship fuel levels amp costs of fuel at various ports.it's that high level of split up.aws lambdas aren't quite the same thing as microservices.;0
34233917;HackerNews;2023-01-03;as far as i know there's no way to granularly scale up a monolith. if the monolith has 20 or 50 or 100 modules and you need 1 or 2 of them scaled you have to scale up the entire thing which is huge expensive etc.not necessarily. yes you do pay for executable bloat and some memory overhead from loading code into memory but the argument here is that you can still deploy a service b from the same deployable that only services certain kinds of requests in order to scale parts of the application horizontally. this is interesting. a monolith with some form of ipc? why not do microservices at that point? that sounds like microservicesish?no because again you're still deploying the same single codebase it's just the instance on the other end of the queue is configured just to consume and process messages.;0
34233916;HackerNews;2023-01-03;just wait until you decide you need some kind of distributed transaction support across multiple microservices you should aim to spend a considerable amount of time in the design and discovery phases.;0
34233912;HackerNews;2023-01-03;the way it usually works if 1 of your 100 modules needs to be scaled it probably means the overall monolith only needs a small amount of extra resources since that module is only using 1 of the total. so it's not like you need to double the instances of the whole thing.the benefit though is you get a bit of 'free' scaling. most of the modules don't even have to consider scaling at all as long as they are growing average or slower. so this saves a lot of operational burden for many teams. conversely with microservices ieveryi team ihas toi consider scaling no matter how simple their service is.if you do have 1 module out of 100 that takes up 40 of the resources then it may be appropriate to split it up. monolith doesn't literally mean exactly one service after all just a small number of big ones.;0
