ID;Source;Creation Date;Content;Sentiment
29576352;HackerNews;2021-12-16;Title:Don't start with microservices – monoliths are your friend, Content: https://arnoldgalovics.com/microservices-in-production/;0

29646953;HackerNews;2021-12-22;the exact reason why i compare microservices to oop that's just because some guru uncle bob or even more probably martin fowler i think some rather long by now time ago wrote a lot of examples along the lines of methods should be at most five preferably three lines long in java.if you look for later examples of the same kind of recommendation you'll probably find they're mostly written in funtional languages nowadays so you could just as well say that's why i compare microservices to fp.;0
29614235;HackerNews;2021-12-19;yeah the ops side of microservices is important.more granular scaling. scaling up instances of 8 16 32gb or even larger instances is much more expensive than 124gb instances. in addition monoliths tend to load slower since there's more code being loaded so you can't scale up in sub minute timesobviously there's lazy loading caching and other things to speed up application boot but loading more code is still slower;0
29607442;HackerNews;2021-12-18;i feel like a lot of microservice advocates fail to price in the overhead introduced when you split stuff up into multiple independent communicating units.example replacing a simple database query effectively instant and relaying the data as a local variable with poking a seperately hosted microservice which ends up adding 20ms of overhead doing a https request encoding and deencoding the result in json etc.;0
29606318;HackerNews;2021-12-18;this is actually quite a nice sweet spot on the monomicro spectrum. most bigger software shops i've worked at had this architecture though it isn't always formally specified. different servers run different subsets of monolith code and talk to specific data stores.the benefits are numerous though the big obvious problem does need a lot of consideration with a growing codebase and engineering staff it's easy to introduce calls into codedata stores from unexpected places causing various issues.i'd argue that so long as you pay attention to that problem as a habithave strong norms around think about what your code talks to even indirectly you can scale for a very long time with this architecture. it's not too hard to develop tooling to provide visibility into whatscalledwhere and test foraudittrack changes when new callers are added. if you invest in that tooling you can enforce internal boundaries quite handily while sidestepping a ton of the organizational and technical problems that come with microsevices.of course if you start from the other end of the monomicro spectrum and have a strong culture of e.g. understand the service mesh really well and integrate with it as fully as possible you can do really well with a microserviceoriented environment. so i guess this boils down to invest in tooling and cultivate a culture of paying attention to your architectural norms and you will tend towards good engineering ... who knew?;0
29603692;HackerNews;2021-12-18;yes the original argument was that boundaries can't be enforced. arguably it is easier to enforce boundaries between microservices.;0
29603356;HackerNews;2021-12-18;there is no single development in either technology or management technique which by itself promises even one orderofmagnitude improvement within a decade in productivity in reliability in simplicity. fred brookssussman summed up the problem nicely we really don't know how to compute! so we latch onto whatever semiplausible idea some consultant cooks up like flowcharts structured programming agile objectoriented programming testdriven development microservices and countless other things.microservices impose a transport layer over whatever it is you were doing before. so that's one extra point of failure that you've got to contend with. complex problems require complex solutions. sure there are better and worse ways of doing things but there are no miracles.;0
29601965;HackerNews;2021-12-18;microservices requires lots of forethought design and highly qualified engineers.you spent the same amount of forethought design and talent on monoliths youd might not need microservices.the real issue is scale.a well designed micro service mesh will scale. a well designed monolith might scale.;0
29596353;HackerNews;2021-12-17;amazon was also doing microservices very early and it was a monolithic c application originally obidos.microservices was relly more about locality and the ability to keep data in a memory cache on a thin service. rather than having catalog data competing with the rest of the monolithic webserver app on the front end webservers requests went over the network to a load balancer they were hashed so that the same request from any of the webservers hit the same catalog server then that catalog server usually had the right data for the response to be served out of memory.most of the catalog data was served from bdb files which had all the nonchanging catalog data pushed out to the catalog server initially this data had been pushed to the webserver. for updates all the catalog servers had realtime updates streamed to them and they wrote to a bdb file which was a log of new updates.that meant that most of the time the catalog data was served out of a redislike cache in memory which due to the load balancer hashing on the request could use the aggregated size of the ram on the catalog service. rarely would requests need to hit the disk. and requests never needed to hit sql and talk to the catalog databases.in the monolithic world all those catalog requests are generated uniformly across all the webservers so there's no opportunity for locality each webserver needs to have all the top 100000 items in cache and that is competing with the whole rest of the application and that's even after going to the world where its all predigested bdb files with an update service so that you're not talking sql to databases.;0
29591723;HackerNews;2021-12-17;overall this setup would work perfectly fine in a smallmedium company and take 510x less time than doing everything the faang way.the point was never comparing it to the faang way. the point is it's easier at the beginning to maintain one monolith and all the production stuff related to it than n microservices.;0
29591341;HackerNews;2021-12-17;i didnt't even get a quater of the way down the page before i stopped reading.as soon as the author started listing things like k8s as needed for microservices it shows they havent stopped to think out side the box. there is no reason you can't run your set of microservices as 34 docker containers on the same host no load balancers no k8s no log aggrigation etc etc etc.if your application makes sence as microservices you don't need to start with all of that so including it all in the cost of startup makes no sense at all as your application starts to scale out and need them add them at that time your going to need most of it for a monolith application as well and some of them you may never need k8s for example there is no reason you can't run your application on just plain old compute infrastructure you don't even need to look at the cloud that old box in the corner of your office might be all you need for the projectif you stop and remember that microservices just means small single function services not things like k8s you will probably find that you can actully do a lot less work if you go down that road by letting other exsisting projects so a whole bunch of the work for you and save you reinventing the wheel to get your project finished and out the door.;0
29590723;HackerNews;2021-12-17;when the autor says to be fair using k8s helm i was able to install logging grafana prometheus very easily. if you leverage on helm3 and bitnami 1 helm charts you can go fast.also you can use pipeline like githubbitbucket pipelines to deploy and remove jenkins completly i have done it and it is a viable solution although with some lockin.so the complexity is a bit less if you study enough well your setup but you imust take time to plan your solutioni.after three years of k8s study in my humble option k8s is far better compared to docker swarm even for tiny projects with k8s as a cloud managed solution even small provider had it nowadays.1;0
29590439;HackerNews;2021-12-17;you're talking about something very odd here... a monorepo with a monolithic build output but that... transforms into any of a number of different services at runtime based on configuration?i'd say that it's more uncommon than it is odd. the best example of this working out wonderfully is gitlab's omnibus distribution essentially one common package e.g. in a container context that has all of the functionality that you might want included inside of it which is managed by feature flags here's an example of what's included now i wouldn't go as far as to bundle the actual db with the apps that i develop outside of databases for being able to test the instance more easily like what sonarqube does so you don't need an external db to try out their product locally etc. but in my experience having everything have consistent versions and testing that all of them work together makes for a really easy solution to administer.want to use the built in gitlab ci functionality for app builds? just toggle it on! are you using jenkins or something else? no worries leave it off.want to use the built in package registry for storing build artefacts? it's just another toggle! are you using nexus or something else? once again just leave it off.want ssltls? there's a feature flag for that. prefer to use external reverse proxy? sure go ahead.want monitoring with prometheus? just another feature flag. low on resources and would prefer not to? it has got your back.now one can argue about where to draw the line between pieces of software that make up your entire infrastructure vs the bits of functionality that should just belong within your app but in my eyes the same approach can also work really nicely for modules in a largely monolithic codebase. is this meant to be simpler than straight separate codebase microservices?quite a lot actually!if you want to do microservices properly you'll need them to communicate with one another and therefore have internal apis and clearly defined service boundaries as well as plenty of code to deal with the risks posed by an unreliable network e.g. any networked system. not only that but you'll also need solutions to make sense of it all from service meshes to distributed tracing. also you'll probably want to apply lots of ddd and before long changes in the business concepts will mean having to refactor code across multiple services. oh and testing will be difficult in practice if you want to do reliable integration testing as will local development be do you launch everything locally? do you have the run configurations for that versioned? do you have resource limits set up properly? or do you just connect to shared dev environments that might cause difficulties in logging debugging and consistency with what you have locally?.microservices are good for solving a particular set of problems e.g. multiple development teams one per domainservice or needing lots of scalability but adding them to a project too early is sure to slow it down and possibly make it be unsuccessful if you don't have the preexisting expertise and tools that they require. many don't.in contrast consider the monolithic example above i'd argue that up to a certain point this sort of architecture actually scales better than either of the alternatives in comparison to the regular monoliths it's just a bit slower to develop in that it requires you to think about boundaries between the packagesmodules in your code which i've seen not be done too often leading to the big ball of mud type of architecture. so i guess in a way that can also be a feature of sorts?;0
29590250;HackerNews;2021-12-17;i agree to not start with microservices.. but its better to not wait too long after the project is growing.regarding his points infrastructure requirementsyou don't need all that stuff! you can have multiple services run on paas services cloud run and you dont need to deal with all the kubernetes stuff. even if you prefer k8s then you still dont need a service mesh from the start. datadog and gitlab brings you very far with hardly any work on your side. faster deploymentsmy point 80 microservices? crazy .. why? just have a service per business domain and try unifying the cicd stack.we had 1 big monolith which would deploy 5 times per day buy every deploy took around 1 hour.having 5 to 10 services that all deploy within 5 minutes is so much nicer to work with. the supporting culturethis is important architecture follows company organization and vice versa. every team often owns 1 or 2 services. teams should be organized by domain. business boundaries should be agreed upon in a higher level.sitting in your dev corner building services without talking and aligning with the product owners amp mt is a recipe for distaster imho. the services should solve a problem that po's understand. you should have alignment. better fault isolationwe never said it was going to be easy... it requires a different way of building your system. you need to think distributed systems.;0
29589817;HackerNews;2021-12-17;the problem is that orgs are not set in stone. teams get merged and split in reorgs buyouts and mergers happen suddenly your microservices designed around cleanly defined boundaries no longer make any sense. sure you can write completely new microservices but that is a distraction from delivering value to the end customer.;0
29589799;HackerNews;2021-12-17;for me it highly depends on the size of software the time to market the time the software is supposed to work without major rewrites.if i am doing a blog application or an website for one time event i would pick a monolith.if i start on erp a checkout solution i would pick microservices.also if the man power is low but i expect growth in the future i might go for a monolith broken in separate projects with minimal dependencies between modules so it wouldn't be terribly difficult to break it into microservices when the need and man power arrives.;0
29589736;HackerNews;2021-12-17;seems to me that the author is poor at designing microservices. using his example the login session and user services should be only one service something like keycloak there's no advantage to splitting this up so why would you? analytics service should never be a dependency of another serivce but rely on service discovery and a preset telemetryanalyticsrpc endpoint which each of the consumerfacing services implements.has anyone claimed that microservices will fend of poor design? there's never a silver bullet.;0
29589283;HackerNews;2021-12-17;the archetypical microservice ecosystem i am aware of is google's production environment. it was at that point primarily written in c and java neither very famous for being dynamically typed.but it was a microservice architecture built primarily on rpcs and not very much on message buses. and rpcs that basically are statically typed with code generation for client libs and code generation for serverside stubbing as it were. the opensource equivalent is grpc.where going microservice is a potential saving is when different parts of your system have different scaling characteristics. maybe your login system ends up scaling as olog n but one datamunging part of the system scales as on log n and another as just on. and one annoying but important part scales as on 2. with a monolith you get lbs in place and you have to scale you monolith out as the part that has the worst scaling characteristic.but in an ideal microservice world where you have an rpcbased mechanism taht can be loadbalanced rather than a shared message bus that is harder to much harder to scale you simply dial up the scaling factor of each microservice on their own.;0
29589156;HackerNews;2021-12-17;i know thanks.my point is precisely that if you have to handle large quantity of state e.g. travel agency handling diverse item bookings to sell as a complete holiday packages note that this includes having conflicts on inventory like cruise cabin categories or hotel rooms microservices add latency by replacing function calls with rpc and gain you... an unspecified advantage in terms of... deployment? the possibility to have hundreds of developers working on the system in parallel?i have always worked on mediumsize monoliths during most of my career and iah if we had 137 developers all working on this everything would be magically solved but alas we have a monolithi was a sentence i uttered or heard exactly 0 times so far.;0
29588939;HackerNews;2021-12-17;ive heard before that microservices deployment scheme solves one particular task if you get traction youll be ready for scaling. if you cant do that you are already dead cause being unable to get 10x more users with a click when they come means your competition will do that instead. is that still true?;0
29588921;HackerNews;2021-12-17;i like monoliths... which are modular inside... no need for microservices easy deployment even without docker and kubernetes... just a single binary...;0
29588812;HackerNews;2021-12-17;its really not odd at all...this is how compilers work...we have been doing it forever.microservices were a half baked solution to a nonproblem partly driven by corporate stupidity and charlotan 'security' experts i'm sure big companies make it work at enough scale but everything in a microservice architecture was achievable with configuration and hotpatching. incidentally you don't get rid of either with a mcs architecture you just have more of it with more moving parts...absolute sphegetti mess nightmare.;0
29587824;HackerNews;2021-12-17;i mean this is kind of how microservices should be done. start with a mvp monolith then carve off microservices if needed performance or large team size.the problem is when the lead dev has been huffing the architecture paint too hard and starts prematurely spinning up microservices because it feels good.;0
29587781;HackerNews;2021-12-17;i it's a pretty obvious conclusion to anyone who has worked in both environments or have had to migrate from one to the other so it's not particularly insightful.iit should be obvious but apparently it's not. so many architecture astronauts drinking the koolaid and making a mess. premature microservices can easily kill a product.;0
29587721;HackerNews;2021-12-17;that can definitely happen and be painful. i now work at a very large organization though and the benefits of microservice design are obvious as were the pains of monolithic ones when i was working on an old legacy monolith in the same place.;0
29587713;HackerNews;2021-12-17;my understanding from the html template days is that a monolith contained both the business and presentation layer together. i made plenty of those with struts 1.x and spring mvc. micro services were pitch as a means to separate the front end and back end.i'm a bit confused on microservices vs monolith in the modern spa context. if i have an application that's front end is react and back end is go and the two communicate over resthttprpc do i have microservices or a monolith?;0
29587591;HackerNews;2021-12-17;i doubt you can judge the blast radius.say your little service just changed how it parsed backticks. now that innocuous change may affect none of the immediately connected microservices but another services three hops away relied on the old behavior of your parser through some complex business rules driven logic. now go test and later troubleshoot that vs standing up a single monolithic jar on your laptop and seeing the exception stack trace tell you exactly what you broke.;0
29586877;HackerNews;2021-12-17;oftentimes however with microservices it's the tail wagging the dog. microservices architectures become such a burden that they strain the capacity of the existing team which leads to more hiring which thanks to conway's law leads to more microservices being built which leads to more operational and architectural overhead which leads to more hiring...;0
29586831;HackerNews;2021-12-17;the individual code bases of a microservice might not involve spaghetti code but the interconnections certain can. i'm looking at a diagram of the service i work on with seven components written in three languages five databases 25 internal connections two external interfaces and three connections to outside databases all crosswired via 6 connections with a similar setup geographically elsewhere in case we need to cut over. and that's the isimplifiedi diagram not showing the number of individual instances of each component running.there is clear separation of concerns among all the components but it's the interconnections between them that take a while to pick up on.;0
29586815;HackerNews;2021-12-17;of course this advice doesn't ialwaysi make sense but it makes sense more often than people want to admit. not that this is an original claim if anybody remembers the majestic monolith.simply put the microservice path makes a lot more sense when your organization is so big that you don't really know what other teams are doing all the time and need a clear delineation of areas of responsibility or maybe if you have very large volumes you're dealing with. that doesn't describe most orgs but if it describes you consider microservices.;0
29586706;HackerNews;2021-12-17;my impression which seems to be supported by this article? is that when you're small you can actually get up amp running with an mvp with a nonserverless monolithic approach iandi scale for a bit before you hit a wall. and ionlyi at that point 1 scaling becomes much more complex and 2 monolithic infrastructure prevents you from easily implementing bestofbreed solutions within segments of your functionality to optimize various functionality. and from a cloud services pov it's cheaper and perhaps require less dev time though i'm guessing that will depend on the projectthis seems reasonable? at least at the early amp earlymid stages. if you make it that far and see things like scaling issue in your future it seems like you should also be at a stage of growth where you'll be getting reasonable funding offers and can invest the resources into migrating away from monolithic.disclaimer my opinion here is formed mostly from following a notcompletelydissimilar process even when working with things more on a monolithic side of things i'll use a highpowered workstation to spin up a vm's on the same host and then if i need to i can migrate individual vm's to their own betterresourced instances on other hardware to scale things. i did this some years ago with a hadoop cluster and the process worked out nicely.although as it turned out that example didn't last long hadoop was overkill because i overestimated the bigness of my data which turned out to only be on the bigger side of small. or smaller side of medium. when i had a rethink on it i wrote some python code against a the primary sqlbased data source amp used keras to do what i needed instead iterating each pieceon a nicelyspec'ed workstation took an hour or so and a full endtoend run maybe 34 hours.but this is kind of my point starting out it's easy to thing oh i need to plan for ever possible eventuality amp level of scale. no you don't.and a final caveat to this ymmv since circumstances differ from project to project. but these are things to consider before you automatically go for slicing each piece of functionality into grains of sand with their own microservice.;0
29586541;HackerNews;2021-12-17;i've wondered if it's not a ploy by cloud vendors and the ecosystem around them to increase peoples' cloud bills. not only do you end up using many times more cpu but you end up transferring a lot of data between availability zones and many clouds bill for that.disagree. i'd argue that microservices are inherently more cost effective to scale. by breaking up your services you can deploy them in arbitrary ways essentially bin packing n microservices onto k instances.when your data volume is light you reduce k and repack your n services.because your services are broken apart they're easier to move around and you have more fine grained scaling. further increasing lockin to the managed cloud paradigm if not to individual clouds.also disagree. we use nomad and it's not hard to imagine how we would move to another cloud.;0
29586327;HackerNews;2021-12-17;i've been a professional programmer since the late 1990s. what i observe is that many people flocked to microservices because they had only known monoliths and they were sick of the limitations inherent to them. now we have a generation of engineers who have only known or been taught microservices and a backlash has developed because they are sick of the limitations inherent to them.this is my reading of the antioop antiinheritance movement as well. to spice up bjarne stroustrup inventor of c there are only two kinds of programming languages those that don't make it and those that people bitch about.;0
29586287;HackerNews;2021-12-17;absolutely agree. the point of microservices is to separate the concerns from an organizational point of view not for technical reasons.most of the advantages attributed to microservices can also be achieved with a monolith architecture using a sane and rigorous design.i find it frustrating at work when i see teams of 50 people having issues coordinating work because they have a monolith while we often unnecessarily spread a team of 5 people among 10 microservices.;0
