ID;Source;Creation Date;Content;Sentiment
29585594;HackerNews;2021-12-17;one problem i've never seen mentioned regarding microservices is what happens when the organization that produced them has moved from growing to stagnating and finally into decline. if microservices ship the orgchart what happens when that organization fails to attract engineers?i worked for a company that microserviced themselves into a pit. we had a huge layoff which completely killed the morale of the remaining engineering staff. over the next 3 years more and more engineers left and the company refused to replace them. what started out as teams 5 people responsible for 3 microservices ended up as teams of 3 people responsible for 6 microservices.it was kind of cool to be responsible for more architecture and see how it all fit together but the sad reality was that too many of the microservices that had been stood up were stitching together disparate data from other microservices to then perform what a single sql query against a rdbms was doing.;0
29585586;HackerNews;2021-12-17;independent teams each developing independent services and acting without topdown approval is a different way to coordinate development that values productivity keeping everyone unblocked and innovation finding better ways of doing things.i've had the opposite experience. in the monolith anyone can make the necessary changes because it's all one codebase that everyone is familiar with. at most you might need some helppairingapprovals from experts in particular areas but in general any team can work independently.by comparison in the microservices world many teams either don't want you to touch their service or are using a tech stack so unfamiliar to you that it would take too long to be productive. and there's a rat's nest of interdependent microservices so you end up begging other teams to adjust their roadmap to fit you in. independent teams can pursue very different patterns without needing to agree with each other.i see this as more downside than benefit. if everyone is using different tech stacks it's harder for people to move between and contribute to different teams. and you end up with situations where one team uses java while another uses scala which brings in extra complexity to satisfy what are essentially aesthetic preferences.;0
29585291;HackerNews;2021-12-17;i disagree microservices are an architectural concept related to the software not to the infrastructure.whether you are using containers or vps or serverless or bare metal for your infrastructure that's completely unrelated to the concept of microservices you can deploy either a monolith or microservices in any of the above.as an example you can deploy a monolith on lambda1 or you can deploy microservices on bare metal using one of the several self managed serverless engines available2.1 see e.g. or 2 see e.g. and;0
29585064;HackerNews;2021-12-16;agree. imo modularitycoupling is the main issue. my issue w the microservice architecture is that it solves the modularity problem almost as a side effect of itself but introduces a whole host of new ones that people do not anticipate.yes if you at the outset say we will separate things into separate services you will get separated services. however you do not need to take on the extra complexity that comes with communication between services remote dependency management and additional infrastructure to reduce coupling.;0
29585058;HackerNews;2021-12-16;microservice is inconsistently defined. one cannot accuse them of using a strawman definition if there is no realman.;0
29585054;HackerNews;2021-12-16;managing complexity is hard no matter the approach to it. microservices define boundaries around component inputs and output and try to reduce complexity by black boxing functionality. monoliths try to reduce complexity by managing code languages libraries databases etc. i'm not sure there really is a good answer between the two because over time1. vendor and open source blackboxes get introduced to monoliths and you end up with a monolith built around a bunch of microservices.2. common tooling has a huge benefit and copypasta code gets the job done faster than everything being custom every time. so you end up with microservices that every task ends up importing some giant framework and uses common libraries so the monolith gets imported to the microservice.software gets complex faster than we all like to believe... it seems like software has gravity attracts complexity and ends up being a big ball of mud in the end almost every time.;0
29584932;HackerNews;2021-12-16;i've wondered if it's not a ploy by cloud vendors and the ecosystem around them to increase peoples' cloud bills. not only do you end up using many times more cpu but you end up transferring a lot of data between availability zones and many clouds bill for that.a microservice architecture also tends to lock you into irequiringi things like kubernetes further increasing lockin to the managed cloud paradigm if not to individual clouds.;0
29584905;HackerNews;2021-12-16;my theory is that microservices became vogue along with dynamically typed languages. lack of static types means that code becomes unmanageable at a much lower level of complexity. so the complexity was moved to the network which looks like a clear win if you never look outside a single component.;0
29584898;HackerNews;2021-12-16;i'd like to challenge one part of your comment that microservices break up data on module boundaries. yes they encapsulate the data. however the issue that causes spaghettification whether internal to some mega monolith across modules or between microservices is the semantic coupling related to needing to understand data imodelsi. dependency hell arises when we need to share an agreed understanding about something across boundaries. when that agreed understanding has to change microservices won't necessarily make your life easier.this is not a screed against microservices. just calling out that within a domain of understanding semantic coupling is pretty a fact of life.;0
29584806;HackerNews;2021-12-16;yeah i don't think there's really a best approach here. i know where i work right now we have this giant java app that is just a nightmare to even get running. i've been working on the microservices and they do have all the downsides you're talking about but i can get that stack up and flying super fast whereas this giant java app takes 3 minutes to even be barely functional and has so many configuration options that out of this 1000 line config file it's hard to find the 3 things you might actually care about.;0
29584587;HackerNews;2021-12-16;the idea of microservices sometimes reminds me of visual programming looking at infrastructure diagrams. like instead of writing the code and executing it. you implement variables databases conditions lambda loops pubsubsqs etc as separate entities and then put them together.;0
29584157;HackerNews;2021-12-16;you're talking about something very odd here... a monorepo with a monolithic build output but that... transforms into any of a number of different services at runtime based on configuration?is this meant to be isimpleri than straight separate codebase microservices?;0
29583989;HackerNews;2021-12-16;i think this leads to silos. microservices written in different lang's mean java dev x can't maintain python service y.. not in an efficient way. what's worse java dev can't move to team y without upskilling not only on the service but also the lang so they get pidgin holed. she also can't move because she's the only java dev left.;0
29583929;HackerNews;2021-12-16;here's my take on microservices it's a form of modularization. like all modularization it can be useful to uncouple larger parts of a system to enforce an architecture avoid unintended crossdependencies make explicit the dependencies that are intended to allow teams to work more independently and to allow the different parts of the system to be be developed compiled built deployed and sometimes scaled independently.but all this comes at a cost you have to know where the module boundaries are because moving these is much harder. the flexibility that you've gained within each module comes at the cost of making it harder to move the border between modules. it's very easy to put down a module border in the right spot and you make a refactor needed for cleanup or performance improvement go from tricky to impossible. e.g. that piece of info needed in this module now canonically lives in the other one. or we accidentally add a couple n's to the time complexity of an algorithm that works on data in multiple modules.but getting the borders right on the first try is hard unlikely even. where those borders should be depends on a lot of things the user domain the performance characteristics the development teams conway's law and all that and the ways in which the business requirements change. for that reason i think most successful modularizations are either done by breaking down an existing monolith providing these insights or by basing it on a known running system that is close enough in its needs and environment.;0
29583902;HackerNews;2021-12-16;i have worked in companies which had monolith software but they have been large and established businesses.i will not name names but i can say this...all but one had constant repetitive and quite painful failures not fixable it seemed. one company was an exemption with some failures but a clear culture of pushing issues while implementing new features.and one company i have been with from startup days till 150 employees had a microservice infrastructure i have never seen so little downtime such a smooth back office front end database reporting system. the cto was owner and main developer if something went awry he would start working on the fix within minutes no matter the day or time. the fastest issue response time ever. 2 lifetime downtimes of a handful minutes for the full service and a couple components which didn't work for maybe an hour or sometimes overnight. i have to say though when one microservice broke it took down more tangential services than one would think but other than that hands down the best software i ever worked with.;0
29583826;HackerNews;2021-12-16;microservices doesn't necessarily mean k8s running on selfmanaged compute instances as in the example given in the article.the main mistake of the article is that the premise is microservices but then the examples are about infrastructure k8s etc but the 2 things are not tied you can have that same architecture cited in the article running monolith instances for example and it would be every bit as complex as managing the micorservices example without any of the advantages.fully managed serverless solutions like lambdacloudflare workersetc managed through sam or serverless framework solves most of the problems cited in the article.the whole infra in our case is api gateway lambda dynamodb this infra is not more complex to manage than our old monolith which was on alb ec2 rds.deployment is one sam deploy away done in github actions this is actually even simpler than our previous monolith.;0
29583628;HackerNews;2021-12-16;how many more articles do we need to drive this point home? first it was a fashion to develop using microservices. now writing about not using them is in vogue .;0
29583430;HackerNews;2021-12-16;another point of confusion among many folks is monorepos. some consider monorepos monoliths which is more like comparing apples to oranges imo.monorepos provide some of the benefits of monoliths in terms of 1 making it easier to refactor your entire codebase at once 2 sharing some common dependencies like framework versions etc. which makes it much easier to keep those up to date and more secure as a result 3 sharing some common utilities like unit testing harnesses etc. 4 other thingsat the same time monorepos don't force one into a monolith architecture at all an in fact can provide most of the same benefits of microservices in terms of separate deployments etc.the most important lesson in my mind is there's no panacea or perfect structure as a prescribed way to do things. every system has its own demands which also change over time and the only should is to tailor things on a casebycase basis adjusting to a better structure when needed.;0
29583156;HackerNews;2021-12-16;modular design is decades old though. rails devs argue about it because it's against the rails way and that makes things harder for them. but i've been modularizing my java webapps since i graduated from college 18 years ago.but also microservices weren't pioneered by rails devs. they were pioneered by huge companies and they definitely have a role to play there as you point out.;0
29582529;HackerNews;2021-12-16;not it's adding a single microservice to a monolith.;0
29582493;HackerNews;2021-12-16;ok maybe a better way to say it is that having teams independently develop services is a good way to reduce the coordination tax iif you have high coordination costs.i if your environment doesn't have that problem i guess this doesn't apply.coordination between engineers was a frequent activity everywhere i've been regardless of how well built the systems were. for example a new requirement for the customers signing up in a given country to have features x y and z enabled. in a large organization there are probably a few teams that will be involved that make that happen. the question is how to coordinate them.many companies try to solve it with topdown decision making prioritizing certainty but hampering productivity some teams have to wait and strictly limiting risky innovation nothing can be done without approval.independent teams each developing independent services and acting without topdown approval is a different way to coordinate development that values productivity keeping everyone unblocked and innovation finding better ways of doing things. you have to invest a bit in tooling and recommended patterns to keep things from going crazy but you kind of need to do that either way.aha here's a difference. if we're talking about the same things icommoni tools and patterns don't need to be enforced. independent teams can pursue very different patterns without needing to agree with each other. this is a big advantage if you don't like being told what to do by people who are pretty remote to the problem you're solving. different people react differently to that. netflix teams tended to be staffed with very experienced and skilled people no junior or mid level positions so there wasn't much value in one engineer dictating architecture patterns or tooling to another. nearly all tooling was optin and the good tools were the de facto standards. but if you came up with a better tool or pattern you had the freedom to try it out. this is how independence fostered innovation and why microservices were useful in such an environment.;0
29582367;HackerNews;2021-12-16;you would only deploy 10 microservices if all 10 changed at once. why are all 10 changing at once? especially if you find yourself in the model where your microservices share codegood architecture decisions trump the monolith vs microservices argument. i'm not saying crossservice shared code is inherently bad but it does have a bad smell.;0
29582292;HackerNews;2021-12-16;maybe because breaking up a monolith has proved to be as hard as combining microservices once you get past the obvious and trivial steps.;0
29582286;HackerNews;2021-12-16;if youre going with a microservice a kubernetes cluster a load balancer multiple compute instances for running the app and hosting the k8s clustertry running a hightraffic highfunctionality website without something equivalent to this. what's this magical single computer you'll be running it all on? you'll need a cluster of servers on a rack somewhere managed the old fashioned way. you'll need equivalent tools to deploy to them and monitor them.i think what this article should be getting at is that lowtraffic sites shouldn't start with microservices and maybe that's true. but if you're trying to build a business that scales rapidly you want to be ready to scale your website from day one.;0
29582256;HackerNews;2021-12-16;there is a lot of talk about monoliths vs microservices lately.actually it's been going on for years and it's always the same argument. people think they're thought leaders for saying start with monoliths and only move to microservices if you absolutely need to!it's a pretty obvious conclusion to anyone who has worked in both environments or have had to migrate from one to the other so it's not particularly insightful. and yet here were are 5 years later saying the same thing over and over again.;0
29581948;HackerNews;2021-12-16;this article sounds like someone who's never successfully implemented either solution. things that are wrong so farmonolithic apps need monitoring e.g. prometheus just as much as microservices.monolithic apps can have scaling issues if you only have one database instance especially if you're writeheavy so you may need to shard anyway.monolithic apps will probably want a messaging system or queue to handle asynchronous tasks e.g. sending email exporting data.microservices do not require kubernetes. you can run them fine on other systems at my last job we just ran uwsgi processes on bare metal.microservices do not require a realtime messaging system. you can just use api calls over http or grpc or whatever else. you'll probably want some kind of message queue as above but not as an integral part of your architecture meaning it can just be redis instead of kafka.microservices do not require separate db instances. if your microservices are all using separate schemas which they should you can migrate a service's schema to a new db primaryreplica set whenever you want. in fact if you have one e.g. mysql primary you can have multiple secondaries each only replicating one schema to handle read load from individual services e.g. a primary write node and then separate read nodes for user data product information and everything else. when it's time to break out the user data into a separate database just make the read replica the new primary for that db and add a new read replica off that.this dude just straight up doesn't know what he's talking about and it sounds like his experience with microservices is following a bad 'microservices with golang kafka cassandra prometheus and grafana on k8s' tutorial.here's how you write baby's first microservices architecture in whatever language you use1. decide where the boundaries are in your given application e.g. user data product data frontend rendering payment systems2. write those services separately with httpgrpcwhatever apis as your interface.3. for each api also write a lightweight native interface library e.g. userinterface productinterface paymentinterface. your services use this to call each other and the method by which they communicate is an implementation detail left up to the interface library itself.4. each service gets its own database schema e.g. user product payment which all live on the same mysql or rds or whatever instance and read replica.5. everything has either its own port or its own hostname so that your nginx instances can route requests correctly.there now you have a working system which behaves like a monolith working via what seems like internal apis but is actually a microservice architecture whose individual components can be scaled refactored or rewritten without any changes to the rest of the system. when you swap out your django protobufoverhttp payment processing backend for a rust process taking grpc calls over redis queues you change your interface file accordingly and literally no one else has to know.it also means that your deployment times are faster your unit testing is faster your cicd is faster and your application startup time is faster when you do have to do a service restart.i'm not sure why this is so hard for people to understand.;0
29581868;HackerNews;2021-12-16;its really nice to be able to add a column and deploy in minutes without having to rebuild and deploy a giant monoliththis is orthogonal to monolith vs microservices. i've worked on monoliths that could easily be and were deployed very frequently.;0
29581844;HackerNews;2021-12-16;refactor to separate microservices when either 1 the team is growing and needs to split into multiple teamsi've heard this before and i just don't get it. i've worked on multiple monoliths where hundreds of engineers contribute and it's fine. you have to invest a bit in tooling and recommended patterns to keep things from going crazy but you kind of need to do that either way. at 3550 people a common limiting factor is coordination between engineersso don't coordinate? if engineers working on different aspects of the codebase need to coordinate that feels like something is wrong architecturally.;0
29581680;HackerNews;2021-12-16;you bring up an excellent point. as of now it is impossible for me to run my company's backend ecosystem on my machine locally. what we do could easily be done by one simple monolith but our eng. lead is obsessed with overengineered microservice architecture so nobody can actually develop locally. everything on the backend is done by a bunch of lambdas behind an api gateway.i got so burnt out developing in that environment that i asked to become a pure frontend dev so that i wouldn't have to deal with it anymore.;0
29581373;HackerNews;2021-12-16;this is exactly how i feel. great to hear it from someone with netflix experience. so so many organizations jump headfirst into microservices before they even realize what that entails just because they heard it's the trendy new thing netflix is doing.if you make your code and architecture simple from the getgo then you can refactor to microservices when you know you really need it.;0
29581189;HackerNews;2021-12-16;i explicitly claim to use a citadel archicture 0 when talking about breaking off services for very similar reasons. having a single microservice split out from a monolith is a totally valid application of microservices but i've had better results in conversation when i market it properly.i've found this to go so far as to have monolith understood to mean single instance of a system with state held in memory.0;0
29581131;HackerNews;2021-12-16;to be fair modular monoliths weren't talked about much before microservices. i'm thinking about the heyday of rails where there were bitter debates over whether you should even move critical business logic out of rails. i got the impression that most devs didn't even care. that was sort of the point where i saw that i was a bit of an odd duck as far as developers go if i cared about this stuff and pivoted my career. i really enjoy contexts where i can make modular monoliths however. i'm thinking of mobiledesktop apps here mostly.software design is something of a lost art currently. this is partially due to the current zeitgeist believing that anything that automated tools cannot createenforce can't be that important in the first place. of course there's a whole swath of concerns that cannot be addressed with static or dynamic analysis or even different languages.microservices is a response to the fact that a monolith without any real design moves quickly but can easily converge on spaghetti due to the fact that everything is within reach. it enables teams to create an island of code that talks to other islands only via narrowly defined channels. additionally they support larger dev teams naturally due to their isolationist take and reinforce the belief that more developers always better in the process. in other words they mesh perfectly with the business context that a lot of software is being built in.factor in the fact that coolcompany uses them and you have a winner.;0
29581104;HackerNews;2021-12-16;it's usually not obvious where to put the seams ahead of time so you can cut them when you need to split into microservices.plus keeping the api boundaries clean costs time and resources and it's tempting to violate them just to launch this one feature. this extra discipline doesn't have any payoff in the short term and it has unknown payoff in the long term because you're not sure you drew the boundaries ahead of time anyway.so i think in practice what happens is you create a monolith and just eat the cost of untangling it when the team gets too big or whatever.;0
29581003;HackerNews;2021-12-16;but i've worked on teams that advocated for microservices needlessly and it was 100 cargo cult behavior netflix does it so we should too.i've seen this too and in fact i got laid off because i pushed back against this silliness for what should have been a simple lift and shift.;0
