ID;Source;Creation Date;Content;Sentiment
23021484;HackerNews;2020-04-29;if the question are there any case studies where microservices went well is a valid question then so must be are there any case studies where monolithic architecture went well.my point being that if and only if we have a track record as an entire field of making decisions based on case studies and if case studies have a track record of being objective rather than proffered as a result of a marketing agenda then the question is ultimately legitimate.there are more shops by total count that fail with monolithic architecture. that's inevitable just based on the infinitesimal number of projects executed as service architectures rather than monoliths at large in the wild. but still we carry on with monolithic architectural style as if its outcomes were assured.it's far easier for the vast majority of developers to build a monolith because it allows development to proceed without having to have any knowledge of or practice with the tricks and traps of distributed systems an entire body of knowledge that a developer might never get meaningful and practical exposure to for an entire career.the trouble starts when microservices are attempted by developers who can't imagine that there are entire bodies of software development knowledge that developers aren't presently in possession of.microservices is just as adrian cockroft used to say serviceoriented architecture with bounded contexts.web development is absolutely not a preparatory course in service oriented architecture. but the vast majority of web developers who attempt to take on soa while simultaneously presuming an omniscience in all things software development due to their experiences only with monolithic web development will often fail to build a soa. they usually end up with something that isn't quite soa and isn't quite a monolith. and that's where the failures largely come from.i work exclusively in microservices and soa and have since 2015. before that i worked principally as a web app developer and did some work offandon in soa implementations. and before that i spent years becoming oriented to the architecture. i don't make the mistakes that web developers typically do when they presume that web development knowledge is a sufficient prerequisite for working in soa.so it's not a question of whether an architectural style works or doesn't. the majority of failures in microservices can be attributed to ignorance and to the narcissism that is permissive of it.so i would ask this question instead are there any cases where developer overconfidence and oversimplification went well?these qualities don't tend to serve any architectural style well.i've never heard of a welldesigned soa not going well. every single case of microservice project remediation that i've participated in had as the most significant contributing factor an utter disregard for the body of knowledge that the microservices architectural style is built upon.there are a lot of things that developers can get away with when doing the kinds of tinkering and wandering that typifies typical web development work. but those things don't work once we cross the line into soa. and unfortunately the incessant chasing after trivial resumé candy hasn't prepared the average developer for the rigorous mindset needed for soa work.as microservices became to next fad for perennial fad chasers of the software development world they finally encountered a kind of work that they could not get away with by faking it. and so we see a lot of failures. but the vast majority of the failures are personal failures and character failures rather than failures of an architectural style.the fat part of the developer bell curve was simply overreaching when it presumed to try to get away with building service architectures with the same level of disinterest in architecture and process that we can get away with in typical web development. like a kid with copious experience building kites presuming to strap themselves to a hang glider and just going for it. the outcomes are mostly predictable.in the end if a little time is invested in learning the fundamentals that have so far been eschewed for the sake of expediency anyone can succeed with soa and microservices. it's not that the realities of the architectural style are unlearnable but it can't be arrived at by the level of tinkering and wandering that we can just get away with in monolithic web development.;0
23021260;HackerNews;2020-04-29;oh all of those were heavily modularized to begin with. but that wasn't enough to keep them manageable. so at the end what we did is figure out which are the core components between the different modules isolate what they did and put them aside in a smaller microservices which were easier to track maintain and monitor. what was once the monolith is now arguably just an interfaceapi for all the heavy lifting which is done by microservices. again my point is that all this must be done depending on the scale and complexity of your application. if you are going to make an authentication microservice for an application that has 50000 users which simply fetches a username and compares a hash in a database obviously you are doing it wrong. i am talking about applications which in the simplest of times operated on 24 different databases located in completely different geographical locationsthe case of my first such monolith. some of those databases used different engines. and due to the nature of the infrastructure and the requirements we couldn't simply ditch everything and start over from scratch. so splitting everything into microservices was the only option. and this is something i was working on back in 2012 iirc so back when microservices were considered witchcraft by most people. and yes i'm talking about several million lines of code and 2 developers my inexperienced out of uni ass and an utterly conservative dev twice my age. took us around 6 months but the project was extremely successful.there is this trend in technology every few years everyone changes their minds about everything 2012 sql is the best. 2016 sql sucks nosql is the future 2020 nosql suck sql is the best. 2024 fill in the blank.the same thing is happening with microservices. but in addition docker kubernetes and recently unikernels have joined the party. the concept is the same though.what i am trying to say is that either of those can be good or bad in different scenarios. it's a question of picking the most appropriate one for the situation.;0
23021255;HackerNews;2020-04-29;i don't agree with your premise that development structure deployment structure. there are plenty of good ways of splitting up development of a monolith without the huge devops headache of deploying microservices.;0
23021184;HackerNews;2020-04-29;i cannot agree more i worked at a company where we went from a monolith deployed on iaas with a couple handful of engineers to docker containers deployed on ecs with over 200 engineers. the main reason we did it was because dockerecs was cheaper than a bunch of ec2 instances and you can't effectively use 200 engineers with a single monolith.after 2 years we had over 450 microservices while keeping our aws bill flat or slightly decreasing.;0
23021139;HackerNews;2020-04-29;that's generally true and it's a big problem with microservices because they need so much upkeep.but if your code is living as a few hundred or thousand readable lines in the common codebase that isn't really a problem. the code is there readable and working and if anyone needs to change it they can. if it falls out of fashion it can be deleted.;0
23021132;HackerNews;2020-04-29;why do you assume they have more fault tolerance scenarios simply because they have more deployable units?in every service architecture i've worked with in the last few years you could theoretically run every single service within the same physical process provided they all shared the same runtimelang the way a monolith does. i tend to start service architectures using ruby exclusively with the eventide toolkit so this is actually a viable approach for most teams i've worked with. but it's never ultimately made sense. weighing the proscons a consolidated deployment topology wouldn't add any benefit and it would actually make it far more difficult for the operations folks practically speaking.i've helped put services into production that 1. carry out crucial core business logic reliably and efficiently 2. can be scaled horizontally without changing the code 3. never raise exceptions or cause outages and 4. don't need to be touched for years because new features are more naturally composed around them anyways i.e. openclosed principle. practically speaking it's quite a bit easier for human programmers to reach this degree of precision with a smaller program than with a much larger one. and if you add up a lot of these high quality programs you get a high quality system. building a high quality system out of a single program is much much harder for humans in practice.i'll use crude terms here for a second every igoodi service put into production brings a net benefit to the organization relative to the same code having been entangled with an existing pile of code. that may sound like a no true scotsman fallacy but the idefinitioni of good in this context is precisely the net benefit being added. if you build and deploy services that have a high degree of quality you get a corresponding benefit. if you build and deploy programs that don't stand on their own don't leverage durable messaging and take other programs down with them when they crash then you get a rather large mess on your hands. in fact you never had a service architecture at all we call this failure mode a distributed monolith.i'll acknowledge that most attempts at microservice architectures in the wild don't seem to succeed. anecdotally they are particularly prone to failure when their architects don't understand the underlying principles of distributed systems all that well they neglect important considerations like messaging idempotence the deleterious effect of synchronous requestresponse messaging and the need for deliberate thoughtful design. in other words they build systems out of n number of microservices and get n2 fault tolerance scenarios which you adeptly called out for being foolish. they're arguably worse off than if they went with a monolith but neither would be an architecture i'd personally want to work with.;0
23021077;HackerNews;2020-04-29;in all honesty i think the monolithmicroservice distinction misses the point a little bit.it's inevitable that the longer the codebase exists the more difficult it is to maintain. it's a battle that you can't necessarily win and it's turtles all the way down as your dependencies and their dependencies tackle the same issues.all it takes is one or two roughly defined apis and you've already created the nucleation point for evermore tech debt and while you'll be able to tame some of it you won't manage all of it due to business requirements or other teams depending on private apis to save time or whatever else you can imagine. switch the architecture and you'll either have all your problems bunched in one codebase or you'll have distributed your problems all over the place.i'd go as far as saying that a perfect monolith and a perfect distributed architecture are theoretical ideals that require perfect communication to build them.;0
23021064;HackerNews;2020-04-29;yep each single microservice is simple ... but the whole is not.i always find it more interesting what's not in the single microservices the stuff you do see. when you make a diagram with boxes and arrows the interesting stuff would be the arrows not the boxes themselves.;0
23021051;HackerNews;2020-04-29;this is a discussion on pretty much every team i've been on for the last 5 or so years. i agree mostly this stuff is done for the wrong reasons.imho it doesn't matter if you replace microservices by components corba objects rpc objects soap services etc. it all boils down to chopping your software into smaller bits that than immediately start having a need for sending messages between them finding each other defending their boundaries etc.so the first mistake would be assuming this is a new problem to think about. it's not. you can find similar debates about how to chop up software ever since people moved beyond just having their code ship in punch card form.the right discussion to have would be first deciding whether you want to break down by your logical architecture so that your deployment architecture reflects that or your organization diagram aka. conway's law. then the next step is deciding whether your primary goal is network isolation of unrelated chunks of code or enabling asynchronous development of these chunks of code if so there are other solutions. usually it boils down to again conway's law different teams just don't want their stuff to depend on shit happening in another team because of internal bureaucracy and hassle.now say you have a valid business reason or technical reason for actually wanting to have different stuff be isolated e.g. for scaling reasons or security reasons. the next step is deciding whether this means you also want to break up your code base. monorepos and microservices are a thing. look at e.g. lerna for node.js or multi module gradle projects on the jvm. in go this is well supported as well. if you're really sure that you don't want micro services because of conway's law there are lots of valid reasons for having a well structured mono repo with a bit of reuse of shared functionality a simplified review process and more visibility in what is happening.imho people do this for completely the wrong reasons like wanting to try out some new language organizational issues etc. that ultimately result in fragmented code bases lots of devops overhead and complexity it's never simple or cheap lots of project management overhead etc. you pay a price.;0
23020944;HackerNews;2020-04-29;there's no need for half of the word to exist.yes there is. a service is a very generic concept to the point it's only relevant as a highlevel concept.the concept of a microservice makes all the sense in the world if you look back to where we came from web services. when compared with all the work and requirements and complications of using soap and wsdl and uddi and everything around just sending small json payloads around and the ability to peel off smaller services leveraging that architecture approach was a far lighter and uncomplicated way of doing business.i mean the name microservices becomes obvious once you look back and all that you see is macroservices.;0
23020886;HackerNews;2020-04-29;i'm reminded of the classic problem of static utility classes where you have functions for say formatting phone numbers or computing a commonly occurring simple mathematical function. it can be difficult to figure out how to better modularize the functionality provided by this class the motivation typically being having a large static utility class often violates the principle of a class having a clear single responsibility. breaking up a large static class into other static classes that better encapsulate some functionalityconcept can help but isn't always the best solution.so lets say we have shared code for doing something like phone formatting. my question for more experienced microservice practitioners is does it make sense to create a microservice for preprocessing data in general? phone numberformatingasaservice is excessive but creating a microservice for processing data where phone number formatting is just one aspect of this service makes sense to me. all other services can throw data at the data processing service and get data back in some sort of standard and expected way conforming to whatever business logicprocessing rules required.;0
23020869;HackerNews;2020-04-29;one view is that the difference between a service and a microservice is that a microservice can be sketched between being a local library or wrapped in an rpc server.;0
23020829;HackerNews;2020-04-29;my takeaway from these kinds of stories is that microservices make sense if it's no longer possible to operate a monolith. by existence proof that was clearly never the case at segment. the common fallacy seems to be that microservices lead to better software via better architecture regardless of human factors like team size. my sense is that it's the opposite microservices are a necessary evil to scale teams past a certain size due to the bottlenecks that emerge with monoliths as more people begin trying to make changes simultaneously and should be viewed as neutral at best in terms of a software architecture pattern to increase reliability performance etc. in practice it seems wise to keep your engineering team as small as possible for many reasons one large one of which is that past a certain point you will be forced to move to microservices. all other things being equal that's a move you don't want to ever have to make.if you have hundreds of engineers then certainly microservice architecture starts to make sense since even the idea of transactional deploys of the monolith break down due to queuing at that scale. but jeeze don't pull that trigger until you actually find yourself backing up on necessary complexity like deploy queues prs stuck due to inability to maintain the branch given the velocity of master etc. don't let conways law lead you prematurely to microservices. if i'm ever in a position where i am feeling real pain that leads to an urgency for microservices i am probably going to first ask the question if i can just fire some people to make the problem go away. the risk of the transition to microservices is just that high.it's the same rule of thumb with other things like hiring feature roadmaps etc yagni. if you are hiring someone before the pain is so high the work cannot be done otherwise building features before you have people explicitly showing the need for them or making deep cross cutting architectural changes that impact everyone before they are strictly necessary due to concrete problems with shipping software you're probably choosing the wrong use of opportunity cost capital etc.;0
23020805;HackerNews;2020-04-29;why can't you have both independently deployed microservices and a shared code base?this is what everyone does so i can't even comprehend what segment was doing. maybe they were deploying a fleet of microservices inside a monolithic deployment? if so there's no wonder it failed.;0
23020723;HackerNews;2020-04-29;a team iperi microservice? that sounds really wasteful. how many microservices need constant evolution?;0
23020650;HackerNews;2020-04-29;split along domain lines with minimum interservice dependencies.exactly and done right that quite often means big 'microservices'.all too often i see the 'functional programming disease' where the aim is to deconstruct to the smallest possible reusable functions 'micro' services right? often prematurely creating high levels of compositional complexity and with zero tools to help you understand how the actual 'app' say payment system works if it's distributed across 20 services.yep each single microservice is simple but the payment system might not be and that's what you need to understand better if your payment system is one thing with maybe one or two things separated out if you need to scale that part.;0
23020641;HackerNews;2020-04-29;i wish more engineering teams would consider spending half the effort of microservices on simply disciplining their monoliths100. this is an uphill battle though. i've encountered so many engineers who equate real engineering with building giant machines. you just can't convince them otherwise.i've watched people build giant realtime stream processing pipelines compromising tons of moving pieces lambda sqs s3 sns stepfunctions etc.. to build... a reporting table and all for... 1.3gb of data. literally.ultimately despite the sell i don't think microservices as a forcing function for good practices works in practice. if the team lacks the skills to build a disciplined monolith then they 100 lack the skills to build a distributed one.;0
23020420;HackerNews;2020-04-29;i bombed an interview before because i said microservices can be really bad.;0
23020337;HackerNews;2020-04-29;i see quite a few people defending microservices the org is the problem they must not have written the software correctly etc. most org structures are not great. most software is not great. if you expect the exception to be the rule you're setting yourself up for a career full of disappointment.microservices are a modern rebranding of serviceoriented architecture but 'microservices' sounds cuter and less like it belongs in javaland and there's some theoretical idea that splitting your app into even smaller pieces will somehow make the whole thing better.soamicroservices solves a few problems and introduces a great many. the original soa proponents were pretty explicit about this. beware! there be dragons here! but one of the main pieces of prescriptive advice from domain driven design is helpful for splitting into distributed services split along domain lines with minimum interservice dependencies. payments is an obvious one. microservices seems to buck much of this advice in favor for a blissfully ignorant principle of small or isolated. good luck isolating something that is not meant to be isolated.scaling software is hard. scaling teams is harder. trying to scale teams by scalingdistributing software is an understandable goal but extremely hard to pull off because of additional complexities and costs you incur in doing so. dev gets harder deploymentops becomes harder testing becomes harder. crossteam communication documentation api publishing and adherence goes from being very low impact within an org to suddenly being critically important.to do soamicroservices effectively you need complete organizational buyin and you have to commit completely to developing tooling and solving all the associated problems in moving to a services approach. often it's easier to just put it all back together organize the code in such a way to minimize merge conflicts and wait for the ungodly slow test suite to run in ci. there are good reasons you rarely hear soamicroservices success stories outside of enormous companies netflix facebook google amazing etc. doing this stuff takes an enormous investment and commitment from the entire organization and there are just lower friction ways to skin this cat if you don't operate at mega web scale.growing a monolith is hard. growing a microservicessoa architecture is also very hard. growing is hard.;0
23020306;HackerNews;2020-04-29;i think that microservice approach is good when you can share those services between many applications in most cases microservices can be the new premature optimization because you can start to lose the focus on the product itself and think about the the microservice as a product;0
23020295;HackerNews;2020-04-29;as with a lot of things it comes down to communication. between teams and between the services they write. which is just another expression of conway's law.this is so accurate. i've heard engineers give state not needing to communicate chillingly as a positive for microservices like we won't need to talk to each other if all of us are working on different services. my other favorite is using microservices as an excuse for why the product isn't working oh imyi service is working fine but ihisi service is doing this when it shouldn't when we're on a small engineering team.;0
23020228;HackerNews;2020-04-29;let me clarify because i wasn't clear in the parent comment.microservices using shared libraries okmicroservices suffering from shared libraries not ok.;0
23020205;HackerNews;2020-04-29;sorry for not being clear.having a shared library is not a bad thing on its own. making the library a bottleneck is the antipattern.if you wish to have a sharedlibrary of microservices you should be prepared to have multiple versions of it running at the same time without any pressure to update everything at once.if your shared library is the bottleneck it means that your microservices are tighly coupled hence the distributed monolith;0
23020199;HackerNews;2020-04-29;thats not quite right soa as originally defined had no mapping to team structure or deployment runtime it was mostly about defining discrete service interfaces and ensuring your clients used that contract rather than back channels to communicate. most often you had a dozen services running in a single app server cluster. conways law was rarely discussed with some exceptions.microservices tended towards a single runtime per service ensuring the deployment lifecycle was tied to the build lifecycle and thus allowing for independent evolution.;0
23020195;HackerNews;2020-04-29;one of the lines is going to be acceptable performance. your phone number formatting microservice is going to be orders of magnitude slower than a client library.the auth service will likely have to hit a db anyways. assuming the microservice call has roughly the same network latency as the db call and the db has 0 response time it would double the total time to perform the auth. it only gets more favorable as db response times go up.more generally i think microservices make sense in scenarios where the time to process the request is longer than the network latency incurred by making it a microservice. things that have to hit a db are generally okay. pure functional things that just compute on cpu and ram are generally not unless they're very computationally expensive like running a simulation or something like that.;0
