ID;Source;Creation Date;Content;Sentiment
23017509;HackerNews;2020-04-29;if your code is bad in a monolith itll be bad with microservices. if you cant build a good monolith you cant build a good microservices architecture because it introduces even more complexity and requires even more consideration.discipline is fundamental to good software engineering you cant force it with microservices.;0
23017501;HackerNews;2020-04-29;as with a lot of things it comes down to communication. between teams and between the services they write. which is just another expression of conway's law.iirc fred brooks pointed out that the of bugs in a system correlates closely with the of lines of communication within and between the teams. joshua bloch recommends in effective java that if possible 3 potential clients should participate in the design of an api for the same reason. so a welldesigned interface or openapi spec is worth its weight in gold.ofc microservices here means separate running instances available on a network. but monoliths can be serviceoriented as well. osgi was good for this in java but any system able to load shared objects or plugins dynamically can follow the same pattern. and the benefit is that if your app hits the jackpot and needs to scale outwards the service interfaces ie the lines of communication are already welldefined.so serviceoriented monolith first then microservices if needed.;0
23017449;HackerNews;2020-04-29;which includes your api middle ware and then databaselayered microservices are an antipattern. in most cases functionality is best divided by domain.;0
23017440;HackerNews;2020-04-29;if all the services that the microservice needs are also services behind an api what's the overhead? something likeihiredeveloper 10 10x.addtopayroll.officeopenplan wfh.enforcehrpoliciesiis all you needthe best thing about this is that you can keep everything in change control and just rollback whenever you need to or spin up new companies at will.;0
23017427;HackerNews;2020-04-29;but does conways law require microservices? it doesnt say anything about microservices.;0
23017425;HackerNews;2020-04-29;i'm just curious if there is a middle ground somewhere?on one end you have a giant monolith. all services rolled into one which includes your api middle ware and then database.one the other end you have microservices which bundle services into individual distinct units with each service being responsible for its api middleware and database.are there any preexisting patterns which seek to combine these two and come up with an architecture which is midway between those two. a few months ago i had read an article about data oriented architecture on hn which comes close though i'm wondering if there are others.;0
23017420;HackerNews;2020-04-29;well.. just consider every microservice a separate company exposing its own productservice. also think about all the overhead that comes with it product managers finance recruitment etc.;0
23017396;HackerNews;2020-04-29;absolutely you probably can't succeed with microservices without selforganizing teams. you just get more hot potatoes to drop;0
23017388;HackerNews;2020-04-29;i think that the problem here was that they were fighting against conway's law any organization that designs a system defined broadly will produce a design whose structure is a copy of the organization's communication structure.i think microservices work well in organizations that are big enough to have a team per microservice. however if you've just split your monolith up and have the same team managing lots of microservices you've made a lot more work for the team without the organisational decoupling which are the real win of microservices.in my experience it is really difficult to fight conway's law you have to work with it and arrange your business accordingly.;0
23017371;HackerNews;2020-04-29;i always felt like the biggest benefit of microservices for the average company that just jumped on the band wagon was simply the fact it forced them to break things up. yes they could achieve the same result with none of the overhead on a monolith but it would take... discipline. it's much easier to just enforce a hard external constraint.realizing this and circling back is still a useful life lesson.;0
23017370;HackerNews;2020-04-29;why do you thinkfeel that there are too many? what's the threshold for an acceptable number of microservices? not asking this to be confrontational. just curious because it's a sentiment i've seen before without the reasoning behind it being articulated.;0
23017340;HackerNews;2020-04-29;exactly i would wager that very few organizations go from monolith to microservices and back. getting organization buyin to do the big rewrite is hard. getting buyin to do the second big rewrite after the first one didn't go well is going to be even harder.;0
23017334;HackerNews;2020-04-29;could it be valid to say that even if microservices are implemented correctly you're swimming if not drowning in complexity? but for some problems and teams that's better than the alternative.;0
23017327;HackerNews;2020-04-29;it seems like they introduce microservices for the wrong reason. instead of having a service per team the focussed on services to solve a technical problemhaving a code repository for each service was manageable for a handful of destination workersmicroservices should be introduced to make teams go faster not to decouple external api endpoints....;0
23017319;HackerNews;2020-04-29;i have this thing about microservicescomplexity in that it follows conway's law the architecture follows the organisational structure.if you push authority and decision making and responsibility for a iservicei to a 2 pizza team then guess what microservices work really well.if you have vast monolithic centralised production operations teams and no way in hell is their cexec going to assign two of them to look after the userlogin service you might not do so well.like most things the organisation needs to change to get the best out of the opportunities software offers. those that don't will face increasing friction and eventually die off.;0
23017318;HackerNews;2020-04-29;still waiting for monzo's following blogpost on cutting down their outrageous number of 1500 microservices 0 and moving some back into monoliths. i'm not sure if i would be too excited over the number of microservices if there is a degree of complexity involved here. that is just too many here.0;0
23017276;HackerNews;2020-04-29;my experience of moving to a microservice architecture the most important consideration with microservices is who will develop maintain and operate them?. you can split them down functional lines architectural lines whatever you like but if you don't have teams with definite ownership of each microservice and that aren't swamped by maintaining lots of them like it seems happened with segment it will become impossible. the operational complexity tax is a real thing but is manageable if your engineerservice ratio is sensible and considered.;0
23017272;HackerNews;2020-04-29;just waiting for o'reilly to drop a book called microservices to monolith;0
23017260;HackerNews;2020-04-29;i want to see the microservice architecture where you don't drown in complexity.;0
23017246;HackerNews;2020-04-29;tldr if microservices are implemented incorrectly ... you're drowning in the complexity.;0
23017239;HackerNews;2020-04-29;how many places have gone from monolith to microservices and back to monolith? i'm sure there's been quite a few.;0
