ID;Source;Creation Date;Content;Sentiment
23757276;HackerNews;2020-07-07;and they often are! because that's mainly one of the advantages... you can simply outsource a spec of the endpoints and that's it flop over a ourservice.swagger.yml and get a working system back. possibly in a languageframework you team has no experience with but it was cheap.recent fun a bunch of microservices written by the same contractor were killing the shared db the 'state' of all microservices so while most were running fine some were hitting the db hard and costing the company quite a lot of money until it was fixed. noone felt it was their responsibility to test amp fix because it was an external company and they 'delivered' according to spec. there are many ways to do this better but it happens quite a lot also with monoliths ofcourse but there i find it fastereasier to diagnose fix depending on the size i guess there is a point somewhere in loc where microservices start to shine.;0
23757248;HackerNews;2020-07-07;in both 1 amp 2 i only see money pits... this sounds like so much overhead... par for the course for enterprises but i see too many startups now deploying 50 microservices and suffering with the overhead hosting maintenance employeecountchurntraining monitoring etc.;0
23757158;HackerNews;2020-07-07;regardless of whether youre dealing with monolithic or distributed systemagreeing somewhat but not totally monoliths are much easier to test and stabilise. all bigger microservices projects i know personally not what i read from uber etc have tremendous overheads compared to their monolithic counterparts. some of them are really nicely done but there still is a lot of overhead in support usually the services are written by different people and possible different languagesenvironments for instance .net core .net framework for windows specific services typescriptnode so other people need quite a large ramp up to get into them networking monitoring etc. as far as i have seen it needs a larger team.and it is very different from having you modular built monolith in your ide for a spin than doing a little localdev testrun of 25 microservices the one you are working on. i can feel the benefits but i have yet to encounter them in real life so far i have seen smaller 100myear rev companies going back to monolith and most of the stories i read are from very large companies with massive developmentdeployment teams where you actually can have 3 people per microservice.if you are working with 34 people managing 20 changing forming a complex system i don't really seen it happen but would love to see practical examples of that while monoliths of the same complexityfunctionality literally i worked on a few 'just because scaling!' rebuilds from monolithsmsback have no issues at all with that.;0
23757086;HackerNews;2020-07-07;you don't need micro services to do ddd you can do ddd within a django app. i'm not a django man myself but a quick google shows several projects and blogs discussing it.in essence ddd forces you to have conversations about separation of concerns and then being careful to stick to them. microservices force that but you can get the same effect with wellthought out namespaces in a monolith.;0
23757060;HackerNews;2020-07-07;anyone that isn't able to write modular code using the language features is going to write network spaghetti code with the added benefit to debug network packets and connection issues on top of everything else.this is the most important bit. to me microservices is just another way to arrange your system into module not much different in concept to modules and packages. regardless of whether youre dealing with monolithic or distributed system if your abstractions are poor your work and your system will suffer.;0
23756939;HackerNews;2020-07-07;until you come to the deployment phase where all teams need to communicate and deploy in sync. this can be a significant factor for slow down.also microservices don't sync on the datastore these are in theory not shared.so yes microservices can be emulated in monolithic architectures as can monolithic microservices be built. usually you end up with the worst of both worlds. the complexity of microservices with the speed of monoliths.;0
23756915;HackerNews;2020-07-07;so you are in principle of course correct. but keep in mind that microservices can be deployed independently of each other. with monoliths there is a single deployment that causes a lot of synchronization issues. every team needs to deploy in lockstep.this is all theoretical to some degree because i have seen teams deploy microservices in banks during the deployment windows and i have had people explclaim they have one microservice.so you can definitely do it but microservices have other advantages as in how easy can you then scale the components how resource hungry are individual services and so on.;0
23756833;HackerNews;2020-07-07;organisation and communication between teams is improved by having good apis.you can have that with or without microservices. you can screw this up with or without microservices.the main factors for going for microservices are technical but as always must be understood.;0
23756750;HackerNews;2020-07-07;as if the blame game doesn't take place with microservices as well.it is specially funny if the microservices are developed by several contractors.;0
23756743;HackerNews;2020-07-07;my first microservices were written using sun rpc the company whose motto was the network is the computer.since then we have seen plenty of microservices solutions come and go what stays is the complexity of dealing with distributed programming.anyone that isn't able to write modular code using the language features is going to write network spaghetti code with the added benefit to debug network packets and connection issues on top of everything else.;0
23756638;HackerNews;2020-07-07;if communication friction and overhead is the primary thrust for microservices where you obviate said overhead by keeping to small teams how do you address and manage the need for communication ibetweeni teams?obviating communication costs iwithini teams is one thing but what of the overhead and costs of communication for the whole isystemi? eg. how do you avoid the cost of deploying a new team that ends up deploying a duplicate microservice?;0
23756636;HackerNews;2020-07-07;you're making a point that microservices help teams to solve the problem of increasing communication needs for larger teams. while your statement makes a lot of sense i'd like to ask why this problem cannot be solved with packages or classes within a monolith? a team can own a microservice and expose an api to others the same way they could expose an api on a class or package no? microservices are a way of deploying small parts of software. it's not about communication across teams. it can help with communication but this is not only true for microservices.;0
23756611;HackerNews;2020-07-07;good explanation. but i have two questions1 so which team then takes ownership of the entire katamari ball of sprawling microservices and understands the interconnectnedness and nuances of overlaps and competition between each microservice?2 if the concept of technical debt at yesterday's monolithic architectures is biting us now what does the future technical debt of microservices hold?;0
23756602;HackerNews;2020-07-07;i worked for a company that had tried to adopt microservices without a good reason to and failed miserably. over time we were able to rearchitect it into a happy medium of a few large components. it was a huge costly effort... and i've never learned so much.beyond technical concerns i learned that you can architect a looming disaster and then leave for a higher position at a big company. nobody watching your conference talk will know.;0
23756568;HackerNews;2020-07-07;good points and it feels like this is what most people miss. they take microservices from a purely technical perspective and then rant about its complexity. you don't need a large scale distributed systems platform when you're a small team or have no scaling requirements. microservices is largely driven through that organisational need of teams having to ship productsfeatures independently and its just easier when the communication is via a service api vs humans or explicitly when walking over each others code.;0
23756530;HackerNews;2020-07-07;ihide implementation detail and expose functionality through intentionrevealing interfaces.iexcept rest apis what microservices expose almost always don't reveal anything most of the time wanting to hide internal state behind a beautiful and uniform facade essentially representing a twotier model. for example orders and order line items can't be addeddeleted at will but depending on whether the order has been processed or not should expose a cancel action with partial refundwith penalty for cancelling etc. sure you can hide that behind a delete method or reify a cancelled status but why? iservices are resilient to failures.iin the case of rest apis this means manually and labouriously attempting to reconcile state across multiple services in the client.compare this with state changes though ordinary rpc which can expose a meaningful state model give contextual diagnosticsexceptions and can have transaction context flowing with rpc calls.;0
23756510;HackerNews;2020-07-07;microservices are for when you have no other choice. if you truly cannot build a monolith then build microservices. if you have merely chosen to adopt a microservice architecture when a monolith would have been suitable then you have made a huge mistake.;0
23756509;HackerNews;2020-07-07;i'm really having a hard time finding the willpower to read articles that just even mention microservices in the title after working on such architectures with java for a while.nice idea but most of the times horribly implemented with no care about monitoring and logging as someone has already said.it requires a degree of attention to details during design and development that few are willing to put in. it's easy to go for a prepackaged solutionframework thinking that you are building something that could be considered state of the art when instead you end up with something that takes multiple tries to even boot correctly or 10 minutes or so to stabilize a garbled mess of interdependant components.designing these systems require a whole new set of skills that were not required when designing monoliths.;0
23756506;HackerNews;2020-07-07;its inherent in this comment that you really dont understand ddd and why adhering to its precepts is a critical improvement in designing microservices.plenty of books to read videos to watch. learnlisten before you speak.;0
23756470;HackerNews;2020-07-07;my point is everything they talk about is common to any type of enterprise software development. its not new. and then they slap on microservices at the end so they can claim to have written something new.again your rant makes no sense at all. the blog post talks about a specific distributed system architecture style whose services are designed following a specific architecture style.and here you are angry at someone because... because you believe the author has ulterior motivations? if they want to write something new then talk aboutsorry but you have no authority to tell others what they should or should not write.the author of this post contributed something to the public that's interesting and has value. meanwhile what have you done?;0
23756419;HackerNews;2020-07-07;yes we did all that a few years ago and it's still in use. clean code hexagonal architecture ddd event sourcing.main lesson is that you should not use it for everything yes the books say it but it's easy to overdo it in the beginning. don't do ddd for the crud parts of your app. it works extremely well for business use cases but it's very bad at crud. a mix of both really hits the sweep spot though.no microservices though just a monolith. imo most businesses shouldn't need microservices only the ones that really need to scale. we definitely don't have anything even close to that.;0
23756409;HackerNews;2020-07-07;i think that many people look at microservices from a purely technical standpoint. how much compute power do i get per dollar spent. what about the monitoring complexities and the logging problems?microservices are actually often driven by business requirements. according to the myhtical man month communication channels follow nn − 1 2. so a team of 4 developers has 6 possible communication channels a team of 5 already 10. this eincreases sharply as team sizes increase and is one of the reasons big enterprise projects suffer compare to startups.the business benefit of microservices done right is that you build islands of communication that communicate using only one outside channel. now communication increases less sharply as teams are separated by their boundaries.according to the guardian the team size and structure is one of the secret for amazons success. for smaller teams the communication benefit will often not outweigh the additional complexity.;0
23756400;HackerNews;2020-07-07;but with microservices you have more supposed independent interfaces.you don't. you have more services accessed over a network and might not have control over all services. but that's already par for the course in nonoliths.if you were to refactor your components by changing classes around say a major version update in a dependency while not updating the components that used them then you would also have problems.that's why versioning and service discovery and hateoas are a thing.;0
23756392;HackerNews;2020-07-07;i've been through a couple monolith to microservice transitions. i will say this... if you're monolith is slow because of it's design limitations and your plan is to propagate those limitations across n microservices w all the overhead that comes with microservices you're microservices will only be good at scaling the billable hours of the consultants who sold you on the idea in the first place.;0
23756372;HackerNews;2020-07-07;my point is everything they talk about is common to any type of enterprise software development. its not new. and then they slap on microservices at the end so they can claim to have written something new.if they want to write something new then talk about the realities of how microservice development is different than regular enterprise software development. not regurgitating the same old concepts and pretending its eye opening and new.;0
23756351;HackerNews;2020-07-07;wow microservices sound like a very painful tradeoff to make. is it really worth it?;0
23756317;HackerNews;2020-07-07;bleah. i hate articles like this. they regurgitate all the well known talking points about enterprise software development but none of the realities of micro services.i disagree. the post is a good summary of all the key features and main concepts of a microservices architecture developed with domaindriven design. it does what it says on the tin and you don't have to read three books to get there. it sounds like they havent actually worked in the trenches supporting and coding real microservices at scale.i have no idea where you got that idea. it certainly wasn't from the blog post though. the realities are that going from monolith to microservices is a huge investment and only large engineering teams should do this migration.your rant makes no sense at all. you're just mindlessly repeating cliches about issues that have absolutely nothing to do with the subject. i mean the blog post is about microservices software architecture with domaindriven design and clean code but here you are whining about how you believe refactoring projects designed following an entirely different architectural style is hard.;0
23756302;HackerNews;2020-07-07;but with microservices you have more supposed independent interfaces. with a more monolithic approach you might just change a system internally and deploy it. internal interfaces are generally easy to adapt.;0
23756259;HackerNews;2020-07-07;bleah. i hate articles like this. they regurgitate all the well known talking points about enterprise software development but none of the realities of micro services. it sounds like they havent actually worked in the trenches supporting and coding real microservices at scale.the realities are that going from monolith to microservices is a huge investment and only large engineering teams should do this migration.the reason is that once you go microservices you instantly require an immediate investment in devops which is something you didnt need as much before with a monolith. oncall rotations and pager duty schedules become imperative because services will go down. also monitoring is another investment that you immediately need otherwise youre completely blind.the article talks about things that are obvious like designing the apis etc but those are the same regardless of if its a module within a monolith or a microservice. all the characteristics they list at the beginning is no different than what a team that owns a module in a monolith would require as well. it feels like this article isnt very useful because it regurgitates concepts from regular enterprise development and packages as new for microservices when its not.what the article lacks is the difference in architecting for a real microservice environment.one of the biggest missed issues is never mentioning dependencies. sure its great to talk about how to model services with eventual consistency blah blah. but if you already have a large engineering team which you must have otherwise why have microservices then there will be a dependency between services and to believe otherwise is crazy. you will probably have one or two services that when they go down your entire company is down. its imperative that every service is architected with that in mind and what happens when its down. hand waving eventual consistency wont cut it in the real world its the biggest problem that each team needs to focus on early otherwise its a ticking time bomb.;0
23756210;HackerNews;2020-07-07;great then a new us comes in that changes the intention and you enjoy the pleasure of changing the interface.that's not a microservices problem not even a software architecture problem. that's at best a project management problem. in fact pretty much every single engineering project there ever was would struggle to meet any form of neckbreaking change in design requirements.;0
