ID;Source;Creation Date;Content;Sentiment
23020159;HackerNews;2020-04-29;i'm struggling to understand the problem with shared code and the desire to fragment the code repo!why can't you have both independently deployed microservices and a shared code base?if the deployment lifecycle is different for each microservices and each ideploymenti is selfcontained then they can be deployed with different versions of the code even if they use the same source tree and share code.obviously the shared code needs to be properly maintained and evolved but it seems to me a lot of the software engineering problems occur when people move away from source code dependencies with great tooling versioning diffs debuggers to other types of dependencies shared libs etc where the tools are nonexistent or very simple.now granted if you needed to fix a critical bug in the shared code that would require a redeploy of everything but that happens much less frequently than the need to deploy a single service with immunity as long as your keep your microservice contract. it also means the discipline of making sure every services is deployable at anytime is kept to.and if you didn't share code you probably wouldn't be fixing a single bug once you'd have much more code with many more bugs.;0
23020138;HackerNews;2020-04-29;it is probably too late to change the name. but you have a good point the micro prefix is highly misleading. furthermore there is little guidance in the literature on how big the microservices are.;0
23020131;HackerNews;2020-04-29;whatever monothlic or microservice it's all about modularity. monothlic or microservice is just the implementation on how you achive modularity.so the problem here to me is how you design the modularity for your system not how you implement it.;0
23020118;HackerNews;2020-04-29;as a researcher the monitoring and faultpropagation modeling work theyve done to get it to stay up at all is impressive but its not clear all of that tooling would be necessary if they didnt have to reason about n2 fault tolerance scenarios where n 100s of microservices. thats on the order of one fault tolerance scenario for each atom in the universe.that doesn't seem true. i would imagine that at netflix scale you probably have request tracing libraries that can give you a graph of service dependencies. whether it's worthwhile to consume that or easier to just let chaos monkey run rampant is another question.also i very rarely have issues with netflix. typically when i do i can just exit the stream and restart it. anecdata but i could count on one hand the number of times i've had a title just not play or netflix be down entirely.;0
23020009;HackerNews;2020-04-29;having read their articles a few times the issues that they were attributing to microservice architecture were really ci problems.;0
23019997;HackerNews;2020-04-29;there is now a single code repository and all destination workers use the same version of the shared library.what if i told you this is unrelated to microservices? you can keep all of their sources in the same repository sharing dependencies.;0
23019973;HackerNews;2020-04-29;i think we can have both architectures monolith and microservices peacefully coexisting with their own pros and cons.;0
23019962;HackerNews;2020-04-29;i dont know that you need to be much more disciplined to write a large application in a module way vs writing any application in a modular way. a monolith could definitely get messy though if you write them how i see people write microservices.;0
23019908;HackerNews;2020-04-29;i think this is actually one of the reasons that microservices became a thing to begin with teams wouldn't actually apply engineering best practices.microservices actually make you encapsulate your code at least within the microservices because you can't call out to it directly. they don't necessarily iforcei you to implement the single responsibility principle but they do a good job of pushing you. microservices implement a servicelocator pattern through dns or web routing one form of the dependency inversion principle. microservices make you pass data around as entities instead of active record instances.the price for this sort of thing is very steep though distributed systems are inherently icky harder to trace and more prone to failure and besides this you've added network overhead to each service call.i wish more engineering teams would consider spending half the effort of microservices on simply disciplining their monoliths. they might get somewhere...;0
23019903;HackerNews;2020-04-29;there is a related post on segment's blog which helps to get a bit more details and contextsupdate and related video;0
23019822;HackerNews;2020-04-29;by sheer number of attempts somebody probably got good results with microservices somewhere.netflix runs quite well in practice. i think they do redundant service calls what is the only minimally sane way to develop a distributed system. the funny thing is that i have never seen any serious discussion of redundant calls except for it being implicit on practical designs on the anecdotal how it works for us articles that pop once in a while. most times people won't even discuss redundant servers. i imagine everybody thinks it's obvious and well i would agree except for the fact that most people i see do not think so.but well netflix couldn't avoid having a distributed system so they aren't really representative for nearly anybody.;0
23019798;HackerNews;2020-04-29;conway's law is a physical law in the same sense as murphy's law.it's also obviously true. the organization builds the architecture. the architecture either helps or hinders the organization. the organization builds a new architecture. there's no indirect connection here. if you've seen hierarchical organizations implement microservices it's because that organization's complement was a microservices architecture. and likewise for a chaotic organization.well sidetrack aren't strongly hierarchical organizations the best suited for microservices? with all the strongly divided responsibilities and whatnot?;0
23019692;HackerNews;2020-04-29;you're right and i think you've highlighted what makes a good monolith so hard to build and maintain.you need to be disciplined to keep a monolith highly modularized. for microservices in contrast their architecture encourages modularization.;0
23019688;HackerNews;2020-04-29;microservices working well is entirely about the team and my current group of teams works very well with the monolith pattern. a big part of this is because for business reasons not technical ones they frequently trade ownership of parts so if a service isn't well constrained it will be very quickly. we also have mature devops practices and engineers handle significant parts of devops themselves instead of just kicking the can.but the reason i say this is about the team is because i've seen a well built well groomed service be passed off to an outside team and immediately turned into a disaster. same service same business case just a team without the devops savvy and willingness to follow the patterns.netflix does some.. unusual things with microservices mostly with how they treat version rollovers. it's not bad or good but it looks different from how many other shops handle the same problem and it means asking the question is everything working? is extremely difficult but asking the question how many people are able to start watching? is pretty easy.;0
23019634;HackerNews;2020-04-29;are there any case studies where microservices went well?you answered your own question with netflix. while you're right that it's not clear netflix would've needed to develop their chaos monkey tooling and the like it's not clear at all at that an equivalent system is possible as a monolith. even if a monolithic netflix system were technically possible it's not clear if a monolithic system would be organizationally feasible either conway's law;0
23019619;HackerNews;2020-04-29;there was a period of time when service had a different meaning than microservice. a service traditionally may exist across bounded contexts and be almost a minimonolith whereas a strict microservice should touch very few data models and exist strictly in a bounded context.of course real life is messy and plenty of people realized writing small single purpose services was valuable and plenty of people build giant microservices that have nothing to do with the original term and are just badly constructed monoliths.;0
23019587;HackerNews;2020-04-29;they went to 50 services in a few months were applying the same policies across all services. it sounds like they didn't plan well enough and jumped straight into it without any good devops or infrastructure mindset. it was a disaster waiting to happen. this shouldn't be an article that people read and say oh im never using microservices. this should be an article people read and say wow that is exactly the right way to not break apart a monolith.;0
23019461;HackerNews;2020-04-29;there is nothing wrong with most developers working on and communicating about the entire code base. having teams work in silos is not a benefit. you're touting as a benefit what is one of microservices' gravest issues teams stop communicating beyond the surface level of their respective apis.;0
23019283;HackerNews;2020-04-29;microservice is not an organizational problem. microservices is a design problem. if you implement ddd domain driven design first to your application and then start to design the application around your ddd concept then it might work.but it's extremely hard even to do that. microservices simply complicates things if any of your domains need to share code with each other. many ddd paradigms exist to address this but none are practical. for example authentication related code. if one domain sets a cookie and the other one has to rely on that to keep the user a shared model between the two domains authenticated then this means you need to duplicate code bases across two domains or in the very least put them into some sort of shared helperlibrary which ddd is kind of against.that's why it totally makes sense to go monolith first and really identify the parts of your application that are slowing you down either development wise testing wise or performance wise and put them into separate contexts.phoenix actually does microservices right. from all the way to scaffold generation to instructing best practices on keeping your domains properly separated. but even then i've burnt my finger many a times trying to write simple cms solutions into mutliple microservices then going back to monoliths again.;0
23019280;HackerNews;2020-04-29;i totally agree with you.i think this article is more evidence against the credibility of multirepo than against microservices.anecdotally my current place of work has grown to about 200 engineers maintains a monorepo and hundreds of deployed cron jobs adhoc jobs and microservices. we have none of the problems discussed here. we invest maybe 20 eng weeks a year in monorepospecific tooling and perhaps another 30 eng weeks per year in microservicestooling.;0
23019096;HackerNews;2020-04-29;are there any case studies where microservices went well?from an end user perspective netflix runs in constantly degraded mod.from an engineering perspective they track number of successful stream starts instead of percentage of the time 100 of their services are working. thats a huge red flag.as a researcher the monitoring and faultpropagation modeling work theyve done to get it to stay up at all is impressive but its not clear all of that tooling would be necessary if they didnt have to reason about n2 fault tolerance scenarios where n 100s of microservices. thats on the order of one fault tolerance scenario for each atom in the universe.;0
23019069;HackerNews;2020-04-29;good monoliths are highly modularized. but it's a whole different thing to package up a module as a separately deployable unit for external public use external to your app that is not your company.i'm just curious to know when you said the easiest and most sensible thing to do is chunk out large parts of the project and put them aside as a microservice ... were these chunks separately deployable units for external public use.;0
23018911;HackerNews;2020-04-29;the micro in microservices implies excessive factoring. otherwise theyd be services.;0
23018790;HackerNews;2020-04-29;microservice implies systems that are decoupled for deployment purposes. for example microservice a could restart to a new version while microservice b keeps running. this is a more complicated interaction contract than services where their deployment is coordinated in concert.;0
23018780;HackerNews;2020-04-29;conway's laws isn't a law it's just an interesting thought experiment. organization and architecture bidirectionally effect each other but not directly and not completely. i hate how current discourse invokes these different laws as if they are physical properties of the universe. i've worked at places with a strong hierarchical organization that created a wonderful set of micro services and i've worked at places with a chaotic environment that developed monoliths.there are shitty hierarchies and shitty flat organizations just like there are shitty monoliths and shitty microservices.sorry if you actually agree with this more nuanced view it's just that i've seen conway's law invoked more than once in this discussion and it drives me bonkers. i get the same way when someone medium developers i call them more than green but less than seasoned who swallow everything the read on medium as gospel and run around ing it zealously ed liskov substitution principle at me as if it was one of newton's laws.;0
23018723;HackerNews;2020-04-29;i agree with you but i find some value in people using that term it signals to me that i should consider the the architecture was prematurely splitup and could suffer from the various pitfalls associated with microservices.;0
23018714;HackerNews;2020-04-29;mmmmyes and no. depending on the size of your project that may not be the case. i've had to work with two titans of monoliths maintained by relatively small teamsanywhere between 2 and 67 people for several million lines of code. at some point managing a codebase this big within a single project becomes a huge burden for both developers and even more so for those who develop and do codereviewsfirst hand experience right here. at times i've spent 3 weeks straight doing code reviews with 2 notebooks filled with notes and diagrams of the different components inside the code. and at that point the easiest and most sensible thing to do is chunk out large parts of the project and put them aside as a microservice with the adequate amounts of tests. for small projects microservices make little absolutely no sense. but in the case of something the size of adwordswhich my two such experiences can be compared to you are playing with a raging lion if you decide to go monolith.my argument here is that it's not so much the size of your team but rather the size and scale of your project that needs to be taken into consideration.;0
23018711;HackerNews;2020-04-29;in general yes.everyone seems to have their preferred style of coding and it is an easy defence mechanism when presented with anyone who tries and finds it wanting to say that well they didn't do it properly.you find that with microservices vs monolith strong types vs weak types exception handling vs results agile vs waterfall.people fragment into camps which turn into echo chambers and it's easy to dismiss anyone who doesn't commit to that cult as being unpure and not worthy of being in the cult anyway.;0
23018618;HackerNews;2020-04-29;while that is true a microservices architecture can and in my opinion should rely on messaging and account for message schema evolution. dependencies between services should be way less coupling than dependencies between an application and a library.;0
23018600;HackerNews;2020-04-29;what is your alternative?aggressively small teams with no handsoff middlemanagement layer.you can build massive capability around a small number of wellmanaged messagebackbones and a single codebase. by keeping the number of hands small and the structure flat you force high standards. skilled staff won't tolerate distractions caused by bad engineering or inadequate automation.heuristic for analysing firms who has strategic power in decisionmaking? conventional answer a group of handsoff middlemanagers who run on meeting tempo and who are valued by how many people and systems report into them. under ast an engineering effort running on maker tempo in cooperation with a handson sales effort.microservices tend to have multilateral contracts with other systems in the organisation. this steers all planning towards meetings. this creates middlemanagement bloat.;0
23018418;HackerNews;2020-04-29;so like monoliths vs microservices it's probably a balance between the two leaning heavily in one direction.i've never understood why it needs to be eitheror. is it really that difficult to support a microservice deployment that only represents 50 or even 2025 of the orgproject?;0
23018404;HackerNews;2020-04-29;that's not what the person you are replying to said though the organizational structure is wrong. more like it is a mistake to use microservices unless you have a certain organizational structurecapacity already.i think they were saying something more aligned with your opinion than you read it as.;0
23018326;HackerNews;2020-04-29;i agree. i hate the term microservice for the same reason i hate superlative infected clickbait titles. there's no need for half of the word to exist. service. what's wrong with service?;0
23018020;HackerNews;2020-04-29;2 pizza team?well finally i might get my own microservice after all.;0
23017867;HackerNews;2020-04-29;microservicearchitecture is one of these trends where the value is unproven the upfront costs are high and the unknowns are unknown.there's also a clear conflict of interest with saas and cloud providers benefiting from the perception that microservices are the way to go.under these circumstances letting isomeone elsei figure out all the issues is the wise thing to do. thanks to the authors for doing just that.;0
23017849;HackerNews;2020-04-29;ime it is always environmental factors.when you have 200 developers working on the same product without well defined boundaries it will be a mess with a monolith and a mess with microservices.also arbitrary rules such as one service per team or one service per employee that force engineers to jerryrig things that don't belong together. either allow them to make a new service make or a new team or admit that microservices are not singlepurpose and are just a blob of multipurpose code. i've seen this way too much.also pure organizational inertia working against good engineering practices sometimes a team will be severely overworked while others are overstaffed. but god forbid there's a temporary reorganization to improve the work of engineers so people send tasks to other teams but there's minimal communication between engineers.;0
23017829;HackerNews;2020-04-29;microservices that suffer from shared code changes are not really microservices but a distributed monolith instead.in other words if you can share a lot of code between services a monolith is actually an appropriate architecture.;0
23017785;HackerNews;2020-04-29;if the microservices are in a single repo and tested and deployed together then they are arguably no longer microservices but a distributed monolith!;0
23017726;HackerNews;2020-04-29;because if you share something like auth for example you should have microservice for that. the question is not about duplicate code but about duplicate libraries that handle the same thing. decoupling the auth process into separate microservice removes the bottleneck.;0
23017712;HackerNews;2020-04-29;also a proper solution for true fault isolation would have been one microservice per queue per customer but that would have required over 10000 microservices.i'm a bit confused they seem to imply that they need a microservice per costumerdestination but you generically have one instance aka process per costumer not an entire separate codebase. the article seem to use the same term for two different concepts. or i am missing something?;0
23017708;HackerNews;2020-04-29;reinventing all parts for every microservice sounds wasteful to me. especially if they handle the same data andor use the similar business logic.;0
23017705;HackerNews;2020-04-29;i agree.writer michael feathers has an article where he suggests that microservices are a replacement to encapsulation all we have to do it use encapsulation well.;0
23017654;HackerNews;2020-04-29;without knowing more about their architecture it is difficult to comment beyond the conclusion alexandra noonan came to stated at the beginning of the article. it looks like to me that the architectural assumptions were changing too quickly due to the demands of a fast growing business. having all their code in a single repository means that they can control dependencies versioning and deployment centrally it gives them central control of their software development lifecycle. i can't see how they could not have had the same benefits of the monolith if their microservices existed in a single repo to begin with and had the appropriate tooling to enforce testing versioning deployment across all services in the repo. i guess this is the whole monorepo debate and tooling.this article for me is more about the complexity of managing a large team across different sites where the architecture needs to change rapidly when modularity is absent. they did get a measurable benefit around performance though. i wonder if alexandra will comment on the challenges of running a team in an environment of this complexity?;0
23017630;HackerNews;2020-04-29;even then this is risky if that developer is hit by a bus do you throw the service away and have another developer write it again?we recently had an interview candidate say this when we questioned the wisdom of having over a thousand microservices some in languages that only the one developer maintaining them used! for me this is insane but i digressmonzo says that they have 800 people and 1500 services. if we're generous and say 500800 are developers then each developer is responsible for 3 services! a team of 6 would have 18 projects in their domain.;0
23017615;HackerNews;2020-04-29;shared libraries were created to provide behavior that was similar for all workers. however this created a new bottleneck where changes to the shared code could require a week of developer effort mostly due to testing constraints.that is a big red flag. microservices that suffer from shared code changes are not really microservices but a distributed monolith instead.;0
23017594;HackerNews;2020-04-29;noo! building teams around software components cements your architecture and prevents most crosscutting improvements.i'll claim that splitting a wellstructured monolith into microservices will always make it less maintanable but it might be worth it if you need to for some reason like elasticity or failure tolerance.but for the love of god keep the design open. don't tie the existence of internal software components to peoples livelihoods.;0
23017589;HackerNews;2020-04-29;yeah the problem with microservices is because the organisation structure is wrong. ive literally heard every excuse about microservices at this point. my architecture is better but it doesnt have a snappy name its called the smallest possible number of services that can be reasoned about and network partitions are not necessary to create bounded contexts in a codebase often just a directory is fine.;0
23017577;HackerNews;2020-04-29;iyou could still do microservices and still fail to deal with conways law.ithat's what the poster suggests happened. nowhere do they suggest that microservices are overall required.;0
23017564;HackerNews;2020-04-29;a team that fails to understand how to write modular code is just going to write spaghetti rpc callsthis is interesting. i always assumed we were talking about good developers here.i wonder what's a more likely cause for a failed attempt at microservices. is it developer incompetence and lack of discipline or is it environmental factors related to the product and the organization?;0
23017549;HackerNews;2020-04-29;with microservices there's no way around it as there's additional overhead when splitting a for loop between multiple services. won't stop people from jumping on the bandwagon though.;0
23017541;HackerNews;2020-04-29;yes i dont think that you need microservices to be able to tackle conway's law. at least it doesnt have anything to do with each other.you could still do microservices and still fail to deal with conways law.;0
23017521;HackerNews;2020-04-29;this is why i struggle with microservice architectures. it seems like there is a basic contradiction. on the one hand it's vitally important that the microservices are carved into the correct modules otherwise you get a nightmare of operational complexity where simple functional changes require coordinated changes across multiple services. but defining the correct way modules requires a bird'seye architectural view of the entire system which seems contradictory to idea of selforganizing independent teams. i can see how it works when the right way to divide things up is obvious or when you are dealing with iaas or paas services but in a complex business domain who decides how to carve things up?;0
