ID;Source;Creation Date;Content;Sentiment
23017160;HackerNews;2020-04-29;Title:Why Segment Went Back to a Monolith, Content: https://www.infoq.com/news/2020/04/microservices-back-again/;0

23067252;HackerNews;2020-05-04;on the other hand if a memory leak concerns one key microservice your whole operation is also likely to suffer even if 99 of services run fine.;0
23060927;HackerNews;2020-05-03;this thread considered an issue whether services and microservices are equivalent concepts. they are not. there is a quality that is held by microservices yet which is not universally held by services.you have observed that other services also have that quality. indeed. nowhere did i say all services with decoupled deployment are microservices.;0
23040980;HackerNews;2020-05-01;like computer lib dream machines where you flip it over backwards to get the other book! and of course the microservices section should be really thin while the monolith section is extremely thick.like popedotninja pointed out you can just flip the book over when one approach starts to peak. vcf east xi ted nelson ted nelson designed the xanadu hypertext software and wrote the twoinone personal computing book computer lib dream machines in 1974. his work deeply influenced the personal computing revolution. ted earned two ph.d.s and penned several other wellregarded academic papers and books about ethical historical and moral issues in computing. computer libdream machines is a 1974 book by ted nelson printed as a twofrontcover paperback to indicate its intertwingled nature. originally selfpublished by nelson it was republished with a foreword by stewart brand in 1987 by microsoft press.in steven levy's book hackers computer lib is described as the epic of the computer revolution the bible of the hacker dream. nelson was stubborn enough to publish it when no one else seemed to think it was a good idea.;0
23040882;HackerNews;2020-05-01;maybe it's because you weren't able to explain why you thought microservices can be really bad or your explanation didn't hold water. so what was the explanation you gave them or do you not want to say?or perhaps there are other reasons you're simply not recognizing? like your sarcastic tone?;0
23032345;HackerNews;2020-04-30;it seems like a lot of the issues were around sharing code and libraries resulting from isolated codebases per service and the versioning hell of shared libraries.i work in a org that migrated to microservices over time but intentionally adopted a monorepo approach as part of it. it works quite well and seems to avoid a lot of the pain points expressed here while also gaining the benefits of microservices.there are definitely tradeoffs to the monorepo approach. it makes development on shared libraries more delicate and stressful however this can be mitigated by more robust crossservice ci and i definitely think it's a worthwhile tradeoff to the painful cycle of shared lib versions diverging across services and finding issues when some service finally gets around to upgrading its version weeksmonths after shared lib changes.;0
23030086;HackerNews;2020-04-30;often they didnt. how many stories have we all heard about wow.. transitioning to microservices was way harder than we expected followed by a move back to monolith instead of fixing the issues.that doesnt mean a micro service architecture is wrong... just that you have to either learn from your mistakes or hire an amazingly talented team... that have learned from mistakes somewhere else.;0
23029303;HackerNews;2020-04-30;if you're up for a humoristic take on microservices you could have a look at this video;0
23027984;HackerNews;2020-04-30;the general view of microservices was largely invented out of thin air when you look at martin fowlers wiki or adrian cockcrofts presentations which were the originating popularizers of the term it was all a reasonable refinement of soa.but then youd get some that would make bizarre claims like a microservices must be under 100 lines of code. shrug;0
23026522;HackerNews;2020-04-30;where you can get into trouble is if the problem affects all your instances across the entire cluster. if all your organization's code is running in the same process if any of that code has a severe memory leak or other serious issue it could impact the stability of everything else.not to say that wouldn't happen for spof microservices e.g. your auth servers but the surface area is potentially larger for monoliths.;0
23025177;HackerNews;2020-04-30;i dont think this is accurate. ive worked at companies that did serviceoriented architecture long before the rise of the term microservice and it was clearly recognized that different services shouldnt be so coupled together you cant redeploy them separately.;0
23025121;HackerNews;2020-04-30;my org is starting to migrate from a php monolith to microservices as a way of freeing ourselves from php.microservices will require more time spent writing interservice apis and code execution will be slower since many procedure calls will require data serialization and network requests. but we believe it will be worth the overhead to not be locked into php for every new component of the project.;0
23024884;HackerNews;2020-04-29;honestly that sounds like the devops team didn't communicate well with the business when they pitched them microservices. the business can't reasonably know that moving to microservices entails a change in infrastructure and toolingyou have to build that into your high level estimates.;0
23024606;HackerNews;2020-04-29;that advice of starting with a monolith has consistently been given by those involved in microservices since the start. i remember a fowler article in particular. unfortunately the if you only have a hammer everything is a nail analogy holds true when people start looking at where microservices may fit into an overall system architecture. their answer is invariably everywhere!really small reusableshareable and stable domains are the sweet spot for microservices. as you say that is most likely to come from decomposing from a monolith. microservices can really help with building rich domain components in an overall architecture and removing complexity from other components through delegation to the microservice is my experience. they just don't need to be everywhere.the same problem of overeagerness is becoming apparent with some of the movement to eventbased architectures. people become obsessed acolytes and there is no other way. when in fact they may well be ideal for a portion of your overall system architecture but are unlikely to serve it all well.;0
23024132;HackerNews;2020-04-29;like others have mentioned here simply pointing out examples where microservices have failed doesn't imply that microservices can't succeed. i've attempted to bake bread twice and they both failed. i didn't conclude that baking bread can't be done but that my skills to do it were insufficient.there are lots of examples of successful companies using microservices but i believe the real problem is in defining what constitutes a microservice. most people call things microservices that are nothing of the sort. i can unequivocally say if you built a service that depends on other things being 100 available like another service than you haven't built a microservice ie those things you built shouldn't be called services.by that token autonomy is a pretty important factor. the udi dahan teachings currently available for free promote this style of architecture. a concrete example of a toolkit for building itruei microservices can be found in message db andor eventide i wouldn't suggest however that anyone can just watch the course pick up these tools and succeed. like baking a good loaf of bread it takes a lot of skill work and experience. whether or not you succeed at building microservices is ultimately up to you and your team.;0
23023922;HackerNews;2020-04-29;that may sound cynical but if we agree that software development is a show bet entertainment whatever for investors in 99 then microservices are good to keep people excited.;0
23023590;HackerNews;2020-04-29;i mean you admit it yourself far too often the splitting off is inappropriate. normally an inappropriate microsservices is a net negative over all that costs you money in the long run. just because its working doesn't mean it is efficient.my last two assimilations where because one microservice was written in java. the original guy left and no one around the company likes to touch java or pretend they don't knowdo it which means it was alaways me who had to update it. it was a very small service likely why he thought small micro! but it was about 3 hours of work in the monolith. now anyone can updatecontribute to it and not bug me every timethe other was a microservice that only served the monolith. new features required the monolith to be updated in order to realize the new features.;0
23023521;HackerNews;2020-04-29;sharing databases across services micro or not is generally a pretty bad ideai don't think such a blanket statement is justified. there are plenty of situations where it may make sense to pull out some functionality into its own serviceso it can be written in a different language scaled independently isolated from failures or whateverbut where giving that service its own separate database would be serious overkill complicating ops and introducing potential data integrity issues for no real benefit.if your deployment relies on synchronized service deployments you really dont have independent services at all.so what? that's really the point blindly following the microservices tm doctrine is often a mistake. it's better to just solve whatever problem you're facing in the simplest possible way. while that imayi mean bythebook microservices with independent databases in many cases something in between is a better choice.;0
23023424;HackerNews;2020-04-29;another aspect no one seems to talk about is whether your deployment is monolithic or fragmented. it seems like a lot of the pain of managing microservices comes from designing a coherent cicd pipeline how to share libraries between various microservices etc. if you have a monorepo good build tooling and a good infrastructure as code tool i think much of that pain goes away but none of those things are easy and the precise selection and combination of tools depends a lot on your organization i wouldn't recommend bazel or nixbuild toolsto a small or mediumsized organization for example.;0
23023328;HackerNews;2020-04-29;it's also really hard. trying to determine how to split up any code base into logical divisions such that you when adding the next 5 years of functionality you'll have the fewest number of cross division processes is hard.this is why martin fowler recommends starting with a monolith and refactoring into microservices unless you have extensive experience building out very similar applications in the same domain.;0
23023251;HackerNews;2020-04-29;monolith microservices difficult refactoring i guess my point is that it doesn't have to be complicated if you architect the monolith carefully. that usually doesn't happen though because frameworks don't necessarily promote the practice and projects are short sighted.;0
23023040;HackerNews;2020-04-29;as it is so often the case the choice between monolith and microservices is not a binary one rather it is a sliding scale between two extremes.on one end we have a real monolith a single executable binary with no external dependencies apart from the os bindings. this is very rare in practice and most commonly found in games and probably mobile apps when it comes to webbased services even a traditional idea of singlecodebase app usually has a sql database as an external dependency.on the other end of the scale there is a complex system consisting of hundreds or even thousands 0 of tiny services that require complex orchestration mechanisms such as a service hub or service mesh.so each team in a wide sense could be a company organisation department etc needs to consider where they fall in the continuum considering a which architecture will provide most benefit while b still being maintainable by the team both the architecture and the team need to evolve together.0;0
23023008;HackerNews;2020-04-29;monolith microservices difficult refactoringmicroservices monolith difficult refactoringmicroservices with poorly chosen context boundaries microservices with well chosen context boundaries very difficult refactoring.;0
23022954;HackerNews;2020-04-29;if it's working well why change it?if your coworkers argument is just microservices bad then obviously they are making a mistake. but in the general i've seen far more frequent inappropriate splitting of monoliths than inappropriate combining of microservices. this is honestly the first time i've heard of it.;0
23022953;HackerNews;2020-04-29;this means you're effectively building a monolith with a microservice architecture. is that really what you want?i actually kinda do want that although maybe it's a niche thing.it would be nice to be able to deploy a monolith that's already cut at seams where there's an obvious api boundary. at one extreme you could imagine a single binary where processes communicate via rpc.what that would give you is an easy way to split off microservices as they're needed.i'm sure somebody has done work along these lines.;0
23022687;HackerNews;2020-04-29;as matt easton says context!i think 5 whys might be a useful exercise here.why was building x as a microservice faster? reason? well why was that?imy general rules for this are to always start in a monolith and break things out as they start to fail or break other parts of the codebase and don't go all in just because you now have one microservice that works well by itselfii like this. a key tactic is to always do things such that one can change one's mind!;0
23022373;HackerNews;2020-04-29;if you take a look at some of segment's open source code it isn't hard to see why they wound up struggling with microservices. it looks like they subscribe to the leftpad style of software development. they have tons of repositories that have less than 10 lines of code. they have a two line repository for calling ipreventdefaulti0 a four line repository for getting the url of a page1 and a eight line repository for clearing the browser state that calls into eight different packages2.disclaimer i run a segment competitor. i'm pretty biased but still...0 1 2;0
23022339;HackerNews;2020-04-29;i don't blame them microservices requires discipline careful planning in depth monitoring and debugging capabilities and whole different mindset. very few companies can implement it successfully.;0
23022290;HackerNews;2020-04-29;if microservices are implemented incorrectly or used as a bandaid without addressing some of the root flaws in your system you'll be unable to do new product development because you're drowning in the complexity.which is nearly verbatim what some of us have been telling you since before the term microservices was coined.coupling is the problem. yes microservices add friction to coupling but they don't prevent it. coupled microservices exist boy howdy and they're resource intensive resistant to evolution or both.;0
23022168;HackerNews;2020-04-29;monolith vs microservice feels like a higher level case of the expression problem.;0
23022148;HackerNews;2020-04-29;before going full microservices try writing your code in a hyper modularized way and see if this doesnt solve your problem first.;0
23022114;HackerNews;2020-04-29;i've found it most helpful to think in terms of deployments each microservice effectively gets deployed independently.one implication of this is you need to ensure your apis are backwards compatible with any other services even if it's only one service that your team also manages. this also includes databases if shared by multiple services which i won't get into suffice to say congrats your database schema is now also a crappy api.as soon as you start having concurrent deployment dependencies that is the updates for service a b ibothi have to be deployed at the same time or things are broken you've effectively built a monolith anyway just with an annoying code layout eg spread across multiple repositories.you can use orchestration to tie these deployments together but this means you're effectively building a monolith with a microservice architecture. is that ireallyi what you want?;0
23022037;HackerNews;2020-04-29;i am not saying thats how soa was defined just that it was used to refer to such team organization around architecture. ex iamazon famously uses a serviceoriented architecture where a service often maps 11 with a team of 3 to 10 engineers.i at the beginning microservice was generally viewed as more granular than soa though thats been backed off of.;0
23022024;HackerNews;2020-04-29;i have an idea. bring the concept of microservices into software!within software module interfaces that can only communicate with one another via socket like serial interfaces with no type checking!or simply have all your software modules running as forked processes on the same hardware and have them all communicate with one another via sockets or http. that means every software module must be it's own server!to further imitate microservices make sure that code in one software module can never ever be moved to another software module. make it hard to reorganize things. also make sure teams can only ever work on one section of the code base.does the above make any sense to you? if it doesn't make any sense to you it's probably because code organization using microservices doesn't make any sense period because the examples above are literally doing the same thing in software that is done in hardware.if it does make sense to you then why are you using microservices to add extra complexity to the code? if you can do the same in software then you'd be doing the exact same thing as the hardware equivalent minus the extra complexity of multiple containers or vms.don't use hardware to organize code use code to organize code and use hardware to maximize performance.;0
23021980;HackerNews;2020-04-29;at my current place of work we have1 monolith and 2 microserivcesworking in the monolith is fine but running tests is slow because it is a giant rails app that is 7 years old.there is 1 microservice that does its thing and the few people who need to interact with it like it.the second microservice was created deployed and abandoned. now people want to move it into the core monolith. it is a distinct unit of functionality that doesn't really have any overlap with the core app. i'm going through and adding all of the tooling to this project because it enables us to solve a certain class of problem report generation that the monolith can't do very well for a couple of reasons. articles like this have fueled the fire to recombine it but the pain points have nothing to do with this particular service being separate.;0
23021934;HackerNews;2020-04-29;a subroutine is a service.which makes the term microservice even weirder given that any microservice is going to be bigger than a single subroutine.;0
23021877;HackerNews;2020-04-29;i saw a talk with alexandra from segment before. when it makes sense to go with monolith it makes sense.when it makes sense to use microservices it makes sense.doing anything for no reason whatsoever never makes sense.that is all.;0
23021782;HackerNews;2020-04-29;microservices in terms of code organization was always a redundant concept.you can organize code with functions and namespaces why do you need hardware to segregate code? it only makes the segregation permanent but offers nothing else beneficial in terms of code organization.the underlying reasoning was always that developers tend to move outside of boxed software modules if it wasn't enforced by hardware so the modules will end up not being modules but everything will be blurred into monoliths.i always figured that if you want really hard lines drawn between software modules you can still do the same stuff in software itself like why do you need actual silicon or vmscontainers to do it?the only real need for different services is performance otherwise all the benefits and downsides of microservices can be replicated in software.;0
23021741;HackerNews;2020-04-29;i think microservices work well in organizations that are big enough to have a team per microservice.presumably by definition were talking about a few hundred lines of code or a couple of weeks development time here at most. what does this team do all day otherwise?;0
23021732;HackerNews;2020-04-29;we do separate code repos my last place did separate repos place before that did monoliths but still did separate repos for anything not in the same monolith. i'm pretty sure it's more common to do separate repos rather than monorepo for separate services.seems to me though the problem is people trying so hard to reuse code. that's the main problem cited in the article. people get really gungho about reusing code and creating shared libraries but reusing code is actually bad most of the time. you should strive to only depend on things that you can reasonably expect to not change and that you don't need to update even if a new version comes out. what you're supposed to do is take that code in the shared library and make it a microservice and obey the usual backwardforward compatibility rules.using a monolith hides that problem because the code remains easy to update and build but just as fragile and in need of heavy testing whenever you change code modules that have multiple consumers. that goes against the idea of monorepos as well.;0
23021714;HackerNews;2020-04-29;what's notably absent are descriptions of problems with versioning interfaces failures from network unreliability or problems managing connecting infrastructure or poor delineation of service boundaries leading to undesired change dependencieswhich is to say it seems like they executed well. there's no sign they fell into common pitfalls.there are definitely some good insights here that i don't often read about. the idea that with a sufficient number of microservices say 50 you not only treat your instances ascattlenotpets you have to treat the service types enmasse ascattlenotpets. this requires more automation and organized management as pointed out by the need for tuned autoscaling rules. this requires continued investment into automating things you would do manually if you had 50 services.the other thing to consider is that going to microservices and back to a monolith is not necessarily a failure. microservices are good for periods of high change velocity once a platform is mostly built requiring much less new development consolidation completely makes sense. at all points we're solving for impedance mismatch whether that's the org structure velocity of changes or numbers of developers vs numbers of deployed units.;0
23021580;HackerNews;2020-04-29;i see a lot of places that seem to either think that1. microservices will let them ship things faster or2. it's microservices everywhere or nothingmicroservices might let you ship faster if you are really good at deciding where to draw the lines between services and really good at managing multiple deployment pipelines and all the infra that's a pretty tough ask.also if you have a monolith it's perfectly fine to pull out one or two parts that need to scale much more efficiently and leave most of your codebase in the monolith but a lot of times i see companies think once you have created one microservice the monolith is now the worst thing possible and it needs to be broken up entirely.my general rules for this are to always start in a monolith and break things out as they start to fail or break other parts of the codebase and don't go all in just because you now have one microservice that works well by itself;0
